,artist,text
81295,Logic,Riding round the city with my homies blowing trees
81296,Logic,Wavy like the Seven Seas living life let me get it right
81297,Logic,Let me give it a minute to get up in it like a beautiful independent woman thats finna make you wait to smash
81298,Logic,Come now let me count this cash
81299,Logic,Come now let me sip this flask
81300,Logic,Pockets fat like shawty ass
81301,Logic,Jump in the whip gotta get this gas
81302,Logic,Put that shit in drive Im live like ammunition
81303,Logic,No permission needed I proceeded to accelerate
81304,Logic,Had days with hella hate but gotta let that anger migrate
81305,Logic,All this shit thats on my plate
81306,Logic,That food for thought that cant be bought
81307,Logic,But only taught and on the real know
81308,Logic,I cant get much higher been smoking that fire
81309,Logic,Riding round the city with my homies that know me
81310,Logic,Know that I cant get much higher word to my supplier
81311,Logic,While you break it roll it light it use that fire ignite it
81312,Logic,I cant get much higher been smoking that fire
81313,Logic,Riding round the city with my homies that know me
81314,Logic,Know that I cant get much higher word to my supplier
81315,Logic,While you break it roll it light it use that fire ignite it
81316,Logic,Nigga like we smoking all weekend
81317,Logic,And I roll and smoke when Im drinkin
81318,Logic,Tell them open that door but dont peek in
81319,Logic,We be havin a OG Kush meetin
81320,Logic,If we smokin that dope its a reason
81321,Logic,Eyes so low from the chiefin
81322,Logic,I be getting high when I wake up
81323,Logic,And roll me one more fore Im sleeping
81324,Logic,Man I be smoking so good that I be forgetting the past
81325,Logic,It dont even come to my house
81326,Logic,If it aint wrapped up in a turkey bag
81327,Logic,We roll up the herb and laugh kick back blow a zip
81328,Logic,Take it on a plane know I smoke the same when Im on a trip
81329,Logic,Nigga like me always got weed on em  got weed on em 
81330,Logic,Try to tell me that she dont smoke later on she joinin
81331,Logic,Aint no point no Im back keep going in
81332,Logic,You been rolling with cats who boring
81333,Logic,I be bringing them stacks enormous
81334,Logic,Section always in the back important
81335,Logic,Bad bitch gorgeous pack imported
81336,Logic,I cant get much higher been smoking that fire
81337,Logic,Riding round the city with my homies that know me
81338,Logic,Know that I cant get much higher word to my supplier
81339,Logic,While you break it roll it light it use that fire ignite it
81340,Logic,I cant get much higher been smoking that fire
81341,Logic,Riding round the city with my homies that know me
81342,Logic,Know that I cant get much higher word to my supplier
81343,Logic,While you break it roll it light it use that fire ignite it
81344,Logic,Uh yeah Im finna get up in the feeling
81345,Logic,Independent feeling like a boss
81346,Logic,Roll a little something smoke a little something
81347,Logic,Chiefin that Indica in the cut tell my anxiety to get lost
81348,Logic,Fuck a pill only numb the pain
81349,Logic,Man you know how much that shit cost 
81350,Logic,I aint talking bout your pocket
81351,Logic,No I am only talking about the mind
81352,Logic,When the cannabis combine with the brain
81353,Logic,It be like everything you see it seem to shine
81354,Logic,Smoking that Golden State everything going great
81355,Logic,Got a lot on my plate not a single complaint
81356,Logic,Stack of money in the bank
81357,Logic,This that RattPack and that Taylor Gang
81358,Logic,They know the face and they know the name
81359,Logic,Im a married man with a bad wife
81360,Logic,Never fuck around unless its Mary Jane
81361,Logic,Come play the game honestly never the same
81362,Logic,Just like my flow got one for every occasion
81363,Logic,Living the life so my life is amazing woo
81364,Logic,I cant get much higher been smoking that fire
81365,Logic,Riding round the city with my homies that know me
81366,Logic,Know that I cant get much higher word to my supplier
81367,Logic,While you break it roll it light it use that fire ignite it
81368,Logic,I cant get much higher been smoking that fire
81369,Logic,Riding round the city with my homies that know me
81370,Logic,Know that I cant get much higher word to my supplier
81371,Logic,While you break it roll it light it use that fire ignite it
81372,Logic,Yeah and if you dont know by now I smoke weed 
81373,Logic, Hahahaha  how Wiz gonna give me the verse
81374,Logic,He aint gonna give me the laugh though 
81375,Logic, Hahahaha  that shit iconic
81376,Logic,Yeah yeah yeah Indica Badu
81377,Logic,Ive upgraded while theyve waited
81378,Logic,Will they love it  Will they hate it 
81379,Logic,Cause I never really want to complicate it
81380,Logic,Think Ive made it yes I did
81381,Logic,Im giving them bars like a bid
81382,Logic,Let me rewind it like a vid
81383,Logic, Did he just say that  Yes I did
81384,Logic,And they really wanna get it like I live
81385,Logic,God damn mother fucker what I gotta give
81386,Logic,On the way to that everlasting life
81387,Logic,Will they rob you Yeah they might
81388,Logic,Hold up wait a minute veer to the right
81389,Logic,On this road to success Ive faced my fears
81390,Logic,My bitch bad got a sick figure
81391,Logic,Play  show and get  figures
81392,Logic,We build bigger money tall as a mountain bitch
81393,Logic,Ive got Hilfigers like goddamn
81394,Logic,Im that main man Martin out here kicking out Pam
81395,Logic,Just riding round with my Gina in that all black Beamer
81396,Logic,All the way from Maryland whipping out West Covina
81397,Logic,Hold up now check my demeanor
81398,Logic,Yeah your girl bad my girl meaner
81399,Logic,Ive got the Akira on the wall
81400,Logic,I just cant follow their law
81401,Logic,Swear to God that they know me
81402,Logic,And its all right its alright
81403,Logic,Let me bring in them new kicks like Timbaland
81404,Logic,I gotta reboot with this upgrade
81405,Logic,And the meaning behind them is so vague
81406,Logic,Before I created this universe
81407,Logic,I had to fly through the Bermuda first
81408,Logic, ix on the beat then we queue the verse
81409,Logic,Now Im in another world when the flow emerge
81410,Logic,Feel like Im in a Fifth Element
81411,Logic,Im in my element lost in paradise
81412,Logic,Its me you and Leeloo Korben Dallas in Fhloston Paradise
81413,Logic,Never by chance like a pair of dice
81414,Logic,I dont give a fuck about their advice
81415,Logic,Im on another planet no Im not manic
81416,Logic,Bitch Im decompressed know they cant stand it
81417,Logic,Cause I pilot it and manned it the best
81418,Logic,All they demanded was I gave up and laid dream to rest
81419,Logic, God damn  Hold up wait a minute fuck all that shit
81420,Logic,I left Earth ages ago to avoid and duck all that shit
81421,Logic,Making music thats gon survive for eons
81422,Logic,Bloodshed from America to Sierra Leone
81423,Logic,Thats that shit I cant be on thats the reason I be gone
81424,Logic,Yes I keep it professional like Luc Besson and Leon
81425,Logic,Sometimes I fantasize about traveling space and time
81426,Logic,I think about specific moments that I could rewind
81427,Logic,Not to redo it but relive it I could give it one more go abide
81428,Logic,And truly understand the deeper things
81429,Logic,Now take a trip with me and vibe
81430,Logic,Im on this interstellar mission is you down to ride 
81431,Logic,Hold up I know this innermission feeling like the tribe
81432,Logic,Life is beautiful Im so lucky to be alive
81433,Logic,Im gonna take this moment right now
81434,Logic,Here and school them people
81435,Logic,I know deep in my heart everyone is created equal
81436,Logic,I truly wish that I could see the sequel of our people
81437,Logic,Truly wish that I could check it
81438,Logic,Now when I hit the road and tour the world
81439,Logic,I see like different light this music shit just aint the world
81440,Logic,Brothers and sisters from different mothers and misters
81441,Logic,All different colors and creeds all come together for me
81442,Logic,Boy Im blessed to be free uh
81443,Logic,Still Im looking back let me rewind
81444,Logic,Dont let me lose my faith let me rewind
81445,Logic,On the front of this bus Im busting my mind open
81446,Logic,Hoping these lyrics will keep me coping
81447,Logic,On the grind like copin no time to bring the dope in
81448,Logic,But this Nyquil got me feeling lit
81449,Logic,Its been like  months since Ive been home
81450,Logic,Sometimes it feel like forever just how long I been gone
81451,Logic,Yeah you know thats the shit that I been on
81452,Logic,You know I love it feel like theres never enough of it
81453,Logic,Chilling watching Tarantino we know Ive been on it forever
81454,Logic,My endeavor like a feature film
81455,Logic,Step into the realm of the realest do you feel this 
81456,Logic,Im in it my limit the chillest
81457,Logic,Yeah I woke up early on my born    its a blessing
81458,Logic,Progression everyday lessons got me stressing
81459,Logic,But Im testing reminiscing
81460,Logic,When I would listen to my intuition
81461,Logic,And now I made it resurrecting
81462,Logic,Young Sinatra I created Im elated
81463,Logic,It seem like everyones somehow related
81464,Logic,Letters back and forth from my homie
81465,Logic,Doing    its been   I know my hearts with him
81466,Logic,Ive been so busy it feel like forever since I hit him man
81467,Logic,I think about how I wasnt shit when he went in
81468,Logic,What if the tables was turned
81469,Logic,And I was the one that been in damn
81470,Logic,He said hes seen me in the magazine
81471,Logic,He said hes seen me on Fallon and Kimmel
81472,Logic,Thats been my dog from the kennel
81473,Logic,I never thought that out the millions watching he was one
81474,Logic,It makes me reminisce about the times when we begun
81475,Logic,Skipping class with all of my homies
81476,Logic,On a constant search for who I was
81477,Logic,I rarely went to school they wonder why and thats because
81478,Logic,My situation at home was alcoholics and drugs
81479,Logic,I never graduated but I made it to the summit
81480,Logic,Dont get me wrong so many times
81481,Logic,I thought that I would plummet
81482,Logic,Felt like I didnt have the heart and couldnt seem
81483,Logic,To stomach all of the beef around my way
81484,Logic,I mean I never wanted to live a life
81485,Logic,Where all youre truly living is a lie
81486,Logic,I knew I always wanted more
81487,Logic,And so they wonder why I said they wonder why
81488,Logic,Still Im looking back let me rewind
81489,Logic,Dont let me lose my faith let me rewind
81490,Logic,So what do you think about space 
81491,Logic,Um space is called the galaxy   
81492,Logic,What are can you name some planets off 
81493,Logic,Yeah theres a one named Saturn and Earth
81494,Logic,Mars and the planet Paradise
81495,Logic,Youve never been there before 
81496,Logic,Um no I was little a long time ago with my mom riding in the coolest ship My TV showed us where we are in space 
81497,Logic,But there was droid ships everywhere   
81498,Logic,Well thank you for your time sir
81499,Logic,I appreciate the interview   
81500,Logic,The tunes on here That shit sound good
81501,Logic,Bryson gotta hurry up and send me this verse
81502,Logic,Bitch Ive been blowin up  bitch Ive been blowin up 
81503,Logic,Everyone showin up where was you in the beginnin  in the beginnin 
81504,Logic,I know that they showin up  know that they showin up 
81505,Logic,Only come around and fuck with me when the boy winnin  when the boy winnin 
81506,Logic,No you do not know enough  you do not know enough 
81507,Logic,You do not know a thing about this life that Im livin  life that Im livin 
81508,Logic,Youve never been low enough  never been low enough 
81509,Logic,Yeah I was born at the bottom  yeah yeah yeah 
81510,Logic,Bitch Ive been blowin up  bitch Ive been blowin up 
81511,Logic,Everyone showin up where was you in the beginnin 
81512,Logic,I know that they showin up  know that they showin up 
81513,Logic,Only come around and fuck with me when the boy winnin
81514,Logic,No you do not know enough  you do not you do not you do not 
81515,Logic,You do not know a thing about this life that Im livin
81516,Logic,Youve never been low enough  never been low 
81517,Logic,Yeah I was born at the bottom  yeah yeah yeah 
81518,Logic,Bobby tell me who really bout it
81519,Logic,Bitch I doubt it not a single person work harder than Bobby
81520,Logic,Just wrote a novel starrin in a movie
81521,Logic,Built another business while you at the party
81522,Logic,Aint one to flex but yeah Im finna flex
81523,Logic,I just parked that new i right next to the Audi
81524,Logic,Copped that G Wagon right there for my shawty
81525,Logic,Yeah now they know the name yeah they know Bobby
81526,Logic,Yeah get it like get it like get it like get it like me nah
81527,Logic,Handout palm up you cannot get this shit here for free nah
81528,Logic,Bobby done put in that work you gon pay me a fee nah
81529,Logic,I said Bobby been livin that life and you know I said   
81530,Logic,Bitch Ive been blowin up  bitch Ive been blowin up 
81531,Logic,Everyone showin up where was you in the beginnin  in the beginnin 
81532,Logic,I know that they showin up  know that they showin up 
81533,Logic,Only come around and fuck with me when the boy winnin  when the boy winnin 
81534,Logic,No you do not know enough  you do not know enough 
81535,Logic,You do not know a thing about this life that Im livin  life that Im livin 
81536,Logic,Youve never been low enough  never been low enough 
81537,Logic,Yeah I was born at the bottom  yeah yeah yeah 
81538,Logic,Bitch Ive been blowin up  bitch Ive been blowin up 
81539,Logic,Everyone showin up where was you in the beginnin 
81540,Logic,I know that they showin up  know that they showin up 
81541,Logic,Only come around and fuck with me when the boy winnin
81542,Logic,No you do not know enough  you do not you do not you do not 
81543,Logic,You do not know a thing about this life that Im livin
81544,Logic,Youve never been low enough  never been low 
81545,Logic,Yeah I was born at the bottom  yeah yeah yeah 
81546,Logic,Most of these people cant never ever comprehend all the shit that Ive seen
81547,Logic,I am polite than a mothafucka but when I grip that mic I get mean
81548,Logic,Come now you know what I mean
81549,Logic,Pepe done got the boy lean
81550,Logic,Yeah you could doubt me say what you want bout me
81551,Logic,I do this shit for the team shit for the squad
81552,Logic,Im livin the dream yes I am livin the dream
81553,Logic,Hold up wait up just cant believe
81554,Logic,Just cant believe that my swag is on another level
81555,Logic,Matter of fact I keep it I keep it I keep it I keep it M
81556,Logic,Turn that shit upside down now its a W
81557,Logic,No no aint nobody fuckin with him
81558,Logic,Dont matter who come stand next to me
81559,Logic,Once Im surrounded aint nobody fuckin with them
81560,Logic,I am the best of the best of the best
81561,Logic,Of the best of the best of the best like Men In Black
81562,Logic,Greatest alive bitch Ive been that
81563,Logic,If you dont agree you get kidnapped
81564,Logic,Bitch slapped thrown back like woo 
81565,Logic,Yeah get it like get it like get it like get it like me nah
81566,Logic,Handout palm up you cannot get this shit here for free nah
81567,Logic,Bobby done put in that work you gon pay me a fee nah
81568,Logic,I said Bobby been livin that life and you know I said   
81569,Logic,Bitch Ive been blowin up  bitch Ive been blowin up 
81570,Logic,Everyone showin up where was you in the beginnin  in the beginnin 
81571,Logic,I know that they showin up  know that they showin up 
81572,Logic,Only come around and fuck with me when the boy winnin  when the boy winnin 
81573,Logic,No you do not know enough  you do not know enough 
81574,Logic,You do not know a thing about this life that Im livin  life that Im livin 
81575,Logic,Youve never been low enough  never been low enough 
81576,Logic,Yeah I was born at the bottom  yeah yeah yeah 
81577,Logic,Bitch Ive been blowin up  bitch Ive been blowin up 
81578,Logic,Everyone showin up where was you in the beginnin 
81579,Logic,I know that they showin up  know that they showin up 
81580,Logic,Only come around and fuck with me when the boy winnin
81581,Logic,No you do not know enough  you do not you do not you do not 
81582,Logic,You do not know a thing about this life that Im livin
81583,Logic,Youve never been low enough  never been low 
81584,Logic,Yeah I was born at the bottom  yeah yeah yeah 
81585,Logic,This is real life the only one we get to live
81586,Logic,I remember being broke and thinking something gotta give
81587,Logic,This is real life everything we do is legendary
81588,Logic,And we gon do it to the day we in the cemetery
81589,Logic,Real life it feel like Im dreaming
81590,Logic,Used to feel like I was nothing now my life has meaning
81591,Logic,Said this is real life goddamn this is real life
81592,Logic,Yeah Ive been fiending for this moment
81593,Logic,Ive been dreaming bout this moment
81594,Logic,I guess this is how it feel to have everything you ever wanted
81595,Logic,Writing these records like a dissertation
81596,Logic,While the fans goin crazy from anticipation
81597,Logic,Damn nine years thats a lot of patience
81598,Logic,And now Im looking at my idols and feeling adjacent
81599,Logic,Its hell of a long way from back in the basement
81600,Logic,Looking at hip hop tryna find my placement
81601,Logic,I bought my first pair of Jordans at   
81602,Logic,Same year I bought a crib too
81603,Logic,Now my face in magazines I used to flip through
81604,Logic,And my music on all the sites I used to sift through
81605,Logic,Remember meeting Nas for the first time
81606,Logic,Shook his hand and he started quoting my lines
81607,Logic,Said he a fan goddamn this is my time
81608,Logic,Ima get it Ima do it till we prime time
81609,Logic,I told him every single day that I be at it
81610,Logic,In the studio recording like an addict
81611,Logic,He said that real hip hop shit I had it
81612,Logic,Thinking to myself  Damn man you made Illmatic 
81613,Logic,This is real life the only one we get to live
81614,Logic,I remember being broke and thinking something gotta give
81615,Logic,This is real life everything we do is legendary
81616,Logic,And we gon do it to the day we in the cemetery
81617,Logic,Real life it feel like Im dreaming
81618,Logic,Used to feel like I was nothing now my life has meaning
81619,Logic,Said this is real life goddamn this is real life
81620,Logic,I used to wonder what it feel like
81621,Logic,Aight I guess we back again
81622,Logic,With another verse about how much Im black again
81623,Logic,You dont like it blame God for the packaging
81624,Logic,Bringing up my race dont call me a white rapper then
81625,Logic,Damn they judging me by my skin tone
81626,Logic,Instead of my talent man these motherfuckers been wrong
81627,Logic,But its all good I just thought Id address it
81628,Logic,And spell it out for people so they can finally assess it
81629,Logic,This is dedicated to anyone with a dream
81630,Logic,And a realization of what following it means
81631,Logic,Breaking the cycle and not following your genes
81632,Logic,That perfect moment when your logic intervenes
81633,Logic,And let you know that everything aint always what it seems
81634,Logic,But if you really looking I promise youll find your dreams
81635,Logic,This is everything I ever wanted half of yall wont get it
81636,Logic,The other half will probably laugh and wonder how I did it
81637,Logic,I just spit it from my mind one word at the time
81638,Logic,Take everything Im going through and put it in a rhyme
81639,Logic,Id be lying if I said I didnt have a lot of weight upon my shoulders
81640,Logic,But this is my therapy as I flow this
81641,Logic,Spilling out my heart I just hope somebody notice
81642,Logic,Ive been real from the start and you motherfuckers know this
81643,Logic,Once my name elevated thats when the fame escalated
81644,Logic,But on the real Ive grown accustomed to the stares
81645,Logic,People watching every move I make like it was theirs
81646,Logic,All up in my business and even in my personal affairs
81647,Logic,Now I know I talk a lot of game but I aint trynna sell you
81648,Logic,Cause honestly I could show you better than I could tell you
81649,Logic,And even though theres been moments when everything have fell through
81650,Logic,We kept it moving assuming even the greatest fail too
81651,Logic,I swear this business shit is do or die
81652,Logic,I never contemplated suicide Im too alive
81653,Logic,In front of thousands but Im talking like its you and I
81654,Logic,And everyday fewer find their dreams because fewer try
81655,Logic,This is real life the only one we get to live
81656,Logic,I remember being broke and thinking something gotta give
81657,Logic,This is real life everything we do is legendary
81658,Logic,And we gon do it to the day we in the cemetery
81659,Logic,Real life it feel like Im dreaming
81660,Logic,Used to feel like I was nothing now my life has meaning
81661,Logic,Said this is real life goddamn this is real life
81662,Logic,Everything I seen made me everything I am
81663,Logic,Everything I do Im a man behind mine
81664,Logic,Throw your hands in the air stand behind mine
81665,Logic,Everything I seen made me everything I am
81666,Logic,Everything I do Im a man behind mine
81667,Logic,It s funny how your role model gets outdated becomes the old model
81668,Logic,At the hotel asking for mo bottles
81669,Logic,M nage et plus one  I m fucking fo models
81670,Logic,Wordplay that elevates minds like Aristotle
81671,Logic,Murci lago whipping through Chicago
81672,Logic,All these beautiful women follow wherever I go
81673,Logic,Million dollar deals on the table
81674,Logic,Just a couple years ago I couldn t pay for cable
81675,Logic,Growing up surrounded by caine like I was Abel
81676,Logic,Shit was unstable now Visionarys the label
81677,Logic,Plus Def Jam know who I am
81678,Logic,I m that motherfucker that do it just  cause I can
81679,Logic,Now I m on a level that your elevator can t reach
81680,Logic,I ve got information that the school system doesn t teach
81681,Logic,Ive got verses that your Sunday service wouldn t dare to preach
81682,Logic,Second coming of Christ flow they like  Whoa  
81683,Logic,Rapture you with lyricism kidnap your soul
81684,Logic,And changed your mind like I m penetrating your skull
81685,Logic,I seen shit John Lennon couldn t imagine
81686,Logic,Just me and a mic on a main stage spazzing
81687,Logic,It s the type of shit normal people can t even fathom
81688,Logic,So much swag kiss your bitch and she orgasms
81689,Logic,I m hazardous you would have sworn I was from Nazareth
81690,Logic,I m resurrecting hip hop like it was Lazarus
81691,Logic,Step to the mic and they gon dread it like Weezy
81692,Logic,Man this industry is so damn greasy
81693,Logic,Swaggin on the track they say I sound like Yeezy
81694,Logic,But I dont give a fuck cause gettin money too easy
81695,Logic,  st century doing something mean to it
81696,Logic,Play this in the south and everybody gonna lean to it
81697,Logic, Greatest of all time has got a nice ring to it
81698,Logic,We do it for the music money aint a thing to us
81699,Logic,Been shining muhfucka whats bling to us
81700,Logic,Most loved most hated at the same time
81701,Logic,Star player in this bitch and its game time
81702,Logic,Who you know lyrically killed the club in the same rhyme 
81703,Logic,They call me Logic motherfucker better know the name
81704,Logic,I spit crack like Pusha  Yuugh   Novocaine
81705,Logic,We never dumb it down you know we just numb it down
81706,Logic,And watch you get up in your feelings when we come around
81707,Logic,Grew up on section   you probably cant relate
81708,Logic, Cause y all just watched the throne I m tryna checkmate
81709,Logic,I been shinin since before I brought them diamonds in and
81710,Logic,They talk that shit they talk that shit it s so astonishing
81711,Logic,Y all better swallow that pride like a klonopin
81712,Logic,Cause I can lay tracks with my eyes closed Chinaman
81713,Logic,Got a show in LA Sunday then New York Monday
81714,Logic,Looking at the BET cypher like I ll be there one day
81715,Logic,It s the Roc reincarnated we call it Visionary
81716,Logic,Fuck the world  til I m on top we call that missionary
81717,Logic,The game s on pause it need to load again
81718,Logic,These rappers is reruns and we need a new episode again
81719,Logic,Yeah well motherfucker this the pilot
81720,Logic,So fly I recorded this on the PJ next to the pilot on a CB
81721,Logic,Said this would happen back in the day but you ain t believe me
81722,Logic,So um Imma keep rising to the top
81723,Logic,Never stop and finger fuck the world  til the day my album drop
81724,Logic,You already know what I been on
81725,Logic,Like fuck it where the weed at 
81726,Logic,And this flight attendant got the fattest ass
81727,Logic,Now these bitches say they love me but theyre just obsessed with the image
81728,Logic,Now if practice makes perfect then this is a scrimmage
81729,Logic,Cause I aint perfect I never said I was
81730,Logic,But now theyre hating cause a brother finally got some buzz
81731,Logic,The things that I say  Say 
81732,Logic,The places Im seeing  Seeing 
81733,Logic,The people I talk to you dont know what I mean
81734,Logic,Even matters of love it aint always as it seems
81735,Logic,Yeah theres plenty in the sea until you hit the mainstream
81736,Logic,The girl that I love the one I call my honey
81737,Logic,Now I wonder if she love me for me or my fucking money
81738,Logic,Sometimes I think about the love that I had in the past
81739,Logic,I truly miss it but it just wasnt destined to last
