,artist,text
78986,Logic,With a fist to match more solid than concrete
78987,Logic,Tell white people I m black feel the need to retreat
78988,Logic,Like I should be ashamed of my granddaddy Malik
78989,Logic,But my beautiful black brothers and sisters
78990,Logic,Want to act like I m adopted
78991,Logic,Go back in time to when my nigga daddy
78992,Logic,Impregnated my cracker momma and stopped it
78993,Logic,Like the white woman said oh my  Oh my 
78994,Logic,Single mother praying In A Gadda Da Vida
78995,Logic,Looking around on the ground for a serpent to feed her
78996,Logic,Praying to God wondering why her baby daddy beat her
78997,Logic,Feeling like the devil finna come and defeat her
78998,Logic,Single mother praying In A Gadda Da Vida
78999,Logic,Looking around on the ground for a serpent to feed her
79000,Logic,Praying to God wondering why her baby daddy beat her
79001,Logic,Feeling like the devil finna come and defeat her
79002,Logic,Single mother praying In A Gadda Da Vida
79003,Logic,Looking around on the ground for a serpent to feed her
79004,Logic,Praying to God wondering why her baby daddy beat her
79005,Logic,Feeling like the devil finna come and defeat her
79006,Logic,All alone in the wintertime close to the heater
79007,Logic,Wondering what s gonna happen
79008,Logic,And how the world gonna treat her
79009,Logic,How could her momma mislead her
79010,Logic,And her daddy just leave her 
79011,Logic,Like abracadabra when that magician pull on the lever
79012,Logic,I don t feel right deep inside
79013,Logic,Feeling like I need to hide
79014,Logic,Everybody wonder why I get high
79015,Logic,Cause I can t fight the feeling inside
79016,Logic,Sometimes I can t get you out of my mind
79017,Logic,Baby no I just can t find I just can t find
79018,Logic,Such a beautiful state of mind
79019,Logic,Beautiful state of mind such a beautiful state of mind
79020,Logic,Sometimes everyday right on time
79021,Logic,It feels like Im living on borrowed time
79022,Logic,I feel the Aryan in my blood its scarier than a Blood
79023,Logic,Been looking for holy water now I m praying for a flood
79024,Logic,It feel like time passing me by slower than a slug
79025,Logic,While this feeling inside of my body seep in like a   
79026,Logic,Will you hug me rub me on the back like a child 
79027,Logic,Tell me you love me need me
79028,Logic,Promise me you ll never leave me
79029,Logic,Even though my daddy you know he blacker than the street
79030,Logic,With a fist to match more solid than con   
79031,Logic,Tell white people I m black feel the need to retreat
79032,Logic,Like I should be ashamed of my granddaddy Malik
79033,Logic,But my beautiful black brothers and sisters
79034,Logic,Want to act like I m adopted
79035,Logic,Go back in time to when my nigga daddy
79036,Logic,Impregnated my cracker momma and stopped it
79037,Logic,Feeling innocent in a sense has got me feeling on the fence
79038,Logic,And all this shit is so intense
79039,Logic,Don t wanna go to this event
79040,Logic,Just wanna stay home and invent
79041,Logic,And somehow yeah that let me vent
79042,Logic,I m taking shots and drinking liquor
79043,Logic,But that shit don t make a dent in how I m feeling
79044,Logic,And yes I m willing to keep chilling on this shit
79045,Logic,I know theres someone out there far away
79046,Logic,Whos feeling all this shit
79047,Logic,And yes I know that when I m low
79048,Logic,Theres so much further I can go
79049,Logic,And so I look up to the sky to the sky
79050,Logic,Like a single mother praying In A Gadda Da Vida
79051,Logic,Looking around on the ground for a serpent to feed her
79052,Logic,Praying to God wondering why her baby daddy beat her
79053,Logic,Feeling like the devil finna come and defeat her
79054,Logic,All alone in the wintertime close to the heater
79055,Logic,Wondering what s gonna happen
79056,Logic,And how the world gonna treat her
79057,Logic,How could her momma mislead her
79058,Logic,And her daddy just leave her 
79059,Logic,Like abracadabra when that magician pull on the lever
79060,Logic,How could her momma mislead her
79061,Logic,And her daddy just leave her 
79062,Logic,Like abracadabra when that magician pull on the lever
79063,Logic,How could her momma mislead her
79064,Logic,And her daddy just leave her 
79065,Logic,Like abracadabra when that magician pull on the lever
79066,Logic,How could her momma mislead her
79067,Logic,And her daddy just leave her 
79068,Logic,Like abracadabra when that magician pull on the lever
79069,Logic,How could her momma mislead her
79070,Logic,And her daddy just leave her 
79071,Logic,Like abracadabra when that magician pull on the lever
79072,Logic,Atom So what now What advice can you give me  
79073,Logic,God What advice can I give humanity 
79074,Logic,God Live your life Don t waste your days on the negative energy of others Remember that you re not your salary You re not your house You re not your car And no matter how big your bank account is your grave is six feet under just like everyone else s So enjoy the days you have Worry not bout the days that came before you Nor the ones that will follow you in death Remember that right here in this moment is all you are guaranteed and the fact that you are living is what life is all about So live your life to the fullest according to your happiness and the betterment of all
79075,Logic,Kai Damn man we ve been walking forever
79076,Logic,Thomas Well Thalias tracking system says we ll be there in just over an hour
79077,Logic,Kai Shit at least we got good walking music or is that it 
79078,Logic,Thomas Oh no man I m cueing up the fourth album now his final one
79079,Logic,Tell me you could see beyond the smile that Im puttin on
79080,Logic,This front that Im puttin up for you
79081,Logic,I spill my soul into a microphone
79082,Logic,With poems written in blood
79083,Logic,In hopes that its enough for you
79084,Logic,In fact I rap till I collapse
79085,Logic,All I wanted was acceptance my latest lesson
79086,Logic,Ill never feel your approval till I accept my own
79087,Logic,Come from a messed up home destitute and less informed
79088,Logic,About the ways to raise a child up
79089,Logic,Of his environment I need to cry and vent
79090,Logic,But I done built this wall up
79091,Logic,Actin like everythings all good
79092,Logic,But in reality Im lookin for something
79093,Logic,Through bumpin my favorite rappers I came up after
79094,Logic,Eyes closed I zone till five or so in the morn
79095,Logic,Shit you know how long Ive been out on my own 
79096,Logic,Chasing dreams fantasies of a throne
79097,Logic,One day I wake up and see that it didnt exist all along
79098,Logic,Till then I will pen verses that fans consider brilliant
79099,Logic,Boosting my ego with every million that spills in
79100,Logic,I wont find solace so wheres the logic in that 
79101,Logic,Worrying bout if they think Logic could rap
79102,Logic,When it all goes back to a childhood need to be loved
79103,Logic,By parents that was in too deep with the drugs
79104,Logic,Nigga my advice fuck the black and white shit
79105,Logic,Be who you are identify as a star
79106,Logic,No one tells you youre that
79107,Logic,Its something that you just know
79108,Logic,The world be stealing your glow
79109,Logic,Your mama did what she could
79110,Logic,Her life was miles from good
79111,Logic,Your father fell in the trap
79112,Logic,They set for you when you black
79113,Logic,They met when they was low
79114,Logic,And therefore you a product of that
79115,Logic,And so your trauma is deep
79116,Logic,Dont bury it you should weep
79117,Logic,And clean it out of your system then truly forgive em
79118,Logic,Just my opinion only then can you find peace
79119,Logic,Just start to notice happiness dont come from album release
79120,Logic,Ive been through it before
79121,Logic,Can only share with you what I know
79122,Logic,To be true but at the same time Ill never be you
79123,Logic,And youll never be me no matter how hard that you try
79124,Logic,This is for youngins out there wondering how far you can fly
79125,Logic,The truth is that you could go further than the stars and the sky
79126,Logic,But if you want to then you ought to know why
79127,Logic,Are you running from something
79128,Logic,With hopes of becoming someone
79129,Logic,Thats finally worthy of love
79130,Logic,Let me tell you now youre worthy enough
79131,Logic,Fuck approval from strangers that shit is dangerous as hell
79132,Logic,Find God learn to accept yourself
79133,Logic,I feel like the grass is green
79134,Logic,And everything I do is unseen
79135,Logic,But I know that s just in my mind
79136,Logic,I know everything is just in my mind
79137,Logic,Do you really wanna to be famous 
79138,Logic,Do you really wanna be a superstar 
79139,Logic,Do you really wanna get dangerous 
79140,Logic,Do you even know where the groupies are 
79141,Logic,Bitches out here be shameless
79142,Logic,And I really wonder where they parents are
79143,Logic,Look around everything changes
79144,Logic,It feels like Ive been buried alive
79145,Logic,Everything happens for a reason
79146,Logic,People only in your life for seasons
79147,Logic,Word to Aunt Viv  Real shit 
79148,Logic,Death and taxes that s all we given
79149,Logic,You can make a life but can t make a livin
79150,Logic,You can make it work but that still aint driven
79151,Logic,Give a lot but that still aint givin
79152,Logic,Livin life like this ain t real though
79153,Logic,Every night like this I feel so dead wrong
79154,Logic,Collision is head on my vision is dead and gone
79155,Logic,Perception of right and wrong
79156,Logic,I been here so very long right here in this very song uh
79157,Logic,Look around everything changes
79158,Logic,Seem like everybody just strangers
79159,Logic,Don t go outside cause it s dangerous
79160,Logic,Why everybody wanna be famous
79161,Logic,I m so OCD if they notice me
79162,Logic,I might jump out the grave so they know it s me
79163,Logic,Man everybody want this shit for free
79164,Logic,Hand out palm up when they get to me
79165,Logic,In my mind no I never let it get to me
79166,Logic,Everybody got a time will it get to me 
79167,Logic,V s up motherfucka that s victory
79168,Logic,Tell me why what I m doing ain t shit to me damn
79169,Logic,Buried alive  Buried alive 
79170,Logic,Will I survive  Buried alive 
79171,Logic,It feels like I ve been buried alive buried alive
79172,Logic,I feel like the grass is green
79173,Logic,And everything I do is unseen
79174,Logic,But I know that s just in my mind
79175,Logic,I know everything is just in my mind
79176,Logic,Do you really wanna to be famous 
79177,Logic,Do you really wanna be a superstar 
79178,Logic,Do you really wanna get dangerous 
79179,Logic,Do you even know where the groupies are 
79180,Logic,Bitches out here be shameless
79181,Logic,And I really wonder where they parents are
79182,Logic,Look around everything changes
79183,Logic,It feels like Ive been buried alive
79184,Logic,Im feelin this villainous feelin inside of my mind
79185,Logic,Every time that I m willing I feel like Im killin my dreams
79186,Logic,When that voice goes nah nah nah
79187,Logic,Listen up now love it or hate it
79188,Logic,Never debate it you can never degrade it
79189,Logic,While all these other motherfuckers
79190,Logic,Probably thinking I made it
79191,Logic,My mind jaded no I never evade it
79192,Logic,I elevate it just to keep it innovative  innovative 
79193,Logic,God damn bring it back now blowin up like Iraq now
79194,Logic,RattPack put me on the map now
79195,Logic,Just take my time I just take my time
79196,Logic,I know Imma get it like this
79197,Logic,So everyone know that I did it like this
79198,Logic,Yeah I know Imma take my time
79199,Logic,Battle the image inside of my mind
79200,Logic,Tell me I cant but Im already knowing
79201,Logic,I know Im gonna rise even though Ive been 
79202,Logic,Buried alive  Buried alive 
79203,Logic,Will I survive  Buried alive 
79204,Logic,It feels like Ive been buried alive buried alive
79205,Logic,I feel like the grass is green
79206,Logic,And everything I do is unseen
79207,Logic,But I know that s just in my mind
79208,Logic,I know everything is just in my mind
79209,Logic,OutKast A Tribe Called Quest The Red Hot Chili Peppers and films by Quentin Tarantino were in rotation constantly throughout the duration of this albums creation   
79210,Logic,Its the type of shit that they read about
79211,Logic,Like Chris said I gotta bleed it out
79212,Logic,Ive been in the zone I cant be without
79213,Logic,This real shit that I be about
79214,Logic,Im a visionary thats long term
79215,Logic,But Def Jam said they need it out
79216,Logic,If I rush this shit I might be without
79217,Logic,But I need a vision cant see without
79218,Logic,Ive been patient never complacent
79219,Logic,Left the underground when I left the basement
79220,Logic,Thats renovation I spit this verse like a revelation
79221,Logic,On the road with Kid Cudi and B I G
79222,Logic,Who made hits with Ye got hits with Jay
79223,Logic,Now he wanna fuck around and make hits with me
79224,Logic,If its meant to be then its meant to be
79225,Logic,Cant express what that meant to me what it mean to me
79226,Logic,Man I swear the shit like a dream to me what it seemed to be
79227,Logic,Its so different now everything is so different now
79228,Logic,Ive been there and Ive done that
79229,Logic,Tell em all that I run that thats a fun fact
79230,Logic,And Im back again cause I love this shit
79231,Logic,Write it down and they publish it
79232,Logic,I went  years without a publicist
79233,Logic,Cause the word of mouth they in love with this
79234,Logic,Ive been dreaming Ive been scheming
79235,Logic,Went away a while but Ive been fiending
79236,Logic,Ive missed the fam but they know the deal
79237,Logic,Been at it way before the deal
79238,Logic,Now the  music got mass appeal
79239,Logic,My main girl got ass appeal
79240,Logic,Like I feel the vibe thats the main thing
79241,Logic,Little fish that went mainstream
79242,Logic,My whole city they know whats up
79243,Logic,Im unseen and Im in the cut about extra shit
79244,Logic,When Im on the phone dont interrupt
79245,Logic,If Im talking business I might erupt
79246,Logic,If youre at the show put your lighter up
79247,Logic,Fuck with me if youre really bout it
79248,Logic,Outsiders I could do without it
79249,Logic,Sold out shows no one knew about it
79250,Logic,When it comes to fucks I give two about it
79251,Logic,Your cosign I could do without it
79252,Logic,Okay last verse I gotta make it count
79253,Logic,Wont speak on my bank account
79254,Logic,So many commas Id have to pause
79255,Logic,And I cant afford to just waste the bars
79256,Logic,Every day boy I thank the Lord
79257,Logic,I got a lot of problems but could have more
79258,Logic,Wish I spoke to my dad more my jeweler less
79259,Logic,I been hungry like Budapest
79260,Logic,Tell me who the best dont give a fuck
79261,Logic,Love life even though Im stressed
79262,Logic,This business boy I swear a test
79263,Logic,Tell Def Jam if they dont cut the check
79264,Logic,Ill send Chris to go cut they neck
79265,Logic,I love the building no disrespect
79266,Logic,But yall better ride when Im in effect
79267,Logic,Thats radio thats TV but Visionary got the internet
79268,Logic,If yall fuck around or try to throw the ball to another artist
79269,Logic,Put half a mill of my own money in this album
79270,Logic,Thats my dime no rap features just my rhymes
79271,Logic,My story its all mine from the basement to the stadium
79272,Logic,From the Roxy to Palladium
79273,Logic,Ive been there and Ive done that yes I run that
79274,Logic,With this pretty girl on my floor
79275,Logic,Half naked playing Connect Four
79276,Logic,But Ive been trying to throw sex out the window
79277,Logic,She so fine type of girl I wanna fuck her mind
79278,Logic,And then unwind with some slow head
79279,Logic,All my homies like  go head 
79280,Logic,Anyway its been a long time
79281,Logic,And this here has been a long rhyme so I gotta go
79282,Logic,Its Logic the one nobody would vouch for
79283,Logic,Hows that shit for an outro 
79284,Logic,This is my story till the end
79285,Logic,This is my story till the end
79286,Logic,Yeah Yeah Yeah Yeah Yeah Yeah
79287,Logic,Y Yeah Yeah Yeah Yeah Yeah Yeah
79288,Logic, Every day that they live and breathe is extended to them 
79289,Logic,They may be misinformed about the truth they may be misguided somebody has led them on the wrong path 
79290,Logic,A path of corruption and destruction But yet Gods mercy every day that they live is extended to them and they have another opportunity to be saved    
79291,Logic,Yeah Yeah Yeah Yeah Yeah Yeah
79292,Logic,Y Yeah Yeah Yeah Yeah Yeah Yeah
79293,Logic,Yeah Yeah Yeah Yeah Yeah Yeah
79294,Logic,Y Yeah Yeah Yeah Yeah Yeah Yeah
79295,Logic,This concludes the Under Pressure program   
79296,Logic,Motherfuckers wanna get famous bust guns and get dangerous
79297,Logic,Daddy graduated from Cambridge money talks in every language
79298,Logic,Real recognize that stainless silver spoon what my aim is
79299,Logic,Yall dont know what that game is yall dont know what that uh
79300,Logic,Yall bout that fraternity life
79301,Logic,If youre from where Im from then as soon as you come
79302,Logic,Baby girl gon be about that maternity life
79303,Logic,If you do like my daddy then she gonna be single and alone
79304,Logic,That maternity life for eternity life
79305,Logic,Eternity life probably thinking we livin that life
79306,Logic,Cause we do what we do but hold up let me get it right
79307,Logic,Everybody got problems everybody got problems
79308,Logic,But not everybody need a    to solve them revolve them  ba ba ba ba 
79309,Logic,Take care of all of them like this I might just go crazy all the way
79310,Logic,Yall live that life where your safety is only a call away
79311,Logic,But not us mommy and daddy never bought us
79312,Logic,Not a god damn thing but they brought us
79313,Logic,Broke as hell we couldnt fund the trust
79314,Logic,Outside run around with a gun to bust
79315,Logic,Police looking for every one of us
79316,Logic,Back then yeah all of that was fun to us
79317,Logic,Had a little bit of money in the middle let me hit em with a riddle
79318,Logic,If I never had a dark night I might not not not 
79319,Logic,Not be the same might not be the 
79320,Logic,I know my mind is sober but Im so high its over
79321,Logic,I know my mind is sober but Im so high its over
79322,Logic,You dont know nothing about this right here boy
79323,Logic,Chilling in Maryland three niggas in a Cadillac lac lac
79324,Logic,You dont know nothin bout that Chi town
79325,Logic,South Central with the gang gang gang
79326,Logic,Niggas in the projects for them niggas tryna eat
79327,Logic,Get the fuck up off your silver
79328,Logic,Everybody wanna live lavish a million in the bank on average
79329,Logic,They cutthroat yeah they savage
79330,Logic,They riding round with the baddest  bitch 
79331,Logic,One day I woke up and said Im bout to do this
79332,Logic,For the rest of my life no question its right
79333,Logic,Waiting for the bus at a stop light
79334,Logic,Looking at the cop right in front of my eyes
79335,Logic,Living in a world of lies where the truth dies
79336,Logic,And hatred multiplies mu mu mu multi 
79337,Logic,Multiplies I said I cant take it
79338,Logic,I remember wondering if I would ever make it
79339,Logic,But as I reminisce I realize it was all irrelevant its evident
79340,Logic,Im getting money for the hell of it
79341,Logic,Never fuck around so the flow celibate
79342,Logic,Speaking for the people like a delegate
79343,Logic,And when the situations delicate
79344,Logic,I execute it with the proper etiquette
79345,Logic,Everybody wanna get ahead of it no I cant take the time to stop
79346,Logic,It aint all about the money so Im headed to the top
79347,Logic,But Im still getting guap never stop unless a body drop
79348,Logic,Metaphorical motherfucker to get it in
79349,Logic,While the whole world spin for the dividend
79350,Logic,Everybody hate till he dead then they miss em
79351,Logic,Why cant we relax and listen 
79352,Logic,Stop spending money on things that glisten
79353,Logic,I know my mind is sober but Im so high its over
79354,Logic,I Know my mind is sober but Im so high its over
79355,Logic,You dont know nothing about this right here boy
79356,Logic,Chilling in Maryland three niggas in a Cadillac lac lac
79357,Logic,You dont know nothin bout that Chi town
79358,Logic,South Central with the gat gat gat
79359,Logic,Niggas in the projects for them niggas tryna eat
79360,Logic,Get the fuck up off your silver spoon
79361,Logic,Sometimes I feel like Ive drifted I feel different I feel gifted
79362,Logic,Ive been high so long dont need to smoke to get lifted
79363,Logic,Ive been under pressure looking for Nikki
79364,Logic,Whenever she is around you know I come quickly
79365,Logic,Vivid memories of Chicago south side where I go
79366,Logic,From Reggies to the House of Blues progress is the motto
79367,Logic,Man the first show that I ever done sold out was in Chicago
79368,Logic,Yeah yeah living like Ive been ready to die
79369,Logic,Maybe not I dont know why my mind is changing
79370,Logic,Rearranging this dangerous melody uh
79371,Logic,Yeah and I know that aint nobody finna ever be ahead of me
79372,Logic,All that competition right there is dead to me
79373,Logic,Yeah uh yeah Ive been turning the pages
79374,Logic,Feeling the vibe shit is outrageous
79375,Logic,Boy Ive been feeling courageous
79376,Logic,This shit right here Ive been at it for ages
79377,Logic,Feels like Im running through mazes
79378,Logic,Yeah vibe with this bad bitch in the whip and I ride to this
79379,Logic,And Im feeling it uh hope when Im forty Im still in it
79380,Logic,One of the few that be killing it uh
79381,Logic,Yeah young motherfucker that be giving what he living
79382,Logic,On the road to success you know that Im driven
79383,Logic,But they didnt wanna publish it
79384,Logic,But right now Im on some other shit
79385,Logic,Im in a different world Im with a different girl
79386,Logic,Im with the same team but its a different scheme
79387,Logic,Remember back when I couldnt even pay the bills
79388,Logic,And Ill never forget how that feels back when I would
79389,Logic,Buy it break it roll it light it smoke it inhale it Im gone
79390,Logic,Buy it break it roll it light it smoke it inhale it Im gone
79391,Logic,Okay doing what I gotta do flying at this altitude
79392,Logic,I look out of the window like goddamn thats what I really do
79393,Logic,Dont know why I fear the planes sometimes I wish to sustain
79394,Logic,If I look back on it I would do it all over again
79395,Logic,Nikki Nikki where you been I cant wait to breathe you in
79396,Logic,Been on this plane way too long I cant wait to see you again
79397,Logic,Oh my God this turbulence has got me sippin on this liquor
79398,Logic,Crazy racist white bitch looking at us
79399,Logic,Like  Who are these niggas  
79400,Logic,First class on they ass all complain thats when I dash
79401,Logic,Just landed in Europe and this model bitch is tryna smash
79402,Logic,Now Im riding on the train all this shit inside my brain
79403,Logic,Just left a hotel in Belgium damn them waffles was insane
79404,Logic,Smoking blunts in Amsterdam
79405,Logic,In my headphones thats the man
79406,Logic,I know I know that I got it if I do what I gotta do to get by
79407,Logic,And they wonder why I never get high
79408,Logic,And they wonder why I never get high
79409,Logic,I know I know that I got it if I do what I gotta do to get by
79410,Logic,And they wonder why I never get high
79411,Logic,And they wonder why I never get high
79412,Logic,Okay fuck affiliation Im that dude that did it on his own
79413,Logic,These thoughts inside my mind
79414,Logic,Be fuckin with me when Im all alone
79415,Logic,I really like this girl she bad as fuck why must I run away 
79416,Logic,It feel like self assassination I cant put this gun away
79417,Logic,God damn whats the plan Not complacent where I am
79418,Logic,Reminiscing when I hit the road back in that mini van
79419,Logic,Broke as fuck not a dollar whipping that Chevy Impala
79420,Logic,Praying that we make it out this city Lord willin InshaAllah
79421,Logic,Up to date the couple years now my idols are my peers
79422,Logic,I was on the road to nowhere till I decided to veer
79423,Logic,Put my everything into this shit
79424,Logic,You know I know you know this
79425,Logic,Used to give a fuck what people thought
79426,Logic,Hoping that they would notice
79427,Logic,Stop giving a fuck cause music gotta be the only motive
79428,Logic,Mind racing on and off the track Im going locomotive
79429,Logic,I cant believe you dont like Tarantino
79430,Logic,Ugh I dont like him because like when its non like non Tarantino esque I think its a good movie 
79431,Logic,You mean like Inglourious Bastards  I didnt see that
79432,Logic,What   I didnt I dont know 
79433,Logic,Oh my God Have you seen Pulp Fiction 
79434,Logic,Yeah but I dont really remember it
79435,Logic,What you talking about Have you seen uh   this is funny cause were on a train   have you seen fuck Whats his name The guy from the movie in the place on the thing 
79436,Logic,On the train With the scenery 
79437,Logic,Uh Im tryna remember right now dammit Source Code 
79438,Logic,No With the dude from Donnie Darko 
79439,Logic,Well I still wanna know what your favorite Tarantino movie is   
79440,Logic,My favorite Tarantino movie  
79441,Logic,I know I know that I got it if I do what I gotta do to get by
79442,Logic,And they wonder why I never get high
79443,Logic,And they wonder why I never get high
79444,Logic,I know I know that I got it if I do what I gotta do to get by
79445,Logic,And they wonder why I never get high
79446,Logic,And they wonder why I never get high
