,artist,text
78110,Logic,When I see kids around the way I say how Im your dad
78111,Logic,It gets me thinking bout incredible moments weve had
78112,Logic,And on the real Im trying so hard not to bug you
78113,Logic,But do you think you could stop rapping about my drug use 
78114,Logic,Im two years clean no longer a fiend
78115,Logic,And I love you I swear Bobby I know youre there
78116,Logic,And when the time is right I know that you gon take care
78117,Logic,Of anything I need of your family
78118,Logic,Can I have some tickets to your next show 
78119,Logic,Can I have some money for my new honey thats hella fine 
78120,Logic,I forgot to mention I got divorced from your step mom
78121,Logic,My mind going crazy but I still look hella calm
78122,Logic,Maybe you could tell  beep 
78123,Logic,Ive been feeling under pressure
78124,Logic,Hey whats up bro This Ralph I didnt want much man just calling to see whats going on I know youre busy Dad hit me up its his birthday today but I know you know that Yeah he calling he be tryna introduce me to his new chick and stuff man I dont know how to handle that I dont wanna tell him like nah I aint trying to meet her off top you know So what you think I should do Text me I know youre busy dawg But he been calling me saying he wanna come down he wanna bring his new chick and Brendas like  damn he really tryna rock out with his new chick cause you know we all talk to Debbie But I dont know I dont know how to tell him this shit so just hit me back whenever you got the time man I know theres more shit on your plate You aint gotta hit me dawg but if you do Id appreciate it When you back love you do your thing Swag RattPack all day boy Alright nigga
78125,Logic,Yeah dear family Im so sorry that Ive been distant
78126,Logic,Everything changed in an instant my time has been inconsistent
78127,Logic,I know that you been insisting I know that birthday I missed it
78128,Logic,I swore I told my assistant but I guess my mind is in another place
78129,Logic,Thoughts often in another world I started seeing another girl
78130,Logic,It fell through man what a world
78131,Logic,But Im so focused on my craft on employing my staff
78132,Logic,Such a perfectionist I cant even finish this draft
78133,Logic,This letter to the ones I love the ones that I miss
78134,Logic,Brothers and sisters that hit me up just to reminisce
78135,Logic,Meanwhile people outside of my blood asking for favors
78136,Logic,I dont owe you a fucking thing you best switch your behavior
78137,Logic,Truly remarkable how I barely know you but somehow owe you When you dont even know bout the shit I go through
78138,Logic,We aint spoken in a while tell me sister how your child 
78139,Logic,Come now girl give me a smile come on girl dont do me foul
78140,Logic,Sorry I aint call before but Im calling you right now
78141,Logic,I heard that you was popping E stop resorting to the vowel
78142,Logic,How my mama how she doing does she know what Im pursuing 
78143,Logic,I aint talk to her in years that relationship she ruined
78144,Logic,But sometimes I wake up and wonder just what the fuck Im doing
78145,Logic,They say family is everything I swear that shit the truth
78146,Logic,I should spend it all with yall but I spend it in the booth
78147,Logic,This is everything I love this is everything I need
78148,Logic,Never sacrifice this feeling even though my heart it bleed
78149,Logic,This is everything I love everything I need
78150,Logic,Never sacrifice this feeling even though my heart bleed
78151,Logic,Under pressure Ive been feeling under pressure
78152,Logic,Hey son Im sorry I missed your call today but I was in an AA meeting A friend of mine was celebrating four years so I couldnt get you right then And then when I did call you werent able to answer or whatever Just wondering how things are going Jenn and I arent together anymore Living on my own you know Anyway the whole family even the family that you don t know my sisters and your aunts that youve never met are very proud of you Your cousins just love you too Anyway son I love you I just want you to know that And just keep grinding you know And I dont wanna hear you joining the Illuminati cause then I gotta kill ya I love you son bye
78153,Logic,I can feel you in my lungs feel you in my veins
78154,Logic,Bloodstream only way to make it to my brain
78155,Logic,I tried some others but man they just not as good as you
78156,Logic,Going crazy cause I only feel this good with you
78157,Logic,Maybe I m just not as strong as I once was
78158,Logic,When we re together lately I don t even feel a buzz
78159,Logic,I m addicted to this shit like it was hard drugs
78160,Logic,Nikki baby I love you but now I gotta go
78161,Logic,Cause in the end what happens you already know
78162,Logic,Probably wonder where I been at I been laying low
78163,Logic,But in my mind I m wondering what I m paying for
78164,Logic,All these other bitches on my dick but I can t fuck with that
78165,Logic,Youre the only girl I need I gotta have you back
78166,Logic,Even though you turn my lungs black
78167,Logic,Tell me where you been Jack
78168,Logic,Uh I know this shorty that go by the name of Mary
78169,Logic,I used to fuck her way back when I didnt know a thing
78170,Logic,Skipping school with all my homies on some truancy
78171,Logic,But when I ended things with her it was just you and me
78172,Logic,Doing me good that s what I thought at first
78173,Logic,Me and you together swear to God that s all that worked
78174,Logic,Away from you though man its just so hard to work
78175,Logic,Uh my heart is hard at work
78176,Logic,We been together like ten years
78177,Logic,Goddamn took me as young man
78178,Logic,Everyday I wonder who I am who will I be where will I go
78179,Logic,What will they write upon my grave 
78180,Logic,A free man born as a king who died as a slave
78181,Logic,But everything he gave her was for nothing though
78182,Logic,Oh no I can t fade that shit I gotta let you go
78183,Logic,You got me tripping like a flight to Vegas
78184,Logic,All this shit you got me doing man it s outrageous
78185,Logic,All I know is I m living the life I never would
78186,Logic,Finally let you go I thought I never could
78187,Logic,Don t get me wrong can t forget the times shared
78188,Logic,Seem like everywhere I go I always know youre there
78189,Logic,Tried to run but my legs won t
78190,Logic,I look away but my head don t
78191,Logic,I love it when you re fresh
78192,Logic,I love it when I take your top off and we share the same breath
78193,Logic,I hate it that I need you Nikki
78194,Logic,But I love it when I feed you Nikki
78195,Logic,I hate that I bleed for you
78196,Logic,Uh I long and I need for you
78197,Logic,But I love it when I taste you
78198,Logic,I wish I could erase you you re everywhere I go
78199,Logic,But you re everywhere I long to be
78200,Logic,And all these other people that don t seem to understand
78201,Logic,I m just a man they always ask what s wrong with me
78202,Logic,Man you re everything I crave
78203,Logic,You re the only thing I let in that would put me in the grave
78204,Logic,I m a king you re my Coretta
78205,Logic,But lately I been feeling like a slave for the nicotine
78206,Logic,Said I m a slave for the nicotine
78207,Logic,I m a muthafuckin slave for ya
78208,Logic,I m a muthafuckin slave for ya
78209,Logic,All handwriting on the albums artwork was done by Big Lenbo 
78210,Logic,I think they should know now
78211,Logic,I think they should know whats up
78212,Logic,Thats that road I been down
78213,Logic,I know how it go now whats up
78214,Logic,I feel like I don t belong
78215,Logic,I feel like my life is wrong
78216,Logic,I feel like I don t know whats up
78217,Logic,I ain t here to pick and choose
78218,Logic,I aint here to sing the blues
78219,Logic,I m just here to spread the clues
78220,Logic,I m just here to spread the news
78221,Logic,I ain t ashamed to be white
78222,Logic,I ain t ashamed to be Black
78223,Logic,I ain t ashamed of my beautiful Mexican wife as a matter of fact
78224,Logic,I know you fucking with that
78225,Logic,And I m not scared of the people who tell me I should be
78226,Logic,Do what you love and don t ever wonder what it could be
78227,Logic,Everybody from my hood everybody know I m good
78228,Logic,Sometimes I m misunderstood
78229,Logic,But thats just the uneducated that never related and feel like Im fading off
78230,Logic,Wonder why I drown in the bubbly
78231,Logic,You could be anything you wanna be
78232,Logic,Cept the person you don t wanna be
78233,Logic,Wondering if everybody still like this up above
78234,Logic,When that push come to shove
78235,Logic,Make me wanna pull up with the with the gat in the glove like
78236,Logic,Not a slave to the stereotype
78237,Logic,All alone in my room in the middle of the night
78238,Logic,I don t have the words but my stereo might
78239,Logic,I dont wanna be black I don t wanna be white I just wanna be a man today
78240,Logic,I dont wanna be a Christian Muslim gay straight or bi see you later bye
78241,Logic,Not perceived by the things I believe or the color of my skin
78242,Logic,Or the fact I m attracted to her maybe him
78243,Logic,Or the fact I m a single mother living all alone
78244,Logic,Looking for a man and a home to call my own
78245,Logic,The only man I ma ever need is my son my son my son my son
78246,Logic,Fuck everybody hatin on me right now I m black and proud
78247,Logic,I m just as white as that Mona Lisa
78248,Logic,I m just as black as my cousin Keisha
78249,Logic,I m biracial so bye Felicia
78250,Logic,Praise Black Jesus now call the preacher
78251,Logic,I vote for more and more and more and more and more and more and more and more and more
78252,Logic,I think they should know now
78253,Logic,I think they should know whats up
78254,Logic,Thats that road I been down
78255,Logic,I know how it go now whats up
78256,Logic,I feel like I don t belong
78257,Logic,I feel like my life is wrong
78258,Logic,I feel like I don t know whats up
78259,Logic,Go on and let your soul glow
78260,Logic,Black Spiderman can he save a brother now
78261,Logic,Black Spiderman can he save a brother now
78262,Logic,Yeah I mean Spiderman should be Black
78263,Logic,Hold up let me get my mind
78264,Logic,Let me get my mind let me get my mind right
78265,Logic,You know everything is alright
78266,Logic,You know everything is all
78267,Logic,Just ride with a mothafucka
78268,Logic,Keep it real never lie to a mothafucka hold me down
78269,Logic,Chillin In A Gadda Da Vida rockin Adidas
78270,Logic,With a se orita when she sippin liquor by the liter
78271,Logic,Thats royalty like the homie Gambino
78272,Logic,He know we be in the casino lightin Cubans with a C note
78273,Logic,Ima fuck the game dare you to test my libido
78274,Logic,Comin up shorter than Danny DeVito
78275,Logic,Whenever I step on the beat ho
78276,Logic,Like a killer on the creep flow
78277,Logic,Had my share of defeat but we still gon eat ho
78278,Logic,While the fans bumpin Welcome To Forever on repeat though
78279,Logic,Wonderin if Ima ever fall off
78280,Logic,Feelin mad at the world wanna hit it with a sawed off
78281,Logic,This is war everybody ain t no reason Ima call it off
78282,Logic,Get it right shout out to the homie Dizzy Wright
78283,Logic,So you know this shit about to be a busy night
78284,Logic,Everything is al  everything is alright
78285,Logic,Its Finally Famous over everything
78286,Logic,Yeah day one shit right there
78287,Logic,Hold up let me get my mind
78288,Logic,Let me get my mind let me get my mind right
78289,Logic,You know everything is alright
78290,Logic,You know everything is all
78291,Logic,Oh my God they plottin and schemin
78292,Logic,Fuckboys rather me not even breathin
78293,Logic,They tryna take my blessings away
78294,Logic,They gotta be demons Im blessed everyday
78295,Logic,And not blessed like Im sneezin Im healthy and well
78296,Logic,On top of my ship and Im not even sinkin
78297,Logic,And I could just sit back and say that Im happy
78298,Logic,But cant spend a day without smokin and drinkin
78299,Logic,Got Champagne problems and I order more
78300,Logic,Im a young nigga with a older soul
78301,Logic,But still young enough to know I gotta know some more
78302,Logic,I made somethin out of nothin Sean Don the magician
78303,Logic,She doin tricks with her pussy I guess shes a vagician
78304,Logic,She tryna hold on to a nigga sta sta stackin up
78305,Logic,Purell for these fake niggas tryna dap dap me up
78306,Logic,Hype nigga back back back it up
78307,Logic,Claimin that we homies boy stop
78308,Logic,Thats the type of shit I boycott
78309,Logic,Yellin fuck the     state troops
78310,Logic,Any nigga with a badge I dont even trust the boy scouts
78311,Logic,I got these good girls hoin out
78312,Logic,Tell me what the fuck you know about
78313,Logic,Bein that nigga that these niggas dont know about
78314,Logic,Then they throw you in the game
78315,Logic,And you mothafuckin blow it out now everything is alright
78316,Logic,Hold up let me get my mind
78317,Logic,Let me get my mind let me get my mind right
78318,Logic,You know everything is alright
78319,Logic,You know everything is all
78320,Logic,Hatin mothafuckas I wanna off  em
78321,Logic,Hella endorphins got me livin life to the coffin
78322,Logic,Im coughin wonderin if Im goin insane
78323,Logic,But I be killin cause Im into the game
78324,Logic,Now lookin back its like aint nothin the same
78325,Logic,All these Spanish women watchin me like a novela
78326,Logic,Hit you with a Beretta get you wetter than a umbrella
78327,Logic,Aint nobody better do it like me
78328,Logic,I know a lot of mothafuckas dont like me
78329,Logic,But I just keep the peace no need to keep a piece
78330,Logic,I keep my enemies on a leash capiche 
78331,Logic,And keep it real for the people I reach
78332,Logic,Uh a ah yeah uh uh yeah yeah
78333,Logic,Uh a ah yeah uh uh yeah yeah
78334,Logic,Uh a ah yeah uh uh yeah yeah
78335,Logic,Uh a ah yeah uh uh yeah yeah
78336,Logic,Uh a ah yeah uh uh yeah yeah
78337,Logic,Uh a ah yeah uh uh yeah yeah
78338,Logic,Uh a ah yeah uh uh yeah yeah
78339,Logic,Uh a ah yeah uh uh yeah yeah
78340,Logic,All day  all day  everyday  everyday 
78341,Logic,We was on that block until we made a way  we made a way 
78342,Logic,Day to day man thats the only way  only way 
78343,Logic,They gon know my name until it fade away
78344,Logic,Fade away fade away fade away fade away fade away
78345,Logic,They gon know my name until it fade 
78346,Logic,They gon know my name until it fade away
78347,Logic,I been there I done that done that this rap shit I run that
78348,Logic,Motherfucker this far from a comeback if one of us fall then we run back
78349,Logic,Cant let that social worker just snatch up my kin gotta get my son back
78350,Logic,Cause when they coming through that system dont give a fuck about you  you you you 
78351,Logic,Everybody gonna die gonna go one day maybe itll happen on a Monday
78352,Logic,Driving to work and get hit by a Hyundai fuck it let it all go one day
78353,Logic,I know Ima get it like this living that life while they all reminisce
78354,Logic,Never regretted the second I said it I feel like Im smarter I read it on Reddit
78355,Logic,Youre fucking pathetic my etiquette murder ya predicate bitch Im ahead of it yeah
78356,Logic,Yes Ima die but I don t wonder why in the hell Ima ride in the dead of it yeah
78357,Logic,I know know life on Earth is so unpredictable
78358,Logic,Okay kay hold up let me say yes I fade away
78359,Logic,Fade away fade away fade away fade away fade away
78360,Logic,They gon know my name until it fade 
78361,Logic,They gon know my name until it fade away
78362,Logic,Tell me what I wouldnt wanna give for a life like this arm and a leg quite like this
78363,Logic,Fuck around wanna fight like this take a hike like this
78364,Logic,I might just might just I dont know
78365,Logic,Reinvention thats my intention
78366,Logic,Want so much more than this third dimension
78367,Logic,Thats not to mention my true ascension is a bigger picture
78368,Logic,No metaphor I m being real with ya
78369,Logic,But it will hit ya like  goddamn  
78370,Logic,Going HAM full of all of them
78371,Logic,In a spaceship I m in another system
78372,Logic,So futuristic on another mission
78373,Logic,But back on Earth everybody bitchin I been in the kitchen
78374,Logic,Livin my life no inhibition life to death with no intermission
78375,Logic,Now the good book said we all the same and we kill each other but its all in vain
78376,Logic,And we all to blame cant see the picture when its out the frame
78377,Logic,Real talk I wanna grip the grain and just ride with ya build a family then die richer
78378,Logic,When ya get to heaven Ima come and get ya
78379,Logic,Sit back and really get the picture
78380,Logic,This life yeah it done ate away hard times never stayed away
78381,Logic,But one thing I know day to day Ima do somethin fore I fade away
78382,Logic,Fade away fade away fade away fade away fade away
78383,Logic,They gon know my name until it fade 
78384,Logic,They gon know my name until it fade away
78385,Logic,Fade away fade away fade away fade away fade away
78386,Logic,They gon know my name until it fade 
78387,Logic,They gon know my name until it fade away
78388,Logic,KAI Nah man It s the same shit with a different title 
78389,Logic,THALIA That s not true Kai
78390,Logic,THOMAS Yeah man They didn t just upgrade features they enhanced her A I
78391,Logic,KAI So she can actually hold a conversation 
78392,Logic,THOMAS Yeah Ask her yourself
78393,Logic,KAI Uh what am I thinking Thalia 
78394,Logic,THALIA Kai I m a program in the ship s interface not a psychic
78395,Logic,THOMAS Yeah that s another thing now She s unisex
78396,Logic,THOMAS Thalia integrate Y chromosome feature
78397,Logic,THALIA Sure thing Thomas Would you like a standard accent or something a little more exotic 
78398,Logic,THOMAS Told you man The upgrade s crazy Thalia revert last command and run simulation
78399,Logic,KAI Man what the hell is that 
78400,Logic,THOMAS Well you can pick anyone in history and based off a collection of data it allows you to personally speak with them
78401,Logic,THOMAS All right let me get this straight You can speak with anyone in recorded history like Jesus Steve Jobs Einstein and you pick Big Sean 
78402,Logic,KAI Man fuck yeah That s my dog 
78403,Logic,THOMAS  Laughs Okay Thalia simulate Big Sean
78404,Logic,THALIA What up Kai you lil bitch 
78405,Logic,KAI Yeah Ima have to upgrade my shit
78406,Logic,If youre dealing war backwards stay far
78407,Logic,Were dealing with truths and rights
78408,Logic,Come some more into my sight
78409,Logic,Yeah in London talkin to Rhetorik bout my life and shit
78410,Logic,I thought the album was finished but I keep writing shit
78411,Logic,Its kind of funny how life changed and rearranged
78412,Logic,No matter what happens everything aint gon be the same
78413,Logic,The incredible album what an incredible outcome
78414,Logic,I grip the mic and then talk to the people like Im Malcolm
78415,Logic,I used to think the fame and money was the motivation
78416,Logic,Until I toured the world and met the people face to face and
78417,Logic,Understood that the power was harnessed in that basement
78418,Logic,It aint about the money and notoriety
78419,Logic,Its about the people and making a difference in society
78420,Logic,But dont get it twisted this life Im living is like a movie
78421,Logic,The Godfather the Goodfella wielding a Uzi
78422,Logic,One with the people if the people is wondering whos he 
78423,Logic,Same level the same rebel that never settled
78424,Logic,Pullin strings like Geppeto who overcame the ghetto
78425,Logic,And I know you wrote me and I still aint answered
78426,Logic,Cause shit is different now its forced upon me different stances
78427,Logic,I used to spend all my time conversing with you
78428,Logic,But now I write this song to let you know Im hurting with you
78429,Logic,Shit is too big but lets be honest man its kinda bittersweet
78430,Logic,Besides the shows and meet and greets yall only see me on the street
78431,Logic,And even then that shit is rare I just dont go outside
78432,Logic,Cause honestly I dont fuck with this world Id rather hide
78433,Logic,That misconception  Cause I rap I must be filled with pride 
78434,Logic,Shit I aint perfect if you heard different then someone lied
78435,Logic,People in my ear telling me  Talk that shit 
78436,Logic,Actions speak louder than words Id rather walk that shit
78437,Logic,Since the first album Im one of the highest earners on the label
78438,Logic,Within six months I put the second one on they table
78439,Logic,I played sold out shows in parts of the world I cant pronounce
78440,Logic,Release the tickets watch them disappear when we announce
78441,Logic,Fuck all that murderous syllable shit right now just let me bounce
78442,Logic,The mood around me is people smokin it by the ounce
78443,Logic,Leave Friday for the show and come back Monday with a hundred grand
78444,Logic,Dont fuck with checks so when I bounce I prefer cash in hand
78445,Logic,You know my first week looking crazy due to high demand
78446,Logic,Cause people dont buy music in this day and age they buy the brand
78447,Logic,Theres ups and downs dont get me wrong but back when I aint have shit
78448,Logic,Felt like I woulda sold my soul to make it with this rap shit
78449,Logic,Thank God he never let Lucifer close enough to ask
78450,Logic,Let me attain it by workin hard and busting my ass
78451,Logic,Achieved a lot in life but whats a lot with more to gain 
78452,Logic,At least I dont drink to avoid the hurt we call that champagne
78453,Logic,Come some more into my sight   
78454,Logic,Ive seen a lot of shit I shouldnt have but never forgot it though
78455,Logic,Brothers on the corner selling crack like it was nada though
78456,Logic,Walk inside my kitchen baking soda all up on the floor
78457,Logic,Police banging on the door while gripping a    
78458,Logic,I was just a youngin but this type of shit Ive seen before
78459,Logic,Yall see a white boy but my daddy a negro
78460,Logic,Half breed motherfucker grip the mic and he flow
78461,Logic,I just wanna spread love they want me to bleed slow
78462,Logic,I just wanna keep the peace and help people
78463,Logic,Give some of this money that Im making to the people
78464,Logic,So if you hatin on me goddamn you evil
78465,Logic,And just dont understand cause Im flyer than Knievel
78466,Logic,Been through a lot of shit but I keep it on the D Lo
78467,Logic,Never bustin in em streets but I keep it G though
78468,Logic,I aint into fairy tales Im just me ho 
78469,Logic,Only thing I talk about is everything that we know
78470,Logic,I heard youve got a fucking problem bitch I bet I beast
78471,Logic,Aint no need to reach I dont need a piece
78472,Logic,I just kill em with kindness yeah we leave  em deceased
78473,Logic,And tell it like it is so now you got it capeesh homie waddup 
78474,Logic,They think its a game right now  Yeah 
78475,Logic,But it aint the same right now know my name right now  Yeah 
78476,Logic,Back where I came from now
78477,Logic,We gon live it up till we bring it back down
78478,Logic,They think its a game right now
78479,Logic,But it aint the same right now know my name right now
78480,Logic,Back where I came from now
78481,Logic,We gon live it up till we bring it back down
78482,Logic,I hope you live a long life hatin
78483,Logic,Now watch every Grammy just to see who they nominating uh
78484,Logic,So successful they probably say I signed with Satan
78485,Logic,But I got God on my side always down to ride
78486,Logic,Dont get it twisted I aint perfect in the least
78487,Logic,Im still all up in your girl jeans like a crease
78488,Logic,Matter fact like a geneticist
78489,Logic,These rappers records comin out they so repetitive
78490,Logic,Shout out my homie Chance peace to Skizzy Mars
78491,Logic,Rattpack homie Castro we dropping bars
78492,Logic,Its all love man that shit is ours
78493,Logic,They never thought Id make it shooting for the stars
78494,Logic,Yeah Im a born sinner but its a Cole world
78495,Logic,Shout out my homies that know me cant forget my old girl
78496,Logic,But thats a touchy subject like a priest woah
78497,Logic,I heard yall finally eating over there we got a feast though
78498,Logic,Keep it Rattpack till the beat go
78499,Logic,You might not get the flow now let it seep though
78500,Logic,Fans know my lyrics deeper than the sea floor
78501,Logic,But we dumb it down so they spin it on the radio
78502,Logic,Racism all up in em that shit is irrelevant
78503,Logic,My flow is colorblind rapping for the hell of it
78504,Logic,I dont give a fuck my mindstate celibate
78505,Logic,Run quick tell a bitch rap getting me hella rich
78506,Logic,Out the blue like Ella Fitz my flow is so elegant
78507,Logic,Death before dishonor murderin rappers in front of they mommas
78508,Logic,I rep Artanis decipher the word cause its ebonics
78509,Logic,Reverse the letters and it spells Sinatra yes I gotcha bitch its Logic
78510,Logic,They think its a game right now  Yeah 
78511,Logic,But it aint the same right now know my name right now  Yeah 
78512,Logic,Back where I came from now
78513,Logic,We gon live it up till we bring it back down
78514,Logic,They think its a game right now
78515,Logic,But it aint the same right now know my name right now
78516,Logic,Back where I came from now
78517,Logic,We gon live it up till we bring it back down
78518,Logic,Im like  Oh God oh oh my God 
78519,Logic,Bitch I run the game yall just commentate from the side
78520,Logic,Im like  Oh God oh oh my God 
78521,Logic,Everything I do you know I do it for the squad
78522,Logic,Im like  Oh God oh oh my God 
78523,Logic,Bitch I run the game yall just commentate from the side
78524,Logic,Im like  Oh God oh oh my God 
