,artist,text
4026,A$AP Rocky,Say your prayer for a player amen inshallah
4027,A$AP Rocky,Been like that aint a damn thing change
4028,A$AP Rocky,Money on mind the red of my brain
4029,A$AP Rocky,Candy paint is gonna drip that stain
4030,A$AP Rocky,Lean on left the grip of my grain
4031,A$AP Rocky,See aint a damn thing change but the weather
4032,A$AP Rocky,So If you aint breakin bread then we cant even sit together
4033,A$AP Rocky,Gettin money is  what I do 
4034,A$AP Rocky,And just a couple of my brohans
4035,A$AP Rocky,Cuz I dont need no homeland
4036,A$AP Rocky,That means I am a grown man
4037,A$AP Rocky,Want beef and then we go HAM
4038,A$AP Rocky,Like whoa damn that old man
4039,A$AP Rocky,She twerkin it with no hands
4040,A$AP Rocky,They remind me of my old friends
4041,A$AP Rocky,My business aint the only thing her nose in
4042,A$AP Rocky,People takin pictures I aint even posin
4043,A$AP Rocky,Couple famous niggas make these bitches slow dance
4044,A$AP Rocky,Just for standin next to me
4045,A$AP Rocky,Dont get too close too close
4046,A$AP Rocky,Dont get too close too close
4047,A$AP Rocky,Just the standin next to me
4048,A$AP Rocky,Ass in my Aston lane switch
4049,A$AP Rocky,When the paint drip when I blast past
4050,A$AP Rocky, Yeah ho      jeans call them Balmain
4051,A$AP Rocky, Yeah ho Life is so ghetto fab call me Paul Cain
4052,A$AP Rocky,Thats the reason why Im with her
4053,A$AP Rocky,These other bitches bitter
4054,A$AP Rocky,Im the quickest picker upper
4055,A$AP Rocky,I will hit her then Ill quit her
4056,A$AP Rocky,Then I give her to my niggas
4057,A$AP Rocky,Im no kidder split her kitty litter
4058,A$AP Rocky,Then forget her like we never did her
4059,A$AP Rocky,Just for standin next to me
4060,A$AP Rocky,Dont get too close too close
4061,A$AP Rocky,Dont get too close too close
4062,A$AP Rocky,Just the standin next to me
4063,A$AP Rocky,My business aint the only thing her nose in
4064,A$AP Rocky,Went from ex pretty boy crook slash dope man
4065,A$AP Rocky,To handin out hundred dollar bills to the doorman
4066,A$AP Rocky,Now somebody please let the hoes in
4067,A$AP Rocky,Now somebody please let my bros in
4068,A$AP Rocky,Boy you wont believe how my foes end 
4069,A$AP Rocky,Overnight celebrities they party til the show ends
4070,A$AP Rocky,Dont get too close too close
4071,A$AP Rocky,Dont get too close too close
4072,A$AP Rocky,Just the standin next to me
4073,A$AP Rocky,Fuck home fuck sleep come clean zonin
4074,A$AP Rocky,Cant forget that Im golden cant forget where Im going
4075,A$AP Rocky,Fuck popo police enemies fake homies
4076,A$AP Rocky,Cant forget that Im a OG better act like you know it
4077,A$AP Rocky,Blunt smoke smoke weed codeine cough
4078,A$AP Rocky,Tell that bitch that Im awesome better back the fuck up off me
4079,A$AP Rocky,Coco C line Tiffany she flossy
4080,A$AP Rocky,Aint concerned with who bought these
4081,A$AP Rocky,Cant forget that she bossy
4082,A$AP Rocky,When yall was buying surfboards trying to ride the wave
4083,A$AP Rocky,I was cooking up another fucking tidal wave  brrrr 
4084,A$AP Rocky,Had to get entitled motherfuckers out the way
4085,A$AP Rocky,Had to take another title sorry for the wait
4086,A$AP Rocky,Barely ever took a break on fashion like my time need
4087,A$AP Rocky,More hours in a day I apologize if Im late
4088,A$AP Rocky,Tap the vein whoa barely look like Im awake
4089,A$AP Rocky,Darker shades bluer veins bluer money in the bankroll
4090,A$AP Rocky,Fuck home fuck sleep come clean zonin
4091,A$AP Rocky,Cant forget that Im golden cant forget where Im going
4092,A$AP Rocky,Fuck popo police enemies fake homies
4093,A$AP Rocky,Cant forget that Im a OG better act like you know it
4094,A$AP Rocky,When I was young and living homeless
4095,A$AP Rocky,Now I rock the Ricky Owens
4096,A$AP Rocky,Eyes lookin like they rollin
4097,A$AP Rocky,Got new bags under my eyelids
4098,A$AP Rocky,New bags like I went shoppin
4099,A$AP Rocky,Minds better at seeing two now
4100,A$AP Rocky,Hit the waves with the new sound
4101,A$AP Rocky,House tunes but its screwed down
4102,A$AP Rocky,Take a sec to thank the Lord nother one to call my folks
4103,A$AP Rocky,Hit my momma on the phone she like  Son you the boss 
4104,A$AP Rocky,Focus dont get caught up in the moment
4105,A$AP Rocky,Cant forget that Im golden dont forget that Im chosen
4106,A$AP Rocky,Fuck home fuck sleep come clean zonin
4107,A$AP Rocky,Cant forget that Im golden cant forget where Im going
4108,A$AP Rocky,Fuck popo police enemies fake homies
4109,A$AP Rocky,Cant forget that Im a OG better act like you know it
4110,A$AP Rocky,They called me a witch burned me like saffron
4111,A$AP Rocky,My matter is golden a child of the odyssey
4112,A$AP Rocky,My touch is righteous like virus my Midas
4113,A$AP Rocky,He told me when Im present Im chosen
4114,A$AP Rocky,So hold me tight I swear Im golden
4115,A$AP Rocky,Fuck home fuck sleep come clean zonin  golden 
4116,A$AP Rocky,Cant forget that Im golden cant forget where Im going
4117,A$AP Rocky,Fuck popo police enemies fake homies  golden 
4118,A$AP Rocky,Cant forget that Im a OG better act like you know it
4119,A$AP Rocky,Gotta find my way back home
4120,A$AP Rocky,Gotta find my way back home
4121,A$AP Rocky,War Lords we all Lords but we your Lords
4122,A$AP Rocky,Tryna find home next stop is the Waldorf
4123,A$AP Rocky,Past the racism and fake ism
4124,A$AP Rocky,Type of hate that make you feel worse than a rape victim
4125,A$AP Rocky,Raw dogs you other niggas mad soft mad I rap my ass off
4126,A$AP Rocky,They throwin mad salt til I go bath salt
4127,A$AP Rocky,On wax spitting heat to melt the wax off
4128,A$AP Rocky,Im Mr Miyagi in Issey Miyake
4129,A$AP Rocky,Asshole flow fuck name brands past logos
4130,A$AP Rocky,Now Im onto grand raps hands so low uh
4131,A$AP Rocky,Its like my fashion style is the life saver
4132,A$AP Rocky,Guess she wasnt satisfied with titties that Christ gave her
4133,A$AP Rocky,Bragging that her new ass shots is a life changer
4134,A$AP Rocky,Head so good on that girl that I might pay her or nah
4135,A$AP Rocky,Super laid back cat opposite of fat black Al Capone
4136,A$AP Rocky,Tell them lil niggas Flacko home
4137,A$AP Rocky,Gotta find my way back home
4138,A$AP Rocky,Gotta find my way back home
4139,A$AP Rocky,Gotta find my way back home
4140,A$AP Rocky,Gotta find my way back home
4141,A$AP Rocky,Uhh Father Lord forgive me as I load up the semi
4142,A$AP Rocky,Roll through the city that chose to resent me
4143,A$AP Rocky,Hold it dont load it reload it on plenty
4144,A$AP Rocky,Any foe or a   beep  that ever voted against me dissed me
4145,A$AP Rocky,Pissed me off then tried to hold it against me
4146,A$AP Rocky,Or wish we off the worst of luck that ever hated
4147,A$AP Rocky,Never hesitated the designated all of the wrong that they did me
4148,A$AP Rocky,Is stored in my memory all of the thoughts that I thought of
4149,A$AP Rocky,Sippin holy water like its bore from my kidneys
4150,A$AP Rocky,Load the smoke like a chimney make a toast for the memories
4151,A$AP Rocky,Make a toast for the henny its the best for the remedies
4152,A$AP Rocky,Energy synergy frienemies industries
4153,A$AP Rocky,Finna get advantage on him and his nemesis bitches been sniffing
4154,A$AP Rocky,If I if I aint the greatest bitch Im one of em
4155,A$AP Rocky,How in the fuck could you front on em 
4156,A$AP Rocky,My old ho beefing my ex wont be friends
4157,A$AP Rocky,Bronson told me not to eat ham rest in peace Yams
4158,A$AP Rocky,Gotta find my way back home
4159,A$AP Rocky,Gotta find my way back home
4160,A$AP Rocky,Gotta find my way back home
4161,A$AP Rocky,Gotta find my way back home
4162,A$AP Rocky,Rest in peace Yams RIP A AP Yamborghini
4163,A$AP Rocky,We gon take it uptown one time
4164,A$AP Rocky,We gon take em back home show em how me do
4165,A$AP Rocky,They call me Pretty Flacko ladies and gentlemen
4166,A$AP Rocky,Id like to introduce Pretty Flacko Sr
4167,A$AP Rocky,Magnum spectacular black man megalas
4168,A$AP Rocky,Shine amethyst fly champion its like that again
4169,A$AP Rocky,Whats happening Mathematics master blin
4170,A$AP Rocky,Flacko season all day erryday
4171,A$AP Rocky,Ask me how its going I tell em on and on and on and on and
4172,A$AP Rocky,You led me out to Arizona steady flowing staying golden
4173,A$AP Rocky,Sand cover ready rover Flacko glowing in that Owens
4174,A$AP Rocky,Thats how its going  Gotta find my way back home 
4175,A$AP Rocky,Huh awareness to the areas familiar with the routes
4176,A$AP Rocky,Travellin man moving through places
4177,A$AP Rocky,Space and time in a country called Earth
4178,A$AP Rocky,Nahmean These tacky ass muhfuckers be in the pictures
4179,A$AP Rocky,Wearing all types of motherfuckin red and green stripes
4180,A$AP Rocky,Over accessorizing out this motherfucker
4181,A$AP Rocky,We from Harlem we gave yall motherfuckers this wave
4182,A$AP Rocky,Grab yall surfboards cause yall got your boogie boards right now fucker
4183,A$AP Rocky,Yall just gon keep watching us at the beach shore
4184,A$AP Rocky,With your motherfuckin khakis rolled up
4185,A$AP Rocky,With your chancletas in your hand
4186,A$AP Rocky,And we just gon keep surfing on this motherfucker
4187,A$AP Rocky,Straight up Its ya boy A AP Yams Yamborghini
4188,A$AP Rocky,Yo Rock man let these motherfuckers know what it is
4189,A$AP Rocky,Out this motherfucker A AP bitch 
4190,A$AP Rocky,Uh my mic sounds nice check one  woo  
4191,A$AP Rocky,My mic sounds nice check two  uh huh yeah yeah 
4192,A$AP Rocky,Testing one two one two lets go  uh huh yeah yeah 
4193,A$AP Rocky,My mic sounds nice check one  yeah yeah 
4194,A$AP Rocky,My mic sounds nice check two  yeah testing testing woo  
4195,A$AP Rocky,Stoned stoned when Im in my zoney zone
4196,A$AP Rocky,Smokin on the homegrown feeling like Im all alone
4197,A$AP Rocky,Used to go to Kingdome Rucker Park with Tony Tone  Harlem  
4198,A$AP Rocky,Listenin to Bone Bone feelins in my bone bone
4199,A$AP Rocky,I can tell it I could give a fuck about a list ya heard  Ya heard  
4200,A$AP Rocky,I could give a fuck about a diss ya heard  Ya heard  
4201,A$AP Rocky,I could give a fuck about your clique ya heard  Ya heard  
4202,A$AP Rocky,Shut the fuck up fore I rock your bitch ya heard Uh
4203,A$AP Rocky,My mama named me my papa gave me cock to take a piss with
4204,A$AP Rocky,To fuck ya bitch with life is different for me for instance
4205,A$AP Rocky,The type of niggas spray his kids in some chicks
4206,A$AP Rocky,He wouldnt raise his kids with that type of twisted sick shit
4207,A$AP Rocky,What you say nigga Times out
4208,A$AP Rocky,Lets start over with this conversation
4209,A$AP Rocky,You sound super crazy right now
4210,A$AP Rocky,And I got my two kids listenin  Im just playing 
4211,A$AP Rocky,You said what  I said Im just  
4212,A$AP Rocky,Uh uh nigga you got me fucked up
4213,A$AP Rocky,I could give a fuck about a list ya heard  Ya heard  
4214,A$AP Rocky,I could give a fuck about a diss ya heard  Ya heard  
4215,A$AP Rocky,I could give a fuck about your clique ya heard  Ya heard  
4216,A$AP Rocky,Shut the fuck up fore I rock your bitch ya heard 
4217,A$AP Rocky,People really think Im an asshole I say anything  cmon 
4218,A$AP Rocky,Truthfully I just say what I really think
4219,A$AP Rocky,Like Im too fresh man to me youre under class man  too fresh 
4220,A$AP Rocky,Would say  Suck my dick  but thats sexual harassment  take that lets go  
4221,A$AP Rocky,Fuck around and really come through in a murse on ya  come on 
4222,A$AP Rocky,Who else you know design ya stage and do your merch over  Come on 
4223,A$AP Rocky,And if you lame do your verse over  yeah 
4224,A$AP Rocky,I changed the game like Im Kurt Warner  yeah keep going 
4225,A$AP Rocky,I run the game like Im Time Warner  yeah 
4226,A$AP Rocky,This aint no Teen Choice Awards slime slide on ya  keep goin yeah 
4227,A$AP Rocky,And make your home for mamas fried roasting
4228,A$AP Rocky,And Beams and leans Mercedes tomatoes
4229,A$AP Rocky,Had keys and grams just me and Yams
4230,A$AP Rocky,Pickin off the last collard greens stress up outta me
4231,A$AP Rocky,Now we sellin out the Coliseum for the dynasty
4232,A$AP Rocky,Tell them boys who got it locked and got the key
4233,A$AP Rocky,You gotta see behind the scenes were in the streets  A AP 
4234,A$AP Rocky,Peep my repertoire Uptown espionage
4235,A$AP Rocky,Eleanor Druham Nickel goin too HAM  cmon 
4236,A$AP Rocky,Lenox Ave VLONE Eastside Wayne Stone  yeah Uptown 
4237,A$AP Rocky,Stoned stoned when Im in my zoney zone
4238,A$AP Rocky,Smokin on the homegrown feeling like Im all alone  yeah 
4239,A$AP Rocky,Used to go to Kingdome Rucker Park with Tony Tone  cmon thats right 
4240,A$AP Rocky,Listenin to Bone Bone feelins in my bone bone  yeah yeah 
4241,A$AP Rocky,I can tell it I could give a fuck about a list ya heard  Take that yeah 
4242,A$AP Rocky,I could give a fuck about a diss ya heard  Ya heard  
4243,A$AP Rocky,I could give a fuck about your clique ya heard  Take that 
4244,A$AP Rocky,Shut the fuck up fore I rock your bitch ya heard Uh  take that take that 
4245,A$AP Rocky,Ayo we dont give a fuck about none of that shit
4246,A$AP Rocky,This is Harlem motherfuckers  yeah take that take that 
4247,A$AP Rocky,The fuck you think  Uptown nigga 
4248,A$AP Rocky,Mob A AP same gang Tone Wop
4249,A$AP Rocky,Real niggas put the clip in and let it go  uh 
4250,A$AP Rocky,Real niggas wanna run real  uh 
4251,A$AP Rocky,Real niggas from the roll real  ends where they buck shot 
4252,A$AP Rocky,Real niggas from the home  buck shot 
4253,A$AP Rocky,Homeboy you aint know  ends where they buck shot 
4254,A$AP Rocky,Had a bitch suckin on a lollipop at the bus stop
4255,A$AP Rocky,Green Glock red Glock  buck shot 
4256,A$AP Rocky,They aint really ready for me when I  buck shot 
4257,A$AP Rocky,They aint really ready for me when I  buck shot 
4258,A$AP Rocky,Niggas know not what nigga want not yeah
4259,A$AP Rocky,From the fort Fort Knox this aint Fortnite
4260,A$AP Rocky,Nigga get your shit rocked nigga
4261,A$AP Rocky,Buck shots uh uh  buck shot 
4262,A$AP Rocky,And my pictures like a mugshot
4263,A$AP Rocky,And all my bitches got butt shots
4264,A$AP Rocky,Eh buck shots left this man dead in the damn lot
4265,A$AP Rocky,In the kitchen pourin up the Wock  eh yeah 
4266,A$AP Rocky,Eh yeah buck shots everybody in this bitch got a mugshot
4267,A$AP Rocky,Push up now we on your block
4268,A$AP Rocky,Bitch Im off the bean and the damn Wock
4269,A$AP Rocky,Got a clip and its full  buck shot 
4270,A$AP Rocky,Leave a motherfucker in the  ends where they buck shot 
4271,A$AP Rocky,Man I was grown up since a young blood  buck shot 
4272,A$AP Rocky,Now Im bussin off shots  end where they buck shot 
4273,A$AP Rocky,Back in my younger days all I want was braids
4274,A$AP Rocky,All my mama want from me was grades  buck shot 
4275,A$AP Rocky,They aint really ready for me when I   buck shot 
4276,A$AP Rocky,One stop get some drugs and a damn Glock
4277,A$AP Rocky,Oh got them bullets aimin at your head top
4278,A$AP Rocky,AK   try to run up and we send shots  pew pew 
4279,A$AP Rocky,Walkin with my chains out on a opp block
4280,A$AP Rocky,Im with Drippy Drew dont try run up you get dropped off
4281,A$AP Rocky,Pull up flexin with the top down
4282,A$AP Rocky,Im with gang with some baddies on a yacht now yeah
4283,A$AP Rocky,Bought a brand new Mulsanne Gucci down now
4284,A$AP Rocky,Nigga you aint in my lane you a clown now yeah
4285,A$AP Rocky,Keep the semi tucked nigga what you want now yeah
4286,A$AP Rocky,Bought a brand new gun its gon catch you up yeah
4287,A$AP Rocky,Raf Simons on my feet I stay feet up yeah
4288,A$AP Rocky,Watch me pull up to the scene nigga Td up oh yeah
48020,Immortal Technique,I once knew a nigga whose real name was William
48021,Immortal Technique,His primary concern was makin a million
48022,Immortal Technique,Bein the illest hustler that the world ever seen
48023,Immortal Technique,He used to fuck movie stars and sniff coke in his dreams
48024,Immortal Technique,A corrupted young mind at the age of thirteen
48025,Immortal Technique,Nigga never had a father and his mom was a fiend
48026,Immortal Technique,She put the pipe down but for every year she was sober
48027,Immortal Technique,Her sons heart simultaneously grew colder
48028,Immortal Technique,He started hangin out sellin bags in the projects
48029,Immortal Technique,Checkin the young chicks lookin for hit and run prospects
48030,Immortal Technique,He was fascinated by material objects
48031,Immortal Technique,But he understood money never bought respect
48032,Immortal Technique,He built a reputation cause he could hustle and steal
48033,Immortal Technique,But got locked once and didnt hesitate to squeal
48034,Immortal Technique,So criminals he chilled with didnt think he was real
48035,Immortal Technique,You see me and niggas like this have never been equal
48036,Immortal Technique,I dont project my insecurities in other people
48037,Immortal Technique,He fiended for props like addicts with pipes and needles
48038,Immortal Technique,So he felt he had to prove to everyone he was evil
48039,Immortal Technique,A feeble minded young man with infinite potential
48040,Immortal Technique,The product of a ghetto bred capitalistic mental
48041,Immortal Technique,Coincidentally dropped out of school to sell weed
48042,Immortal Technique,Dancin with the Devil smoked until his eyes would bleed
48043,Immortal Technique,But he was sick of sellin trees and gave in to his greed
48044,Immortal Technique,Everyone tryin to be trife never face the consequences
48045,Immortal Technique,You probably only did a month for minor offenses
48046,Immortal Technique,Ask a nigga doin life if he had another chance
48047,Immortal Technique,But then again theres always the wicked that knew in advance
48048,Immortal Technique,Dance forever with the Devil on a cold cell block
48049,Immortal Technique,But thats what happens when you rape murder and sell rock
48050,Immortal Technique,Devils used to be Gods angels that fell from the top
48051,Immortal Technique,Theres no diversity because were burnin in the melting pot
48052,Immortal Technique,So Billy started robbin niggas anything he could do
48053,Immortal Technique,To get his respect back in the eyes of his crew
48054,Immortal Technique,Startin fights over little shit up on the block
48055,Immortal Technique,Stepped up to sellin mothers and brothers the crack rock
48056,Immortal Technique,Workin overtime for makin money for the crack spot
48057,Immortal Technique,Hit the jackpot and wanted to move up to cocaine
48058,Immortal Technique,Fulfillin the Scarface fantasy stuck in his brain
48059,Immortal Technique,Tired of the block niggas treatin him the same
48060,Immortal Technique,He wanted to be major like the cut throats and the thugs
48061,Immortal Technique,But when he tried to step to em niggas showed him no love
48062,Immortal Technique,They told him any motherfuckin coward can sell drugs
48063,Immortal Technique,Any bitch nigga with a gun can bust slugs
48064,Immortal Technique,Any nigga with a red shirt can front like a Blood
48065,Immortal Technique,Even Puffy smoked a motherfucker up in the club
48066,Immortal Technique,But only a real thug can stab someone til they die
48067,Immortal Technique,Standin in front of them starin straight into their eyes
48068,Immortal Technique,Billy realized that these men were well guarded
48069,Immortal Technique,And they wanted to test him before business started
48070,Immortal Technique,Suggested rapin a bitch to prove he was cold hearted
48071,Immortal Technique,So now he had a choice between goin back to his life
48072,Immortal Technique,Or makin money with made men up in the cyph
48073,Immortal Technique,His dreams about cars and ice made him agree
48074,Immortal Technique,A hardcore nigga is all he ever wanted to be
48075,Immortal Technique,And so he met them Friday night at a quarter to three
48076,Immortal Technique,Everyone tryin to be trife never face the consequences
48077,Immortal Technique,You probably only did a month for minor offenses
48078,Immortal Technique,Ask a nigga doin life if he had another chance
48079,Immortal Technique,But then again theres always the wicked that knew in advance
48080,Immortal Technique,Dance forever with the Devil on a cold cell block
48081,Immortal Technique,But thats what happens when you rape murder and sell rock
48082,Immortal Technique,Devils used to be Gods angels that fell from the top
48083,Immortal Technique,Theres no diversity because were burnin in the melting pot
48084,Immortal Technique,They drove around the projects slow while it was rainin
48085,Immortal Technique,Smokin blunts drinkin and jokin for entertainment
48086,Immortal Technique,Until they saw a woman on the street walkin alone
48087,Immortal Technique,Three in the mornin comin back from work on her way home
48088,Immortal Technique,And so they quietly got out the car and followed her
48089,Immortal Technique,Walkin through the projects the darkness swallowed her
48090,Immortal Technique,They wrapped her shirt around her head
48091,Immortal Technique,And knocked her onto the floor
48092,Immortal Technique, This is it kid now you got your chance to be raw  
48093,Immortal Technique,So Billy yoked her up and grabbed the chick by the hair
48094,Immortal Technique,And dragged her into a lobby that had nobody there
48095,Immortal Technique,She struggled hard but they forced her to go up the stairs
48096,Immortal Technique,They got to the roof and then held her down on the ground
48097,Immortal Technique,Screamin  Shut the fuck up and stop movin around  
48098,Immortal Technique,The shirt covered her face but she screamed and clawed
48099,Immortal Technique,So Billy stomped on the bitch until hed broken her jaw
48100,Immortal Technique,The dirty bastards knew exactly what they were doin
48101,Immortal Technique,They kicked her until they cracked her ribs and she stopped movin
48102,Immortal Technique,Blood leakin through the cloth she cried silently
48103,Immortal Technique,And then they all proceeded to rape her violently
48104,Immortal Technique,Billy was made to go first but each of them took a turn
48105,Immortal Technique,Rippin her up and chokin her until her throat burned
48106,Immortal Technique,Her broken jaw mumbled for God but they werent concerned
48107,Immortal Technique,When they were done and she was lyin
48108,Immortal Technique,One of them niggas pulled out a brand new twenty two
48109,Immortal Technique,They told him that she was a witness of what shed gone through
48110,Immortal Technique,And if he killed her he was guaranteed a spot in the crew
48111,Immortal Technique,He thought about it for a minute she was practically dead
48112,Immortal Technique,And so he leaned over and put the gun right to her head
48113,Immortal Technique,Im fallin and I cant turn back
48114,Immortal Technique,Im fallin and I cant turn back
48115,Immortal Technique,Right before he pulled the trigger and ended her life
48116,Immortal Technique,He thought about the cocaine with the platinum and ice
48117,Immortal Technique,And he felt strong standin along with his new brothers
48118,Immortal Technique,Cocked the gat to her head and pulled back the shirt cover
48119,Immortal Technique,But what he saw made him start to cringe and stutter
48120,Immortal Technique,Cause he was starin into the eyes of his own mother
48121,Immortal Technique,She looked back at him and cried cause he had forsaken her
48122,Immortal Technique,She cried more painfully than when they were rapin her
48123,Immortal Technique,His whole world stopped he couldnt even contemplate
48124,Immortal Technique,His corruption had successfully changed his fate
48125,Immortal Technique,And he remembered how his mom used to come home late
48126,Immortal Technique,Workin hard for nothin because now what was he worth 
48127,Immortal Technique,He turned away from the woman that had once given him birth
48128,Immortal Technique,And cryin out to the sky cause he was lonely and scared
48129,Immortal Technique,But only the Devil responded cause God wasnt there
48130,Immortal Technique,And right then he knew what it was to be empty and cold
48131,Immortal Technique,And so he jumped off the roof and died with no soul
48132,Immortal Technique,They say death takes you to a better place but I doubt it
48133,Immortal Technique,After that they killed his mother and never spoke about it
48134,Immortal Technique,And listen cause the story that Im tellin is true
48135,Immortal Technique,Cause I was there with Billy Jacobs and I raped his mom too
48136,Immortal Technique,And now the Devil follows me everywhere that I go
48137,Immortal Technique,In fact Im sure hes standin among one of you at my shows
48138,Immortal Technique,And every street cypher listenin to little thugs flow
48139,Immortal Technique,He could be standin right next to you and you wouldnt know
48140,Immortal Technique,The Devil grows inside the hearts of the selfish and wicked
48141,Immortal Technique,White brown yellow and black  color is not restricted
48142,Immortal Technique,You have a self destructive destiny when youre inflicted
48143,Immortal Technique,And youll be one of Gods children that fell from the top
48144,Immortal Technique,Theres no diversity because were burnin in the melting pot
48145,Immortal Technique,So when the Devil wants to dance with you you better say never
48146,Immortal Technique,Because a dance with the Devil might last you forever
48147,Immortal Technique,Oh yall motherfuckers thought it was over huh 
48148,Immortal Technique,Well it s not you didn t count on a fallen angel gettin back
48149,Immortal Technique,Into the grace of God and comin after you
48150,Immortal Technique,Y all niggas ain t shit your producers ain t shit
48151,Immortal Technique,Your fuckin A  R ain t shit
