,artist,text
4026,A$AP Rocky,Say your prayer for a player amen inshallah
4027,A$AP Rocky,Been like that aint a damn thing change
4028,A$AP Rocky,Money on mind the red of my brain
4029,A$AP Rocky,Candy paint is gonna drip that stain
4030,A$AP Rocky,Lean on left the grip of my grain
4031,A$AP Rocky,See aint a damn thing change but the weather
4032,A$AP Rocky,So If you aint breakin bread then we cant even sit together
4033,A$AP Rocky,Gettin money is  what I do 
4034,A$AP Rocky,And just a couple of my brohans
4035,A$AP Rocky,Cuz I dont need no homeland
4036,A$AP Rocky,That means I am a grown man
4037,A$AP Rocky,Want beef and then we go HAM
4038,A$AP Rocky,Like whoa damn that old man
4039,A$AP Rocky,She twerkin it with no hands
4040,A$AP Rocky,They remind me of my old friends
4041,A$AP Rocky,My business aint the only thing her nose in
4042,A$AP Rocky,People takin pictures I aint even posin
4043,A$AP Rocky,Couple famous niggas make these bitches slow dance
4044,A$AP Rocky,Just for standin next to me
4045,A$AP Rocky,Dont get too close too close
4046,A$AP Rocky,Dont get too close too close
4047,A$AP Rocky,Just the standin next to me
4048,A$AP Rocky,Ass in my Aston lane switch
4049,A$AP Rocky,When the paint drip when I blast past
4050,A$AP Rocky, Yeah ho      jeans call them Balmain
4051,A$AP Rocky, Yeah ho Life is so ghetto fab call me Paul Cain
4052,A$AP Rocky,Thats the reason why Im with her
4053,A$AP Rocky,These other bitches bitter
4054,A$AP Rocky,Im the quickest picker upper
4055,A$AP Rocky,I will hit her then Ill quit her
4056,A$AP Rocky,Then I give her to my niggas
4057,A$AP Rocky,Im no kidder split her kitty litter
4058,A$AP Rocky,Then forget her like we never did her
4059,A$AP Rocky,Just for standin next to me
4060,A$AP Rocky,Dont get too close too close
4061,A$AP Rocky,Dont get too close too close
4062,A$AP Rocky,Just the standin next to me
4063,A$AP Rocky,My business aint the only thing her nose in
4064,A$AP Rocky,Went from ex pretty boy crook slash dope man
4065,A$AP Rocky,To handin out hundred dollar bills to the doorman
4066,A$AP Rocky,Now somebody please let the hoes in
4067,A$AP Rocky,Now somebody please let my bros in
4068,A$AP Rocky,Boy you wont believe how my foes end 
4069,A$AP Rocky,Overnight celebrities they party til the show ends
4070,A$AP Rocky,Dont get too close too close
4071,A$AP Rocky,Dont get too close too close
4072,A$AP Rocky,Just the standin next to me
4073,A$AP Rocky,Fuck home fuck sleep come clean zonin
4074,A$AP Rocky,Cant forget that Im golden cant forget where Im going
4075,A$AP Rocky,Fuck popo police enemies fake homies
4076,A$AP Rocky,Cant forget that Im a OG better act like you know it
4077,A$AP Rocky,Blunt smoke smoke weed codeine cough
4078,A$AP Rocky,Tell that bitch that Im awesome better back the fuck up off me
4079,A$AP Rocky,Coco C line Tiffany she flossy
4080,A$AP Rocky,Aint concerned with who bought these
4081,A$AP Rocky,Cant forget that she bossy
4082,A$AP Rocky,When yall was buying surfboards trying to ride the wave
4083,A$AP Rocky,I was cooking up another fucking tidal wave  brrrr 
4084,A$AP Rocky,Had to get entitled motherfuckers out the way
4085,A$AP Rocky,Had to take another title sorry for the wait
4086,A$AP Rocky,Barely ever took a break on fashion like my time need
4087,A$AP Rocky,More hours in a day I apologize if Im late
4088,A$AP Rocky,Tap the vein whoa barely look like Im awake
4089,A$AP Rocky,Darker shades bluer veins bluer money in the bankroll
4090,A$AP Rocky,Fuck home fuck sleep come clean zonin
4091,A$AP Rocky,Cant forget that Im golden cant forget where Im going
4092,A$AP Rocky,Fuck popo police enemies fake homies
4093,A$AP Rocky,Cant forget that Im a OG better act like you know it
4094,A$AP Rocky,When I was young and living homeless
4095,A$AP Rocky,Now I rock the Ricky Owens
4096,A$AP Rocky,Eyes lookin like they rollin
4097,A$AP Rocky,Got new bags under my eyelids
4098,A$AP Rocky,New bags like I went shoppin
4099,A$AP Rocky,Minds better at seeing two now
4100,A$AP Rocky,Hit the waves with the new sound
4101,A$AP Rocky,House tunes but its screwed down
4102,A$AP Rocky,Take a sec to thank the Lord nother one to call my folks
4103,A$AP Rocky,Hit my momma on the phone she like  Son you the boss 
4104,A$AP Rocky,Focus dont get caught up in the moment
4105,A$AP Rocky,Cant forget that Im golden dont forget that Im chosen
4106,A$AP Rocky,Fuck home fuck sleep come clean zonin
4107,A$AP Rocky,Cant forget that Im golden cant forget where Im going
4108,A$AP Rocky,Fuck popo police enemies fake homies
4109,A$AP Rocky,Cant forget that Im a OG better act like you know it
4110,A$AP Rocky,They called me a witch burned me like saffron
4111,A$AP Rocky,My matter is golden a child of the odyssey
4112,A$AP Rocky,My touch is righteous like virus my Midas
4113,A$AP Rocky,He told me when Im present Im chosen
4114,A$AP Rocky,So hold me tight I swear Im golden
4115,A$AP Rocky,Fuck home fuck sleep come clean zonin  golden 
4116,A$AP Rocky,Cant forget that Im golden cant forget where Im going
4117,A$AP Rocky,Fuck popo police enemies fake homies  golden 
4118,A$AP Rocky,Cant forget that Im a OG better act like you know it
4119,A$AP Rocky,Gotta find my way back home
4120,A$AP Rocky,Gotta find my way back home
4121,A$AP Rocky,War Lords we all Lords but we your Lords
4122,A$AP Rocky,Tryna find home next stop is the Waldorf
4123,A$AP Rocky,Past the racism and fake ism
4124,A$AP Rocky,Type of hate that make you feel worse than a rape victim
4125,A$AP Rocky,Raw dogs you other niggas mad soft mad I rap my ass off
4126,A$AP Rocky,They throwin mad salt til I go bath salt
4127,A$AP Rocky,On wax spitting heat to melt the wax off
4128,A$AP Rocky,Im Mr Miyagi in Issey Miyake
4129,A$AP Rocky,Asshole flow fuck name brands past logos
4130,A$AP Rocky,Now Im onto grand raps hands so low uh
4131,A$AP Rocky,Its like my fashion style is the life saver
4132,A$AP Rocky,Guess she wasnt satisfied with titties that Christ gave her
4133,A$AP Rocky,Bragging that her new ass shots is a life changer
4134,A$AP Rocky,Head so good on that girl that I might pay her or nah
4135,A$AP Rocky,Super laid back cat opposite of fat black Al Capone
4136,A$AP Rocky,Tell them lil niggas Flacko home
4137,A$AP Rocky,Gotta find my way back home
4138,A$AP Rocky,Gotta find my way back home
4139,A$AP Rocky,Gotta find my way back home
4140,A$AP Rocky,Gotta find my way back home
4141,A$AP Rocky,Uhh Father Lord forgive me as I load up the semi
4142,A$AP Rocky,Roll through the city that chose to resent me
4143,A$AP Rocky,Hold it dont load it reload it on plenty
4144,A$AP Rocky,Any foe or a   beep  that ever voted against me dissed me
4145,A$AP Rocky,Pissed me off then tried to hold it against me
4146,A$AP Rocky,Or wish we off the worst of luck that ever hated
4147,A$AP Rocky,Never hesitated the designated all of the wrong that they did me
4148,A$AP Rocky,Is stored in my memory all of the thoughts that I thought of
4149,A$AP Rocky,Sippin holy water like its bore from my kidneys
4150,A$AP Rocky,Load the smoke like a chimney make a toast for the memories
4151,A$AP Rocky,Make a toast for the henny its the best for the remedies
4152,A$AP Rocky,Energy synergy frienemies industries
4153,A$AP Rocky,Finna get advantage on him and his nemesis bitches been sniffing
4154,A$AP Rocky,If I if I aint the greatest bitch Im one of em
4155,A$AP Rocky,How in the fuck could you front on em 
4156,A$AP Rocky,My old ho beefing my ex wont be friends
4157,A$AP Rocky,Bronson told me not to eat ham rest in peace Yams
4158,A$AP Rocky,Gotta find my way back home
4159,A$AP Rocky,Gotta find my way back home
4160,A$AP Rocky,Gotta find my way back home
4161,A$AP Rocky,Gotta find my way back home
4162,A$AP Rocky,Rest in peace Yams RIP A AP Yamborghini
4163,A$AP Rocky,We gon take it uptown one time
4164,A$AP Rocky,We gon take em back home show em how me do
4165,A$AP Rocky,They call me Pretty Flacko ladies and gentlemen
4166,A$AP Rocky,Id like to introduce Pretty Flacko Sr
4167,A$AP Rocky,Magnum spectacular black man megalas
4168,A$AP Rocky,Shine amethyst fly champion its like that again
4169,A$AP Rocky,Whats happening Mathematics master blin
4170,A$AP Rocky,Flacko season all day erryday
4171,A$AP Rocky,Ask me how its going I tell em on and on and on and on and
4172,A$AP Rocky,You led me out to Arizona steady flowing staying golden
4173,A$AP Rocky,Sand cover ready rover Flacko glowing in that Owens
4174,A$AP Rocky,Thats how its going  Gotta find my way back home 
4175,A$AP Rocky,Huh awareness to the areas familiar with the routes
4176,A$AP Rocky,Travellin man moving through places
4177,A$AP Rocky,Space and time in a country called Earth
4178,A$AP Rocky,Nahmean These tacky ass muhfuckers be in the pictures
4179,A$AP Rocky,Wearing all types of motherfuckin red and green stripes
4180,A$AP Rocky,Over accessorizing out this motherfucker
4181,A$AP Rocky,We from Harlem we gave yall motherfuckers this wave
4182,A$AP Rocky,Grab yall surfboards cause yall got your boogie boards right now fucker
4183,A$AP Rocky,Yall just gon keep watching us at the beach shore
4184,A$AP Rocky,With your motherfuckin khakis rolled up
4185,A$AP Rocky,With your chancletas in your hand
4186,A$AP Rocky,And we just gon keep surfing on this motherfucker
4187,A$AP Rocky,Straight up Its ya boy A AP Yams Yamborghini
4188,A$AP Rocky,Yo Rock man let these motherfuckers know what it is
4189,A$AP Rocky,Out this motherfucker A AP bitch 
4190,A$AP Rocky,Uh my mic sounds nice check one  woo  
4191,A$AP Rocky,My mic sounds nice check two  uh huh yeah yeah 
4192,A$AP Rocky,Testing one two one two lets go  uh huh yeah yeah 
4193,A$AP Rocky,My mic sounds nice check one  yeah yeah 
4194,A$AP Rocky,My mic sounds nice check two  yeah testing testing woo  
4195,A$AP Rocky,Stoned stoned when Im in my zoney zone
4196,A$AP Rocky,Smokin on the homegrown feeling like Im all alone
4197,A$AP Rocky,Used to go to Kingdome Rucker Park with Tony Tone  Harlem  
4198,A$AP Rocky,Listenin to Bone Bone feelins in my bone bone
4199,A$AP Rocky,I can tell it I could give a fuck about a list ya heard  Ya heard  
4200,A$AP Rocky,I could give a fuck about a diss ya heard  Ya heard  
4201,A$AP Rocky,I could give a fuck about your clique ya heard  Ya heard  
4202,A$AP Rocky,Shut the fuck up fore I rock your bitch ya heard Uh
4203,A$AP Rocky,My mama named me my papa gave me cock to take a piss with
4204,A$AP Rocky,To fuck ya bitch with life is different for me for instance
4205,A$AP Rocky,The type of niggas spray his kids in some chicks
4206,A$AP Rocky,He wouldnt raise his kids with that type of twisted sick shit
4207,A$AP Rocky,What you say nigga Times out
4208,A$AP Rocky,Lets start over with this conversation
4209,A$AP Rocky,You sound super crazy right now
4210,A$AP Rocky,And I got my two kids listenin  Im just playing 
4211,A$AP Rocky,You said what  I said Im just  
4212,A$AP Rocky,Uh uh nigga you got me fucked up
4213,A$AP Rocky,I could give a fuck about a list ya heard  Ya heard  
4214,A$AP Rocky,I could give a fuck about a diss ya heard  Ya heard  
4215,A$AP Rocky,I could give a fuck about your clique ya heard  Ya heard  
4216,A$AP Rocky,Shut the fuck up fore I rock your bitch ya heard 
4217,A$AP Rocky,People really think Im an asshole I say anything  cmon 
4218,A$AP Rocky,Truthfully I just say what I really think
4219,A$AP Rocky,Like Im too fresh man to me youre under class man  too fresh 
4220,A$AP Rocky,Would say  Suck my dick  but thats sexual harassment  take that lets go  
4221,A$AP Rocky,Fuck around and really come through in a murse on ya  come on 
4222,A$AP Rocky,Who else you know design ya stage and do your merch over  Come on 
4223,A$AP Rocky,And if you lame do your verse over  yeah 
4224,A$AP Rocky,I changed the game like Im Kurt Warner  yeah keep going 
4225,A$AP Rocky,I run the game like Im Time Warner  yeah 
4226,A$AP Rocky,This aint no Teen Choice Awards slime slide on ya  keep goin yeah 
4227,A$AP Rocky,And make your home for mamas fried roasting
4228,A$AP Rocky,And Beams and leans Mercedes tomatoes
4229,A$AP Rocky,Had keys and grams just me and Yams
4230,A$AP Rocky,Pickin off the last collard greens stress up outta me
4231,A$AP Rocky,Now we sellin out the Coliseum for the dynasty
4232,A$AP Rocky,Tell them boys who got it locked and got the key
4233,A$AP Rocky,You gotta see behind the scenes were in the streets  A AP 
4234,A$AP Rocky,Peep my repertoire Uptown espionage
4235,A$AP Rocky,Eleanor Druham Nickel goin too HAM  cmon 
4236,A$AP Rocky,Lenox Ave VLONE Eastside Wayne Stone  yeah Uptown 
4237,A$AP Rocky,Stoned stoned when Im in my zoney zone
4238,A$AP Rocky,Smokin on the homegrown feeling like Im all alone  yeah 
4239,A$AP Rocky,Used to go to Kingdome Rucker Park with Tony Tone  cmon thats right 
4240,A$AP Rocky,Listenin to Bone Bone feelins in my bone bone  yeah yeah 
4241,A$AP Rocky,I can tell it I could give a fuck about a list ya heard  Take that yeah 
4242,A$AP Rocky,I could give a fuck about a diss ya heard  Ya heard  
4243,A$AP Rocky,I could give a fuck about your clique ya heard  Take that 
4244,A$AP Rocky,Shut the fuck up fore I rock your bitch ya heard Uh  take that take that 
4245,A$AP Rocky,Ayo we dont give a fuck about none of that shit
4246,A$AP Rocky,This is Harlem motherfuckers  yeah take that take that 
4247,A$AP Rocky,The fuck you think  Uptown nigga 
4248,A$AP Rocky,Mob A AP same gang Tone Wop
4249,A$AP Rocky,Real niggas put the clip in and let it go  uh 
4250,A$AP Rocky,Real niggas wanna run real  uh 
4251,A$AP Rocky,Real niggas from the roll real  ends where they buck shot 
4252,A$AP Rocky,Real niggas from the home  buck shot 
4253,A$AP Rocky,Homeboy you aint know  ends where they buck shot 
4254,A$AP Rocky,Had a bitch suckin on a lollipop at the bus stop
4255,A$AP Rocky,Green Glock red Glock  buck shot 
4256,A$AP Rocky,They aint really ready for me when I  buck shot 
4257,A$AP Rocky,They aint really ready for me when I  buck shot 
4258,A$AP Rocky,Niggas know not what nigga want not yeah
4259,A$AP Rocky,From the fort Fort Knox this aint Fortnite
4260,A$AP Rocky,Nigga get your shit rocked nigga
4261,A$AP Rocky,Buck shots uh uh  buck shot 
4262,A$AP Rocky,And my pictures like a mugshot
4263,A$AP Rocky,And all my bitches got butt shots
4264,A$AP Rocky,Eh buck shots left this man dead in the damn lot
4265,A$AP Rocky,In the kitchen pourin up the Wock  eh yeah 
4266,A$AP Rocky,Eh yeah buck shots everybody in this bitch got a mugshot
4267,A$AP Rocky,Push up now we on your block
4268,A$AP Rocky,Bitch Im off the bean and the damn Wock
4269,A$AP Rocky,Got a clip and its full  buck shot 
4270,A$AP Rocky,Leave a motherfucker in the  ends where they buck shot 
4271,A$AP Rocky,Man I was grown up since a young blood  buck shot 
4272,A$AP Rocky,Now Im bussin off shots  end where they buck shot 
4273,A$AP Rocky,Back in my younger days all I want was braids
4274,A$AP Rocky,All my mama want from me was grades  buck shot 
4275,A$AP Rocky,They aint really ready for me when I   buck shot 
4276,A$AP Rocky,One stop get some drugs and a damn Glock
4277,A$AP Rocky,Oh got them bullets aimin at your head top
4278,A$AP Rocky,AK   try to run up and we send shots  pew pew 
4279,A$AP Rocky,Walkin with my chains out on a opp block
4280,A$AP Rocky,Im with Drippy Drew dont try run up you get dropped off
4281,A$AP Rocky,Pull up flexin with the top down
4282,A$AP Rocky,Im with gang with some baddies on a yacht now yeah
4283,A$AP Rocky,Bought a brand new Mulsanne Gucci down now
4284,A$AP Rocky,Nigga you aint in my lane you a clown now yeah
4285,A$AP Rocky,Keep the semi tucked nigga what you want now yeah
4286,A$AP Rocky,Bought a brand new gun its gon catch you up yeah
4287,A$AP Rocky,Raf Simons on my feet I stay feet up yeah
4288,A$AP Rocky,Watch me pull up to the scene nigga Td up oh yeah
7313,Bas,Do you still believe in love 
7314,Bas,Ran into a night owl rollin White Owls
7315,Bas,Girl its been awhile since I hit a White Owl
7316,Bas,Im with it though she a centerfold
7317,Bas,Big ol blunt look like tentacles
7318,Bas,She strip in Europe Interpol
7319,Bas,Dont remember her in her clothes
7320,Bas,I fucked her friend damn they was close
7321,Bas,Lets reunite lets get em close
7322,Bas,Hit em twice in a row hit a flight and Im ghost
7323,Bas,Thats the last time I seen her though
7324,Bas,She be gettin too eager ho
7325,Bas,Cheefin off of these berries
7326,Bas,When the world gets heavy and it hurts to carry
7327,Bas,Im her Midnight Mercenary Fiend
7328,Bas,She take me to a place that I never would discover
7329,Bas,Might never have another so I had to fuck her
7330,Bas,Reach into my pockets damn I aint got a rubber
7331,Bas,See my nigga Ron like L Ron Hubbard he be outta space
7332,Bas,Say he got a case of straps at the back of the hotel cupboard
7333,Bas,Room     check by the safe she say  Boy you got it made
7334,Bas,Do you got a cape   I aint with the games ma do I gotta wait 
7335,Bas,Im quite impatient intoxication got me feelin like procreating
7336,Bas,Girl Im the baker you surely caking
7337,Bas,Stand back catch my amazing graces
7338,Bas,Photo finish and fornication
7339,Bas,Photo finish and fornication fiend
7340,Bas,Feel the buzz ohh whoa yeah
7341,Bas,Whats your drug Whats your drug 
7342,Bas,Take it all the way from the beginning
7343,Bas,Now comes the question of which intro do you use 
7344,Bas,Do you use this intro or the other intro I was talkin on 
7345,Bas,But then that lets people know I had more than one take
7346,Bas,So maybe we should just not use this and use the other intro
7347,Bas,So people would think I just took it straight through
7348,Bas,Youd be surprised how many truths you can hide in flows
7349,Bas,Im listenin to this beat with my eyelids closed
7350,Bas,Thoughts keep flashin and I keep laughin
7351,Bas,I never thought that I would fuck Irish hoes
7352,Bas,Maybe Asian bitches or Caucasian bitches
7353,Bas,Remember when I got to New York I was lost
7354,Bas,Because all I ever saw was Jamaican bitches
7355,Bas,I aint barely know what Jamrock was
7356,Bas,Lil country nigga God damn I was
7357,Bas,To you niggas talkin online until you make it this high
7358,Bas,Then you could never understand this buzz well
7359,Bas,Maybe if you put yourself in the shoes
7360,Bas,Of a nigga comin straight out the South
7361,Bas,No gold grill just a east coast feel
7362,Bas,And a set of crooked teeth in his mouth
7363,Bas,Make them hoes bounce that cant get enough
7364,Bas,Niggas say I made it I aint make it enough
7365,Bas,Man hang that nigga you a real lame ass nigga
7366,Bas,If you aint got my tape in your truck
7367,Bas,Cole uhm world dont you forget that
7368,Bas,I think I lost my mind round the same time I lost my six pack
7369,Bas,But no sit ups for me long as my dick still get up for me
7370,Bas,Long as a ho still give up for me
7371,Bas,She usually charge but she get us for free
7372,Bas,Woah thats TMI lil something like TMZ
7373,Bas,Scared of the days youll be seeing me
7374,Bas,Cause my girl do not play coach DNP
7375,Bas,Thats something for the hoop fans
7376,Bas,Just copped her the coupe man
7377,Bas,No drop top but a slot on the roof that can slide out
7378,Bas,And get a little sun while you ride out
7379,Bas,Ced on the beat let me vibe out
7380,Bas,We was   with a ASR up in my house
7381,Bas,Writin rhymes out momma made it happen
7382,Bas,Couldve been a lawyer but I made it rappin
7383,Bas,He made it rappin now at the shows he the main attraction
7384,Bas,Another shot of Henny so Im faded askin
7385,Bas,How long do this drug called fame be lastin 
7386,Bas,Another shot of Henny so Im faded askin
7387,Bas,How long do this drug called fame be lastin 
7388,Bas,I wont let it out until you let me know if you love it
7389,Bas,Im on my night job my niggas riding my city understand us
7390,Bas,See a hundred bandits each put a hundred bands up
7391,Bas,They cant call us bandits no more
7392,Bas,Same hood same corner store
7393,Bas,But them same old hoes aint wearing panties no more
7394,Bas,Im on my night job slim waist with them fat thighs
7395,Bas,Never been baptized but she soak me all in her holy water
7396,Bas,Im one of five she the only daughter she aint used to sharing
7397,Bas,I aint used to caring lets play truth or dare
7398,Bas,Cause lately my lifestyles like dynamite
7399,Bas,Imma go lights out like Dyna might
7400,Bas,Smoke one that I might Im on my night job
7401,Bas,Always knew how to play these cards of mine
7402,Bas,Fuck rap we seen harder times
7403,Bas,Jump back like Vinny Carter prime
7404,Bas,I wont let it out until you let me know if you love it
7405,Bas,Im on my night job yall niggas jivin Im back up in position
7406,Bas,Earnhardt Imma catch some nigga slippin
7407,Bas,Burn hard on a track and get to whippin
7408,Bas,Im on my night job why is it always blacks that get detention 
7409,Bas,For my nigga with the pass to get the flip in
7410,Bas,Boy that trap is a accurate description
7411,Bas,Im on my night job finally got Bassy off the corner
7412,Bas,   niggas thought he was a goner
7413,Bas,He ducked shots now its  Bas we got a phoner 
7414,Bas,Im on my night job flew the posse out to Rome and
7415,Bas,Wont tell you bout no Bo   Key Yacht  dont want em
7416,Bas,Nigga word to Selassie I Im zonin
7417,Bas,Got old niggas tryna bite cause they cant capture
7418,Bas,The feeling from days fore the game passed em
7419,Bas,Niggas out here lookin like a bunch of Dame Dashes
7420,Bas,That aint better than your last work
7421,Bas,Cigarette let the ash burn
7422,Bas,Omen said dont worry bout the last word
7423,Bas,Ima hit the gas swerve on em Skrr 
7424,Bas,Too high to riot thats my best excuse for being lazy
7425,Bas,Being an artist thats the best excuse for being crazy
7426,Bas,Ive been so infatuated went to Clark and graduated
7427,Bas,Now she on my face time and my nigga she just masturbated
7428,Bas,Fuck a album release party Im out in the streets shawty
7429,Bas,How many rappers I killed counted at least forty
7430,Bas,Nah I aint God but shawty down on her knees for me
7431,Bas,Im horny like that Coltrane album
7432,Bas,A Love Supreme thats cold fame album
7433,Bas,Lately Ive been dancing like a Soul Train album
7434,Bas,Lately silly making songs talkin bout how they hate me
7435,Bas,Theyve been loving me this whole time
7436,Bas,My only adversary was my own mind
7437,Bas,Killed my ego now Im snappin like its   
7438,Bas,With a gold mine of inspiration for yall
7439,Bas,Fuck your co sign that nigga cant fuck with Cole neither
7440,Bas,Dont ask for a feature we bring a whole liter of ether
7441,Bas,To eat ya we got heat for niggas keep reachin
7442,Bas,If these bullets was heat seeking
7443,Bas,They wouldnt even reach you niggas
7444,Bas,I just came up On some grey   s
7445,Bas,Great health cheers to that
7446,Bas,Do this shit for Queens got my ears to that
7447,Bas,They hate us but not more they hate theyselves
7448,Bas,I guess that they gotta motivate theyselves
7449,Bas,We can never correlate you will never see my plane
7450,Bas,Right in front of you but your vision is so plain
7451,Bas,I see it more vivid seen it all did it
7452,Bas,Round these fake fucks still keep it authentic granted
7453,Bas,Give or take fucks how your measures rate us
7454,Bas,Damnit youll never understand it
7455,Bas,Ive seen the cards handed and I replayed mine
7456,Bas,But Im never off handed gotta keep good time
7457,Bas,Free your mind and everythingll follow wont you
7458,Bas,Free your mind and everythingll follow wont you
7459,Bas,Listen when you get a blessin you dont ask why
7460,Bas,You just pass forward and fast forward
7461,Bas,All my niggas from the hood got a passport
7462,Bas,And them girls already know we aint ask for it
7463,Bas,Said she from the hood but her ass foreign
7464,Bas,Drive a Malibu but her gas foreign
7465,Bas,Her aspirations I cant relate with
7466,Bas,But Im like a ghost cause my ass tourin
7467,Bas,Burn holes in all my clothes
7468,Bas,But I got merch and this cash for it
7469,Bas,Glass floors and no ceilings
7470,Bas,How I wish we could both feel it
7471,Bas,For all the ones gone cause I miss your breathing
7472,Bas,Any yall saw came any yall part
7473,Bas,Penny my thoughts nah this shit premium
7474,Bas,Free your mind and everythingll follow wont you
7475,Bas,Free your mind and everythingll follow wont you
7476,Bas,And everythingll follow got to
7477,Bas,Free your mind and everythingll follow gotta
7478,Bas,Free your mind and everythingll follow gotta
7479,Bas,Free your mind and everythingll    Cole
7480,Bas,Tell the good Lord we gon raise hell
7481,Bas,We gon pop off like a fake nail
7482,Bas,Take the top off and get ill get ill get
7483,Bas,Tell the fuckin mayor he got hate mail
7484,Bas,Less shakedowns and more Shakespeare
7485,Bas,Please all these niggas dont care
7486,Bas,Prepare for the new shit that Cole is the truth shit
7487,Bas,Nigga this is Lu shit nigga this is Bas shit
7488,Bas,Meaning this some true shit telling you shit
7489,Bas,Bout the crew how we do shit who sick 
7490,Bas,And tell my niggas in the two six in the coupe
7491,Bas,Imma kick back smoke a pool stick
7492,Bas,This for my new chick tryin get fit say she too thick
7493,Bas,Aint no such thing as too thick what you wanna be a toothpick 
7494,Bas,What you wanna get your cooch licked 
7495,Bas,Well Im tryna get my flute played
7496,Bas,I am Frederick Douglass of rhetoric ahead the the others
7497,Bas,You motherfuckas better get free
7498,Bas,This for that insecure girl your name I wont mention
7499,Bas,On Instagram straight flickin
7500,Bas,Bitch you a nipple slip away from strippin
7501,Bas,Might as well get your clientele up you a pioneer
7502,Bas,Them girls fuck for free Im never buying there
7503,Bas,Save that shit for the D R
7504,Bas,I rock crowns and these niggas rock tiaras or tiaras
7505,Bas,Cause Im Pete Carroll left college and I fucked the pros up
7506,Bas,Guess it aint luck when the luck just shows up
7507,Bas,Like every verse on the spot shit is never rehearsed
