,artist,text
110140,Scarface,And we dont talk to police
110141,Scarface,Thats the number one rule on the streets
110142,Scarface,Cause if you cant do the time then you dont do the crime
110143,Scarface,Nigga keep the streets quiet
110144,Scarface,You dont upstrap unless you have to
110145,Scarface,Bullshit with these niggas and they clap you
110146,Scarface,Dig two graves just in case its two bodies
110147,Scarface,And never bring a stick to a gunfight
110148,Scarface,One shot one kill you get one life
110149,Scarface,And shitting where you sleep aint an option
110150,Scarface,People knowing where you sleep thats a problem
110151,Scarface,You got to watch these niggas
110152,Scarface,They aint your home boys not these niggas
110153,Scarface,First chance you call sleep they could murk you
110154,Scarface,So dont put squares in your circle
110155,Scarface,Cos these streets dont love nobody
110156,Scarface,You gotta pay attention to the signs Johnny
110157,Scarface,If you a weak nigga dont try to play hard
110158,Scarface,Better keep your punk ass out the yard
110159,Scarface,And dont get fronted just avoid that
110160,Scarface,But if you have to pay them boys back
110161,Scarface,Cos niggas aint playing its a drought
110162,Scarface,The border is closed the cash running out
110163,Scarface,And broke mother fuckers make the best crooks
110164,Scarface,Every nigga in the way getting shook
110165,Scarface,You got to play the game by the book
110166,Scarface,I fuck around and your life getting took
110167,Scarface,And last but not least when you make that money
110168,Scarface,Keep it low pro dont say shit dummy
110169,Scarface,And dont say shit to your girlfriend
110170,Scarface,Pillow talk will send your ass to the state pen
110171,Scarface,Take notes to the game Im providing
110172,Scarface,Stop using momma names trynna hide shit
110173,Scarface,Nigga them feds aint stupid
110174,Scarface,You aint the only nigga trynna do this
110175,Scarface,Riding round the hood in a four door
110176,Scarface,Flying spur ol rims trynna showboat
110177,Scarface,You drawing too much attention
110178,Scarface,And then be surprised when you catch a life sentence
110179,Scarface,The game is a thing that you boys should be proud of
110180,Scarface,But once you in it its hard to get out of
110181,Scarface,And greed will kill a nigga like a gun do
110182,Scarface,So when you get the chance to make a break for it run fool
110183,Scarface,Staring down the barrel of a Colt    
110184,Scarface,Im feeling mad suicidal so I think Im gonna drive
110185,Scarface,Everything is hazy and I cant see my lanes
110186,Scarface,Demons got me seeing double in the rain
110187,Scarface,If I put the pedal to the metal take my hands off the wheel
110188,Scarface,Lord if you hear me steer steer
110189,Scarface,I think I need to breathe cuz I aint feeling right
110190,Scarface,My conscience is at ease saying live your life
110191,Scarface,Got everything I aint missin much bruh
110192,Scarface,Got my little paper back I aint feeling fucked up
110193,Scarface,My woman got my back so I aint stressed out
110194,Scarface,Side looking in you can say I m blessed huh
110195,Scarface,Career still intact got my street cred
110196,Scarface,Went on with life thinking that the beef s dead
110197,Scarface,But every now and then I get flash backs
110198,Scarface,Get down on my knees and I ask that
110199,Scarface,God keep my head on cuz I dont wanna spaz out
110200,Scarface,Load back up that   and air a nigga ass out
110201,Scarface,Staring down the barrel of a Colt    
110202,Scarface,Im feeling mad suicidal so I think Im gonna drive
110203,Scarface,Everything is hazy and I cant see my lanes
110204,Scarface,Demons got me seeing double in the rain
110205,Scarface,If I put the pedal to the metal take my hands of the wheel
110206,Scarface,Lord if you hear me steer steer
110207,Scarface,Awaken by the sound of the siren
110208,Scarface,Helicopter spotlights illuminate the crime scene
110209,Scarface,Crowd gathers round try to find out what the fuck just happened
110210,Scarface,I looked a little closer at my t shirt
110211,Scarface,I see squirts of blood just now starting to bleed worse
110212,Scarface,Im lost I got blood on my hands though
110213,Scarface,And then the camera man starts to pan slow
110214,Scarface,Realizing what Im up against
110215,Scarface,I guess I just have to face the consequence
110216,Scarface,I gotta think fast got some motherfuckers after me
110217,Scarface,Paranoid got me running for my life now
110218,Scarface,Homicide questioning my mama and my wife now
110219,Scarface,Parking lot full of cops got the dogs out
110220,Scarface,Running chest burning out of breath
110221,Scarface,Hit the corner parked car at the stop sign
110222,Scarface,Going back to jail aint the plan so the outline
110223,Scarface,Is to come up with something so I escape this or hand cuffs
110224,Scarface,Fuck that I aint gonna take shit
110225,Scarface,I rather be carried by  than judged by   getting that cell
110226,Scarface,Or maybe they gon gun a nigga down
110227,Scarface,Cause they dont wanna see me in the trial
110228,Scarface,Everything is hazy and I cant see my lanes
110229,Scarface,Demons got me seeing double in the rain
110230,Scarface,If I put the pedal to the metal take my hands of the wheel
110231,Scarface,Lord if you hear me steer steer
110232,Scarface,Ghetto niggas remain violent while the killers remain silent
110233,Scarface,Niggas strapped with   s and aint smiling
110234,Scarface,And Im driving to a place theyre all warrin
110235,Scarface,The lake we build houses but its the hood we call home
110236,Scarface,In the ghetto the only place a motherfucker will keep it real
110237,Scarface,We focused on the dollar bill still
110238,Scarface,The outsiders tend to disrespect the place
110239,Scarface,Where niggas do they struggling die with a straight face
110240,Scarface,Surviving under conditions demons died in
110241,Scarface,You can run it but cant hide it so step aside
110242,Scarface,Its the nigga that makes music for the streets
110243,Scarface,Cause I love this motherfucker like pussy with no sheets
110244,Scarface,Some niggas make it out the neighborhood and wont surface
110245,Scarface,And let the money make them nervous whats the purpose 
110246,Scarface,A motherfucker sitting on fat
110247,Scarface,Who done came up in the hood but he cant come back
110248,Scarface,Fuck that I remain in the street game frame
110249,Scarface,On a mission to maintain me and take aim
110250,Scarface,In position to let my opposition know my life
110251,Scarface,Cause off in these streets I keep it real but whats right 
110252,Scarface,Surviving sitting on a key doing business on a beeper
110253,Scarface,Im sinking in this motherfucker deeper
110254,Scarface,Fear the reaper that no man born or woman harm me
110255,Scarface,Fuck being a nigga in your army though Im a killer
110256,Scarface,Enter the ghetto so that you can see
110257,Scarface,What I mean when I say I love this cause it loves me
110258,Scarface,Let it be stop looking at this motherfucker strange
110259,Scarface,And talking bout a motherfucking change
110260,Scarface,This is for my thug niggas
110261,Scarface,This one for the homies and the thug niggas  uuuuugh 
110262,Scarface,This one for the homies and the thug niggas  uuuuugh 
110263,Scarface,This one for the homies and the thug niggas  uuuuugh 
110264,Scarface,This one for the homies and the thug niggas  uuuuugh 
110265,Scarface,This one for the homies and the thug niggas  uuuuugh 
110266,Scarface,This one for the homies and the thug niggas
110267,Scarface,Face imagine us working at McDonalds
110268,Scarface,To me and you selling fucking tapes to the Bahamas
110269,Scarface,Gold slug a car full of thug niggas
110270,Scarface,Twenty inch wheels candy paint so we drug dealers
110271,Scarface,No Limit soldiers to the fullest
110272,Scarface,See I was raised on red beans the size of some bullets huh
110273,Scarface,We ghetto niggas cant be stopped
110274,Scarface,Got me mixing up dope with little J down at Rap A Lot
110275,Scarface,My phone tapped the feds on my tail
110276,Scarface,Got me paying luxury taxes on everything I build
110277,Scarface,True to the ghetto thats my life
110278,Scarface,You see that house on the lake its for the kids and the wife
110279,Scarface,You can test me if you wanna
110280,Scarface,Cause I be dumping niggas off from New Orleans to California
110281,Scarface,Rowdy like a hurricane  uuuuuugh 
110282,Scarface,Independent black owned got em hooked on this cocaine
110283,Scarface,You used to see CEO s in suits and ties
110284,Scarface,But we young niggas in tennis shoes and diamonds
110285,Scarface,Executive street millionaires
110286,Scarface,Niggas gonna be bout it bout til we gray in the wheel chair
110287,Scarface,This one for the homies and the thug niggas  uuuuugh 
110288,Scarface,This one for the homies and the thug niggas  uuuuugh 
110289,Scarface,This one for the homies and the thug niggas  uuuuugh 
110290,Scarface,This one for the homies and the thug niggas  uuuuugh 
110291,Scarface,This one for the homies and the thug niggas  uuuuugh 
110292,Scarface,This one for the homies and the thug niggas
110293,Scarface,What do you get from boosting 
110294,Scarface,Niggas coming out to California and represent them niggas from
110295,Scarface,And now  Pac ll keep this shit popping
110296,Scarface,And all my niggas across the Bay know L A  keep the shit hot
110297,Scarface,I keep a Glock inside my pants  dont give Locaz a chance
110298,Scarface,Put me inside a casket you dirty bastards
110299,Scarface,Until the day I die you catch a nigga high off weed the police cant
110300,Scarface,My shit will drop and Ill sell five million
110301,Scarface,While all the niggas enter the game they caught up in drug dealing
110302,Scarface,Now how can I fall how can I ball how can I catch my enemies and murder em all 
110303,Scarface,My words of flame burn niggas inside their brain
110304,Scarface,Niggas cant hang with me and nuttins changes uh
110305,Scarface,Scarface got me on this shit
110306,Scarface,We lace heat motherfuckers in they body and face uh
110307,Scarface,Growing thicker liquor maybe ya daddy a nigga
110308,Scarface,Niggas dont wanna see me worldwide mob figure
110309,Scarface,M O B  Hennessy keep me gd and
110310,Scarface,Keyed niggas don t wanna see me when I got weed in my system
110311,Scarface,Catch another victim capture bodies
110312,Scarface,Bring a shottie to the fucking party yeah
110313,Scarface,I do this shit cause its wrong but we born right
110314,Scarface,And to these niggas in my zone we do it long ways
110315,Scarface,til these bitches understand nigga my song pays cause Im the man
110316,Scarface,Now these are my homeboys we outlaws til the day we die
110317,Scarface,Keep this shit rough and raw
110318,Scarface,My    make sho that I survived to another day
110319,Scarface,Just bust rhymes and brothers get paid
110320,Scarface,Now thats the end of my freestyle but it was laced with game
110321,Scarface,Buy my shit and you can hear it plain West Side 
110322,Scarface,This one for the homies and the thug niggas  uuuuugh 
110323,Scarface,This one for the homies and the thug niggas  uuuuugh 
110324,Scarface,This one for the homies and the thug niggas  uuuuugh 
110325,Scarface,This one for the homies and the thug niggas  uuuuugh 
110326,Scarface,This one for the homies and the thug niggas  uuuuugh 
110327,Scarface,This one for the homies and the thug niggas
110328,Scarface,Represent for the niggas in the hood and how they livin
110329,Scarface,Hustlin til you touch a  to  of drug dealin
110330,Scarface,It dont matter how I get it I got it fuck feelings
110331,Scarface,I dont have none Im bout my paper nigga ask em
110332,Scarface,Dont get confused on how the cash come
110333,Scarface,Never by any means necessary better
110334,Scarface,Get up off your ass and get my money fore I stretch yah
110335,Scarface,Out in front your doorstep when I brandish this    th
110336,Scarface,You can make arrangements you a dead man a ghost
110337,Scarface,See I come from them cuts for real
110338,Scarface,Much long before this rap came fuck the deal
110339,Scarface,I survived the game of life nigga fuck some skills
110340,Scarface,Crossin me get in the way this pussy must get killed
110341,Scarface,Im alive he came he bust til he left
110342,Scarface,I would have made for sure I was dead and fuck yourself
110343,Scarface,Yeah cause now Im at his ass with a vengeance
110344,Scarface,Blood in blood out from the beginning to the ending
110345,Scarface,Real shit bein spit know your limits
110346,Scarface,Its best you mind your mothafuckin business
110347,Scarface,Gotta pack a pistol plus talk to God in these streets
110348,Scarface,Go to church Sunday Monday sellin raw in these streets
110349,Scarface,Never took it home though I left it all in these streets
110350,Scarface,I aint promotin no eviction notice on the door
110351,Scarface,Fuck it I had to go for broke
110352,Scarface,Riskin   years just to see another first
110353,Scarface,I was all alone car full of niggas
110354,Scarface,Howd I get here Car full of hittas
110355,Scarface,I was rollin weed they was snortin blow
110356,Scarface,Such a cool breeze heart so cold
110357,Scarface,Step up to the plate where your money at 
110358,Scarface,Bobby Brown on cake with a hundred packs
110359,Scarface,We were secret lovers had to get a beeper
110360,Scarface,My Atlantic star not a Notre Dame
110361,Scarface,Not a student loan tried to motivate
110362,Scarface,Continental my Bentley this shit should be illegal
110363,Scarface,Selassie eye in the ghost thousand bales of that diesel
110364,Scarface,Lord go toe to toe with any pussy boy
110365,Scarface,Fuck one time for Face and all the Boobie boys
110366,Scarface,Where Im from a half a keyll set a nigga straight
110367,Scarface,I just wanna make the car notes
110368,Scarface,Let mama make the pot roast
110369,Scarface,You should meet me at the car wash
110370,Scarface,Washin all   thats inshallah
110371,Scarface,Gotta pack a pistol plus talk to God in these streets
110372,Scarface,Go to church Sunday Monday sellin raw in these streets
110373,Scarface,Never took it home though I left it all in these streets
110374,Scarface,I aint promotin no eviction notice on the door
110375,Scarface,Fuck it I had to go for broke
110376,Scarface,Riskin   years just to see another verse
110377,Scarface,Speakin for those squeakin in them cell blocks readin
110378,Scarface,To blacks whites and Puerto Ricans
110379,Scarface,Brothers with those ankle bracelets impatient for their releasin
110380,Scarface,To make it back to the block the hatred the present
110381,Scarface,Time sure flies look how many years went by
110382,Scarface,My young niggas already need hair dye
110383,Scarface,Alcoholic faces women bad as a mug
110384,Scarface,Fried food be addin up the system thrives off its victims
110385,Scarface,They ask how this economic collapse
110386,Scarface,Can affect people all over the map
110387,Scarface,Tea party for tax reenactment is whack
110388,Scarface,The past the past yo to my vatos out in the East Los
110389,Scarface,Nietas on the east coast shouts to Puerto Rico
110390,Scarface,Dominican Republic people rep I
110391,Scarface,Brown and black we must get it together
110392,Scarface,The prison industrial complex a fuckin set up
110393,Scarface,The Aztec Olmec African settled on this land from the get up
110394,Scarface,I changed my aim who Im gon wet up
110395,Scarface,When violence is resorted knowledge is distorted
110396,Scarface,Unless its payback for brutality
110397,Scarface,Im more or less with that get back
110398,Scarface,Gotta pack a pistol plus talk to God in these streets
110399,Scarface,Go to church Sunday Monday sellin raw in these streets
110400,Scarface,Never took it home though I left it all in these streets
110401,Scarface,I aint promotin no eviction notice on the door
110402,Scarface,Fuck it I had to go for broke
110403,Scarface,Riskin   years just to see another verse
110404,Scarface,Mr Mr Scarface been walking down the block
110405,Scarface,Out jumps some fiends and steals all his rocks
110406,Scarface,Pulls out a gun and shoots down all the fiends
110407,Scarface,And Mr Mr Scarface went up the block again
110408,Scarface,All I have in this world all I have in this world
110409,Scarface,All I have all I have all I have in this world
110410,Scarface,Mr Scarface is back in the motherfuckin house once again 
110411,Scarface,Yea droppin some of that new
110412,Scarface,Mr Scarface Two on your motherfuckin ass
110413,Scarface,So suck a nigga dick or make a nigga rich
110414,Scarface,I dont give a fuck about the chatter in the background
110415,Scarface,Niggas get beat when they step this is Aks town
110416,Scarface,If you dont know I recommend you check
110417,Scarface,And ask them motherfuckers how many heads I put to rest
110418,Scarface,I play a game but the game aint roulette
110419,Scarface,Slangin caine is the thang and I bet
110420,Scarface,That theres a lot of wannabe Scarfaces
110421,Scarface,Ive heard the name in ninety nine different places
110422,Scarface,Im here to squash it all original will speak
110423,Scarface,Scarface on your ass from the streets
110424,Scarface,I left my cut in fear of a prison term
110425,Scarface,They wanna put me in a chair and let me burn
110426,Scarface,But go to prison on a murder rap fuck that
110427,Scarface,I refuse to be a visitor in states camp
110428,Scarface,So I broke and left behind all I worked for
110429,Scarface,Either that or be sentenced for a drug war
110430,Scarface,And many want to know why Ive slowed up
110431,Scarface,Its either that or get fucked
110432,Scarface,Cause laws get happy on the trigger
110433,Scarface,Say fuck it put a cap in a nigga
110434,Scarface,But this ass aint made for no caps homie
110435,Scarface,So I get in the wind but hey
110436,Scarface,A nigga still sold a quarter everyday
110437,Scarface,I sat around for six months black
110438,Scarface,Waitin for the day to make a comeback
110439,Scarface,And now Im ready for combat
110440,Scarface,All I have in this world all I have in this world
110441,Scarface,All I have in all I have in all I have in this world
110442,Scarface,Nobody knows my name theyll only know this face
110443,Scarface,On the for reala my nigga just call me Scarface
110444,Scarface,All I have in this world all I have in this world
110445,Scarface,All I have in all I have in all I have in this world
110446,Scarface,Nobody knows my name theyll only know this face
110447,Scarface,On the for reala my nigga just call me Scarface
110448,Scarface,All I have in this world all I have in this world
110449,Scarface,All I have in all I have in all I have in this world
110450,Scarface,Back in the South Park six oclock on the dot
110451,Scarface,Checkin on my old rock spot
110452,Scarface,Heh the small timers see me so they jet
110453,Scarface,I got myself a bag and I cant wait
110454,Scarface,To cut em up small to make a profit
110455,Scarface,Niggas on the cut short stop it
110456,Scarface,Fiendsll see em small then they go
110457,Scarface,Where to see the motherfuckin pro
110458,Scarface,And started reachin for his shit
110459,Scarface,Like I said before you dont get a second chance dude
110460,Scarface,Unloaded on his ass he was hurt
110461,Scarface,Six shots put his dick in the dirt
110462,Scarface,Laid him out like a motherfuckin rug
110463,Scarface,Gettin pumped full of    slugs
110464,Scarface,Some other niggas stepped out yall
110465,Scarface,Aw shit I had to make a phone call
110466,Scarface,Scarface Im in a little trouble man
110467,Scarface,Scarface Im out here in South Park Village
110468,Scarface,J Prince Stay right there Ill be right on
110469,Scarface,Scarface Cmon lets take these motherfuckers to war man
110470,Scarface,J called up some niggas from the  th Ward
110471,Scarface,And came back with a motherfuckin hit squad
110472,Scarface,Will an AK with a banana clip
110473,Scarface,And little Bill had a god damn pistol grip
110474,Scarface,I hit a little laugh and got me a buzz
110475,Scarface,And thats about the time they got drugged
110476,Scarface,You can call me the shit starter or call me Mr Scarface
110477,Scarface,All I have in this world all I have in this world
110478,Scarface,All I have in all I have in all I have in this world
110479,Scarface,Nobody knows my name theyll only know this face
110480,Scarface,On the for reala my nigga just call me Scarface
110481,Scarface,All I have in this world all I have in this world
110482,Scarface,All I have in all I have in all I have in this world
110483,Scarface,Nobody knows my name theyll only know this face
110484,Scarface,On the for reala my nigga just call me Scarface
110485,Scarface,All I have in this world all I have in this world
110486,Scarface,All I have in all I have in all I have in this world
110487,Scarface,Later on all alone you know what happened next
110488,Scarface,Another bitch came by to give me sex
110489,Scarface,It was kind of strange I was thrown off
110490,Scarface,The last bitch got her head blown off
110491,Scarface,But fuck I aintsta pass up no putty
110492,Scarface,She started strippin at the door oh goody
110493,Scarface,I got in that ass with the quickness
110494,Scarface,Fuckin her down with the diznick
110495,Scarface,I didnt have to pretend I loved her
110496,Scarface,All she wanted me to do was just fuck her
110497,Scarface,So I gave it up to the lady
110498,Scarface,And all she said was  Fuck me baby fuck me baby 
110499,Scarface,I started stroking in an outrage
110500,Scarface,The whole while I was starin at my twelve gauge
110501,Scarface,The bitch was makin noise I said Im killin her
110502,Scarface,And all the while my dick was hard and he was still in her
110503,Scarface,I made a nut as she fell to the floor
110504,Scarface,I heard a knock on the front door
110505,Scarface,I grabbed the twelve gauge from the bed head
110506,Scarface,Who the fuck is Fred I stood by the door
110507,Scarface,By that time someone jumped in the window
110508,Scarface,Now what the fuck was I do 
110509,Scarface,The bitch packed a twenty two
110510,Scarface,Hit him in his head there she laid him
110511,Scarface,The nigga standin by the door I sprayed him
110512,Scarface,I seen that same old brown Cadillac
110513,Scarface,It kinda fucked me up at first
110514,Scarface,Cause the nigga that drove that Caddy rode away in a hearse
110515,Scarface,I opened up fire on the ride G
110516,Scarface,Who I was shootin for was standin right behind me
110517,Scarface,I had a double barrel pointed at my ass
110518,Scarface,Could this be the end of Mr Brad 
110519,Scarface,I dont know what happened to the slut
110520,Scarface,Well thats about the time the closet door it opened up
110521,Scarface,Ill be damned if I go out like the last bitch  
110522,Scarface,They know me by the face but they dont know my last name
110523,Scarface,Yeah just call me Mr Scarface
110524,Scarface,I dont really remember feeling like this
110525,Scarface,Got this love formin in my life for this dame
110526,Scarface,And indeed took the form of life and thats a shame
110527,Scarface,How a man can fall in love with dreams  not afraid
110528,Scarface,Not afraid to let you up and leave
110529,Scarface,Do your thang MaryJane mess with all my folks got em high
110530,Scarface,For the days that they were lost and broke shit got em by
110531,Scarface,Only right we stop and give her props
110532,Scarface,Plus she from the block of only finer crops
110533,Scarface,Happy just to hear your name
110534,Scarface,When the world starts to stress you out what you do 
110535,Scarface,Put a cancer stick up in your mouth or grab a brew
110536,Scarface,Sold in stores but the fact remains is they the blame
110537,Scarface,And the governments been taxin that       gettin paid
110538,Scarface,If its taxable its cool to smoke  kill or not
110539,Scarface,And the alcohol is killin folks true or not
110540,Scarface,Other people try to make you bad  but I know you not
110541,Scarface,When my situations lookin sad I know I got
110542,Scarface,A true friend in my time of need all I need
110543,Scarface,Your natural you come from seeds I decree
110544,Scarface,Makes me happy when Im feelin pain
110545,Scarface,Once again makes me happy just to hear your name
110546,Scarface,Happy just to hear your name
110547,Scarface,When you sad depressed and feeling strange who you blame
110548,Scarface,Need some company to keep you sane call her name
110549,Scarface,MaryJane I love you MaryJane do your thang
110550,Scarface,Youre all I need to get me through this thang true to game
110551,Scarface,You aint never made me smash my thangs scratch the brain
110552,Scarface,Anything youve always kept me tame and its plain
110553,Scarface,For me to see that you my everything MaryJane
110554,Scarface,MaryJane helps to ease the brain when you hang
110555,Scarface,Through the seasons you aint never change stayed the same
110556,Scarface,Never seen what people seen in speed you became
110557,Scarface,Naturally you everything we need do the thang
110558,Scarface,Do your thang baby true indeed
110559,Scarface,Happy just to hear your name
110560,Scarface,One  Bring your boy a bottle of wine 
110561,Scarface,Two  Dont forget the papers this time 
110562,Scarface,Three  Go to Joes and pick up a dime 
110563,Scarface,And fuck the baddest hoes that your ass can find
110564,Scarface,One  Bring your boy a bottle of wine 
110565,Scarface,Two  Dont forget the papers this time 
110566,Scarface,Three  Go to Joes and pick up a dime 
110567,Scarface,Four of the finest hoes that your ass can find
110568,Scarface,Sittin at the stoplight looking at hoes
110569,Scarface,Peeping out this bitch in her black Girbauds
110570,Scarface,Windows rolled up tight top was closed
