,artist,text
61499,Jay-z,Got this weed head chick she always catch me doing shit
61500,Jay-z,Crazy girl  wanna leave me but she always forgets
61501,Jay-z,Got this Chinese chick had to leave her quick
61502,Jay-z,Cause she kept bootlegging my shit man
61503,Jay-z,I got this African chick with Eddie Murphy on her skull
61504,Jay-z,She like  Jigga Man why you treat me like animal  
61505,Jay-z,Im like  Excuse me Ms Fufu but when I met your ass
61506,Jay-z,You was dead broke and naked and now you want half 
61507,Jay-z,I got this ho that after   million sold
61508,Jay-z,Mamis a narcoleptic always sleeping on Hov
61509,Jay-z,Got to tie the back of her head like Deuce Bigalow
61510,Jay-z,Ive got so many girls across the globe
61511,Jay-z,I love girls girls girls girls
61512,Jay-z,Yo put your number on this paper cause I would love to date ya
61513,Jay-z,Holla at ya when I come off tour
61514,Jay-z,I love girls girls girls girls
61515,Jay-z,I come scoop you in that Coupe sittin on deuce zeroes
61516,Jay-z,Fix your hair in the mirror lets roll
61517,Jay-z,I love girls girls girls girls
61518,Jay-z,Yo put your number on this paper cause I would love to date ya
61519,Jay-z,Holla at ya when I come off tour
61520,Jay-z,I love girls girls girls girls
61521,Jay-z,Youre now tuned into the muhfuckin greatest  Jigga 
61522,Jay-z,Turn the music up in the headphones  Jigga 
61523,Jay-z,Tim you can go and brush your shoulder off nigga
61524,Jay-z,If you feeling like a pimp
61525,Jay-z,Nigga go and brush your shoulders off
61526,Jay-z,Ladies is pimps too go and brush your shoulders off
61527,Jay-z,Niggas is crazy baby dont forget that boy told you
61528,Jay-z,Get that dirt off your shoulder
61529,Jay-z,I probably owe it to yall probably be locked by the force
61530,Jay-z,Tryin to hustle some things that go with the Porsche
61531,Jay-z,Feelin no remorse feelin like my hand was forced
61532,Jay-z,Middle finger to the law nigga grippin my balls
61533,Jay-z,Said the ladies they love me from the bleachers they screamin
61534,Jay-z,All the ballers is bouncin they like the way I be leanin
61535,Jay-z,All the rappers be hatin off the track that Im makin
61536,Jay-z,But all the hustlers they love it just to see one of us make it
61537,Jay-z,Came from the bottom of the bottom to the top of the pops
61538,Jay-z,Nigga London Japan and Im straight off the block
61539,Jay-z,Like a running back get it Man Im straight off the block
61540,Jay-z,I can run it back nigga  cause Im straight with the Roc
61541,Jay-z,If you feeling like a pimp
61542,Jay-z,Nigga go and brush your shoulders off
61543,Jay-z,Ladies is pimps too go and brush your shoulders off
61544,Jay-z,Niggas is crazy baby dont forget that boy told you
61545,Jay-z,Get that dirt off your shoulder
61546,Jay-z,You gotta get that dirt off your shoulder
61547,Jay-z,You gotta get that dirt off your shoulder
61548,Jay-z,You gotta get that dirt off your shoulder
61549,Jay-z,You gotta get that dirt off your shoulder
61550,Jay-z,Your homie Hov in position in the kitchen with soda
61551,Jay-z,I just whipped up a watch tryin to get me a Rover
61552,Jay-z,Tryin to stretch out the coca like a wrestler yessir
61553,Jay-z,Keep the Heckler close you know them smokersll test ya
61554,Jay-z,But like   cards went out Im through dealin
61555,Jay-z,Now   bars come out now you feel em
61556,Jay-z,Now   cars roll out remove ceilin
61557,Jay-z,In case   broads come out now you chillin
61558,Jay-z,With a boss bitch of course S C on the sleeve
61559,Jay-z,At the      club ESPN on the screen
61560,Jay-z,I paid a grip for the jeans plus the slippers is clean
61561,Jay-z,No chrome on the wheels Im a grown up for real
61562,Jay-z,If you feeling like a pimp
61563,Jay-z,Nigga go and brush your shoulders off
61564,Jay-z,Ladies is pimps too go and brush your shoulders off
61565,Jay-z,Niggas is crazy baby dont forget that boy told you
61566,Jay-z,Get that dirt off your shoulder
61567,Jay-z,You gotta get that dirt off your shoulder
61568,Jay-z,You gotta get that dirt off your shoulder
61569,Jay-z,You gotta get that dirt off your shoulder
61570,Jay-z,You gotta get that dirt off your shoulder
61571,Jay-z,Your boy back in the building Brooklyn we back on the map
61572,Jay-z,Me and my beautiful bee itch in the back of that Bach
61573,Jay-z,Im the realest to run it I just happen to rap
61574,Jay-z,I aint gotta clap at em niggas scared of that black
61575,Jay-z,I drop that Black Album then I back out it
61576,Jay-z,As the best rapper alive nigga ask bout me
61577,Jay-z,From bricks to Billboards from grams to Grammys
61578,Jay-z,From Os to opposite of Orphan Annie
61579,Jay-z,You gotta pardon Jay for sellin out the Garden in a day
61580,Jay-z,Im like a young Marvin in his hey
61581,Jay-z,Im a hustler homie you a customer crony
61582,Jay-z,Got some dirt on my shoulder could you brush it off for me 
61583,Jay-z,If you feeling like a pimp
61584,Jay-z,Nigga go and brush your shoulders off
61585,Jay-z,Ladies is pimps too go and brush your shoulders off
61586,Jay-z,Niggas is crazy baby dont forget that boy told you
61587,Jay-z,Get that dirt off your shoulder
61588,Jay-z,You gotta get that dirt off your shoulder
61589,Jay-z,You gotta get that dirt off your shoulder
61590,Jay-z,You gotta get that dirt off your shoulder
61591,Jay-z,You gotta get that dirt off your shoulder
61592,Jay-z,Youre now tuned into the mufuckin greatest
61593,Jay-z,Best rapper alive best rapper alive
61594,Jay-z, Are you not entertained Are you not entertained  
61595,Jay-z, Is this not why you are here  
61596,Jay-z,Turn the music up turn me down
61597,Jay-z,This time its for the money my nigga
61598,Jay-z,Theres never been a nigga this good for this long
61599,Jay-z,This hood or this pop this hot or this strong
61600,Jay-z,With so many different flows this ones for this song
61601,Jay-z,The next one I switch up this one will get bit up
61602,Jay-z,These fucks too lazy to make up shit they crazy
61603,Jay-z,They dont paint pictures they just trace me
61604,Jay-z,You know what Soon they forget where they plucked
61605,Jay-z,Their whole style from then try to reverse the outcome
61606,Jay-z,Im not a biter Im a writer for myself and others
61607,Jay-z,I say a B I G verse Im only bigging up my brother
61608,Jay-z,Bigging up my borough Im big enough to do it
61609,Jay-z,Im that thorough plus I know my own flow is foolish
61610,Jay-z,So them rings and things you sing about bring em out
61611,Jay-z,Its hard to yell when the barrels in your mouth
61612,Jay-z,Im in new sneakers dual seaters few divas
61613,Jay-z,What more can I tell you Let me spell it for you 
61614,Jay-z,W I double L I E nobody truer than H O V
61615,Jay-z,And Im back for more New Yorks ambassador
61616,Jay-z,Prime Minister back to finish my business up
61617,Jay-z,I know this much is true true true
61618,Jay-z,What more can I say to you You heard it all
61619,Jay-z,You already know what Im about flying birds down South
61620,Jay-z,Moving wet off the step purple rain in a drought
61621,Jay-z,Stunting on hoes brushing off my shirt
61622,Jay-z,But aint nothing on my clothes except my chain my name
61623,Jay-z,Young H O pitch the yay faithful
61624,Jay-z,Even if they patrol I make payroll
61625,Jay-z,Benz paid for friends they roll
61626,Jay-z,Private jets down to Turks and Caicos
61627,Jay-z,Cris caseloads I dont give a shit
61628,Jay-z,Nigga one life to live I cant let a day go
61629,Jay-z,By without me being fly fresh to death
61630,Jay-z,Head to toe till the day I rest
61631,Jay-z,And I dont wear jerseys Im    plus
61632,Jay-z,Give me a crisp pair of jeans nigga button ups
61633,Jay-z,S Dots on my feet make my cipher complete
61634,Jay-z,What more can I say Guru play the beat 
61635,Jay-z,We gon let this ride into the hook
61636,Jay-z, Ima snap my fingers on this one
61637,Jay-z,What more can I say to you 
61638,Jay-z, What more can I sayyyyyyyyyyy  
61639,Jay-z,Now you know your ass is Willie when they got you in the mag
61640,Jay-z,For like half a billy and your ass aint lily White
61641,Jay-z,That mean that shit you write must be illy
61642,Jay-z,Either that or your flow is silly Its both 
61643,Jay-z,I dont mean to boast but damn if I dont brag
61644,Jay-z,Them crackers gon act like I aint on they ass
61645,Jay-z,The Martha Stewart thats far from Jewish
61646,Jay-z,Far from a Harvard student just had the balls to do it
61647,Jay-z,And no Im not through with it
61648,Jay-z,In fact Im just previewing it
61649,Jay-z,This aint the show Im just EQing it
61650,Jay-z,One two and I wont stop abusing it
61651,Jay-z,To groupie girls stop false accusing it
61652,Jay-z,Back to the music  the Maybach roof is translucent
61653,Jay-z,Niggas got a problem Houston 
61654,Jay-z,What up B they cant shut up me
61655,Jay-z,Shut down I not even P E  Imma ride
61656,Jay-z,God forgive me for my brash delivery
61657,Jay-z,But I remember vividly what these streets did to me
61658,Jay-z,So picture me letting these clowns nitpick at me
61659,Jay-z,I will literally kiss Ti Ti in the forehead
61660,Jay-z,Tell her  Please forgive me  then squeeze into your forehead
61661,Jay-z,Im not the one to score points off in fact
61662,Jay-z,I got a joint thatll knock your points off
61663,Jay-z,Young Hova the God nigga blast for me
61664,Jay-z,Im at the Trump International ask for me
61665,Jay-z,I aint never scared Im everywhere you aint never there
61666,Jay-z,And nigga why would I ever care 
61667,Jay-z,Pound for pound Im the best to ever come around here
61668,Jay-z,Excluding nobody look what I embody 
61669,Jay-z,The soul of a hustler I really ran the street
61670,Jay-z,A CEOs mind that marketing plan was me
61671,Jay-z,And no I aint get shot up a whole bunch of times
61672,Jay-z,Or make up shit in a whole bunch of lines
61673,Jay-z,And I aint animated like say a Busta Rhymes
61674,Jay-z,But the real shit you get when you bust down my lines
61675,Jay-z,Add that to the fact I went plat a bunch of times
61676,Jay-z,Times that by my influence on pop culture
61677,Jay-z,Im supposed to be number one on everybody list
61678,Jay-z,Well see what happens when I no longer exist
61679,Jay-z,What more can I sayyyyyyyyyyy 
61680,Jay-z,Take those moneys and spread cross families
61681,Jay-z,My sisters Hattie and Lou the nephews cousins and TT
61682,Jay-z,Eric the rest to B for whatever she wants to do
61683,Jay-z,She might start an institute
61684,Jay-z,She might put poor kids through school
61685,Jay-z,My stake in Roc Nation should go to you
61686,Jay-z,Leave a piece for your siblings to give to their children too
61687,Jay-z,TIDAL the champagne DUSS  Id like to see
61688,Jay-z,A nice peace fund ideas from people who look like we
61689,Jay-z,We gon start a society within a society
61690,Jay-z,Thats major just like the Negro League
61691,Jay-z,There was a time America wouldnt let us ball
61692,Jay-z,Those times are now back just now called Afro tech
61693,Jay-z,Generational wealth thats the key
61694,Jay-z,My parents aint have shit so that shift started with me
61695,Jay-z,My mom took her money she bought me bonds
61696,Jay-z,That was the sweetest thing of all time uh
61697,Jay-z,Legacy Legacy Legacy Legacy
61698,Jay-z,Black excellence baby you gon let em see
61699,Jay-z,Legacy Legacy Legacy Legacy
61700,Jay-z,Black excellency baby let em see
61701,Jay-z,I remember like listenin to Wu Tang
61702,Jay-z,And niggas like  Your seed married his seed married my seed 
61703,Jay-z,Thats how we keep Carter money all in the family
61704,Jay-z,You see my father son of a preacher man
61705,Jay-z,Whose daughter couldnt escape the reach of the preachers hand
61706,Jay-z,That charge of energy set all the Carters back
61707,Jay-z,It took all these years to get to zero in fact
61708,Jay-z,I hated religion cause here was this Christian
61709,Jay-z,He was preachin on Sundays versus how he was livin Monday
61710,Jay-z,Cause strangely our division led to multiple religions
61711,Jay-z,I studied Muslim Buddhist and Christians
61712,Jay-z,And I was runnin from him He was givin me wisdom
61713,Jay-z,See how the universe works 
61714,Jay-z,It takes my hurt and help me find more of myself
61715,Jay-z,Thats called the Red Queens Race
61716,Jay-z,You run this hard just to stay in place
61717,Jay-z,You run this hard just to stay in place
61718,Jay-z,Legacy Legacy Legacy Legacy
61719,Jay-z,Black excellence you gon let em see
61720,Jay-z,Legacy Legacy Legacy Legacy
61721,Jay-z,Black excellency baby let em see
61722,Jay-z,Day someday someday well all
61723,Jay-z,Presidents to represent me  Get money  
61724,Jay-z,Im out for presidents to represent me  Get money  
61725,Jay-z,Im out for presidents to represent me  Get money  
61726,Jay-z,Im out for dead fuckin presidents to represent me  Whose    
61727,Jay-z,While others spit that Wonderama shit
61728,Jay-z,Shall remain anonymous caught up in the finest shit
61729,Jay-z,Live out my dreams until my heart give out
61730,Jay-z,Involved with cream you know exactly what this shits about
61731,Jay-z,Fuck yall mean Handlin since a teen I dish out
61732,Jay-z,Like the point guard off your favorite team without doubt
61733,Jay-z,My life aint rosy but I roll with it
61734,Jay-z,My mind was fine til the dough hit it
61735,Jay-z,And told me that the Mo did it
61736,Jay-z,And now its kosher shit is so Hasidic
61737,Jay-z,I blow a digit on a diamond in a minute but no bitches
61738,Jay-z,Cause even the thoroughest niggas be NARCin
61739,Jay-z,Tryin to strike a bargain hopin that they might get pardoned
61740,Jay-z,Shit Im involved with got me pins and needles
61741,Jay-z,And my cerebral breeds the wickedest evil
61742,Jay-z,Thoughts that this sportll feed you
61743,Jay-z,Peep facts in the game so deep fiends could catch a
61744,Jay-z,Freeze off my kneecap can yall believe that 
61745,Jay-z,Got the city drinkin Cristals re up the fee
61746,Jay-z,Rappers goin broke tryin to keep up with me
61747,Jay-z,My rise to riches surprised the bitches think harder
61748,Jay-z,You know this nigga JayZ Shawn Carter
61749,Jay-z,G S the fuck up dree ess the fuck up
61750,Jay-z,Watch me shine like a Breitling Breguets the fuck up
61751,Jay-z,All rhymers forget it like Alzheimers
61752,Jay-z,Small timers I said it Im addressin all drama
61753,Jay-z,Im out for presidents to represent me  Get money  
61754,Jay-z,Im out for presidents to represent me  Get money  
61755,Jay-z,Im out for presidents to represent me  Get money  
61756,Jay-z,Im out for dead fuckin presidents to represent me  Whose    
61757,Jay-z,Im out for presidents to represent me  Get money  
61758,Jay-z,Im out for presidents to represent me  Get money  
61759,Jay-z,Im out for presidents to represent me  Get money  
61760,Jay-z,Im out for dead fuckin presidents to represent me  Whose    
61761,Jay-z, I want money like Cosby  who wouldnt 
61762,Jay-z,That make me think you probably aint got no puddin
61763,Jay-z,Niggas got them kinda dreams from jail
61764,Jay-z,You in the streets nigga make your moves get your mail
61765,Jay-z,Niggasll coast in the SL but cant post bail
61766,Jay-z,Niggasll roast a L but scared to throw your toast well
61767,Jay-z,Im here to tell niggas it aint all swell
61768,Jay-z,Theres heaven then theres hell niggas
61769,Jay-z,One day youre cruisin in your  
61770,Jay-z,Next day youre sweatin forgettin your lies
61771,Jay-z,Alibis aint matchin up bullshit catchin up
61772,Jay-z,Hit with the RICO they repo your veh i cle
61773,Jay-z,Everything was all good just a week ago
61774,Jay-z,Bout to start bitchin aint you 
61775,Jay-z,Ready to start snitchin aint you 
61776,Jay-z,Ill forgive your weak ass hustlin just aint you
61777,Jay-z,Aside from the fast cars honeys that shake they ass at bars
61778,Jay-z,You know you wouldnt be involved
61779,Jay-z,With the underworld dealers carriers of MAC millers
61780,Jay-z,East Coast bodiers West Coast cap peelers
61781,Jay-z,Little monkey niggas turn gorillas
61782,Jay-z,Stopped in the station filled up on octane
61783,Jay-z,And now they not sane and not playin that goes without sayin
61784,Jay-z,When money play in then they play you out
61785,Jay-z,Tryin to escape my own mind lurkin the enemy
61786,Jay-z,Representin infinity with presidencies you know 
61787,Jay-z,Dead fuckin presidents to represent me  Whose    
61788,Jay-z,Dead fuckin presidents to represent me  Whose    
61789,Jay-z,Dead fuckin presidents to represent me  Whose    
61790,Jay-z,Dead fuckin presidents to represent me  Whose    
61791,Jay-z,Im out for presidents to represent me  Get money  
61792,Jay-z,Im out for presidents to represent me  Get money  
61793,Jay-z,Im out for presidents to represent me  Get money  
61794,Jay-z,Im out for presidents to represent me  Get Money  
61795,Jay-z,Im out for presidents to represent me  Get money  
61796,Jay-z,Im out for presidents to represent me  Get money  
61797,Jay-z,Im out for presidents to represent me  Get money  
61798,Jay-z,Im out for dead fuckin presidents to represent me  Whose    
61799,Jay-z, JAY Z this   JAY Z that    JAY Z wont hold my hand no more   
61800,Jay-z, JAY Z this   JAY Z that  
61801,Jay-z, JAY Z that   JAY Z this    JAY Z wont give me no money   
61802,Jay-z,What yall niggas get front page articles yall mention JAY Z name
61803,Jay-z, This thing on  JAY Z JAY Z  Check in JAY Z news
61804,Jay-z,I understand what yall tryin to do
61805,Jay-z,I brought the flutes this time though  Check 
61806,Jay-z,Unleash the flutes on em Guru
61807,Jay-z,Give me some more music in the headphone
61808,Jay-z,Lets get to the proceedings preceding this evening
61809,Jay-z,Lets do this thing  lets do it right this time 
61810,Jay-z,I got my mojo back baby oh behave
61811,Jay-z,Yall and your articles hock spit at Jay
61812,Jay-z,Yall from afar threw darts my way
61813,Jay-z,What you thought I would not have nothin to say Nope 
61814,Jay-z,Yall fell into the booby trap
61815,Jay-z,I set the trap just to see dude react
61816,Jay-z,And now and now yous cant leave
61817,Jay-z,You opened the door God Im at you annually
61818,Jay-z,And Im sorry Miss Rosie Perez
61819,Jay-z,I call a spade a spade it just is what it is
61820,Jay-z,But you cant give cred to anything dude says
61821,Jay-z,Same dude to give you ice and you owe him some head
61822,Jay-z,Shorty its time to wake up the dead
61823,Jay-z,You sound a little naive in them articles that I read
61824,Jay-z,The Blueprint   baby on the way
61825,Jay-z,I got my mojo back baby oh behave
61826,Jay-z,The Blueprint   baby on the way
61827,Jay-z,I got my mojo back baby oh behave
61828,Jay-z,Cant yall see that hes fake the rap version of T D Jakes
61829,Jay-z,Prophesizin on your CDs and tapes
61830,Jay-z,Wont break you a crumb of the little bit that he makes
61831,Jay-z,And this is with whom you want to place your faith
61832,Jay-z,I put dollars on mine ask Columbine
61833,Jay-z,When the Twin Towers dropped I was the first in line
61834,Jay-z,Donatin proceeds off every ticket sold
61835,Jay-z,When I was out on the road thats how you judge Hov no 
61836,Jay-z,Aint I supposed to be absorbed in myself 
61837,Jay-z,Every time theres a tragedy Im the first one to help
61838,Jay-z,They call me this misogynist but they dont call me the dude
61839,Jay-z,To take his dollars to give gifts at the projects
61840,Jay-z,These dudes is all politics depositin checks
61841,Jay-z,They put in they pocket all you get in return is a lot of lip
61842,Jay-z,And yall buy the shit caught up in the hype
61843,Jay-z,Cause the nigga wear a kufi it dont mean that he bright
61844,Jay-z,Cause you dont understand him it dont mean that he nice
61845,Jay-z,It just means you dont understand all the bullshit that he write
61846,Jay-z,Is it  Oochie Wally Wally or is it  One Mic  
61847,Jay-z,Is it  Black Girl Lost or shorty owe you for ice 
61848,Jay-z,Ive been real all my life they confuse it with conceit
61849,Jay-z,Since I will not lose they try to help him cheat
61850,Jay-z,But I will not lose for even in defeat
61851,Jay-z,Theres a valuable lesson learned so it evens up for me
61852,Jay-z,When the grass is cut the snakes will show
61853,Jay-z,I gotta thank the little homie Nas for that though
61854,Jay-z,Savin me the hassle of speakin to half of these assholes
61855,Jay-z,And Ima let karma catch up to Jaz O whoa
61856,Jay-z,Im back before you had a chance to miss me
61857,Jay-z,My mama cant save you this time niggas is history
61858,Jay-z,Who you know flow vicious as me 
61859,Jay-z,Yet so religiously thats why they call me Hov
61860,Jay-z,I get the spoils cause the victor is me  Me nigga  
61861,Jay-z,Youre an actor youre not who youre depicted to be
61862,Jay-z,You street dreamin all yall niggas livin through me
61863,Jay-z,I gave you life when niggas was forgettin you emcee
61864,Jay-z,Im a legend you should take a picture with me
61865,Jay-z,You should be happy to be in my presence
61866,Jay-z,Im Big Dog Glenn Rob  listen God you a flea
61867,Jay-z,And the little homie Jungle is a garden to me
61868,Jay-z,Whats the problem B You not as hard as me nigga
61869,Jay-z,Hard as we nigga R O C nigga
61870,Jay-z,Thats why they follow me they feel my pain and my agony nigga
61871,Jay-z,I wont rest til you on one knee
61872,Jay-z,You want war then this wars gon be nigga
61873,Jay-z,You want war then this wars gon be nigga
61874,Jay-z,The Blueprint   baby on the way
61875,Jay-z,I got my mojo back baby oh behave
61876,Jay-z,The Blueprint   baby on the way
61877,Jay-z,I got my mojo back baby oh behave
98471,NF,Feels like were on the edge right now
98472,NF,I wish that I could say Im proud
98473,NF,Im sorry that I let you down
98474,NF,All these voices in my head get loud
98475,NF,I wish that I could shut them out
98476,NF,Im sorry that I let you down
98477,NF,Yeah I guess Im a disappointment doin everything I can
98478,NF,I dont wanna make you disappointed its annoying
98479,NF,I just wanna make you feel like everything I ever do
98480,NF,Was never tryna make an issue for you but I guess the more you
98481,NF,Thought about everything you were never even wrong
98482,NF,In the first place right Yeah Ima just ignore you
98483,NF,Walking towards you with my head down
98484,NF,Lookin at the ground Im embarrassed for you
98485,NF,Paranoia what did I do wrong this time 
98486,NF,Very loyal Shoulda had my back
98487,NF,But you put a knife in it my hands are full
98488,NF,What else should I carry for you 
98489,NF,Feels like were on the edge right now
98490,NF,I wish that I could say Im proud
98491,NF,Im sorry that I let you down
98492,NF,All these voices in my head get loud
98493,NF,I wish that I could shut them out
98494,NF,Im sorry that I let you down
98495,NF,Yeah you dont wanna make this work
98496,NF,You just wanna make this worse
98497,NF,Want me to listen to you but you dont ever hear my words
98498,NF,You dont wanna know my hurt yet
98499,NF,Let me guess you want an apology probably
98500,NF,How can we keep going at a rate like this 
98501,NF,We cant so I guess Ima have to leave
98502,NF,I just wanna be alone right now I dont really wanna think at all
98503,NF,Go ahead just drink it off
98504,NF,Both know youre gonna call tomorrow like nothings wrong
98505,NF,Aint that what you always do 
98506,NF,I feel like every time I talk to you youre in an awful mood
98507,NF,What else can I offer you 
98508,NF,Theres nothing left right now I gave it all to you
98509,NF,Feels like were on the edge right now
98510,NF,I wish that I could say Im proud
98511,NF,Im sorry that I let you down
98512,NF,All these voices in my head get loud
98513,NF,I wish that I could shut them out
98514,NF,Im sorry that I let you down
98515,NF,Packed all my clothes and I moved out
98516,NF,I dont even wanna go to your house
98517,NF,Every time I sit on that couch
98518,NF,I feel like you lecture me eventually I bet that we
98519,NF,And prolly woulda figured things out
98520,NF,But its cool I checked out
98521,NF,Oh you wanna be friends now 
98522,NF,Okay lets put my fake face on and pretend now
98523,NF,Sit around and talk about the good times that didnt even happen
98524,NF,I mean why are you laughing 
98525,NF,Must have missed that joke let me see if I can find a reaction
98526,NF,No but at least youre happy
98527,NF,Feels like were on the edge right now
98528,NF,I wish that I could say Im proud
98529,NF,Im sorry that I let you down
98530,NF,All these voices in my head get loud
98531,NF,And I wish that I could shut them out
98532,NF,Im sorry that I let you down
98533,NF,Im sorry that I let you down
98534,NF,How could you leave so unexpected 
98535,NF,For you but you just left us
98536,NF,We needed you I needed you
98537,NF,Yo I dont know what its like to be addicted to pills
98538,NF,But I do know what its like to be a witness it kills
98539,NF,Mama told me she loved me Im thinkin this isnt real
98540,NF,I think of you when I get a whiff of that cigarette smell yeah
98541,NF,Welcome to the bottom of hell
98542,NF,They say pain is a prison let me out of my cell
98543,NF,You say you proud of me but you dont know me that well
98544,NF,Sit in my room tears running down my face and I yell
98545,NF,Into my pillowcases you say you coming to get us
98546,NF,Then call em a minute later just to tell us you not Im humiliated
98547,NF,Im in a room with a parent that I dont barely know
98548,NF,Some lady in the corner watching us while shes taking notes
98549,NF,I dont get it mom dont you want to watch your babies grow 
98550,NF,I guess pills are more important all you have to say is  no 
98551,NF,But you wont do it will you You gon keep popping til those pills kill you
98552,NF,I know youre gone but I can still feel you
98553,NF,Why would you leave us Why would you leave us here 
98554,NF,How could you leave us here 
98555,NF,How could you leave us Why would you leave us Oh
98556,NF,I got this picture in my room and it kills me
98557,NF,But I dont need a picture of my mom I need the real thing
