,artist,text
94444,Nas,You know what Im sayin Yeah yeah
94445,Nas,Ayo put the Grants over there in the safe
94446,Nas, Cause we spendin these Jacksons
94447,Nas,The Washingtons go to wifey you know how that go
94448,Nas,Im sayin thats what this is all about right 
94449,Nas,Clothes bankrolls and hoes
94450,Nas,Visualizin the realism of life in actuality
94451,Nas,Fuck whos the baddest a persons status depends on salary
94452,Nas,And my mentality is money orientated
94453,Nas,Im destined to live the dream for all my peeps who never made it
94454,Nas, Cause yeah we were beginners in the hood as Five Percenters
94455,Nas,But somethin mustve got in us  cause all of us turned to sinners
94456,Nas,Now some restin in peace and some are sittin in San Quentin
94457,Nas,Others such as myself are tryin to carry on tradition
94458,Nas,Keepin this Schweppervescent street ghetto essence inside us
94459,Nas,Cause it provides us with the proper insight to guide us
94460,Nas,Even though we know somehow we all gotta go
94461,Nas,But as long as we leavin thievin
94462,Nas,Well be leavin with some kind of dough
94463,Nas,So until that day we expire and turn to vapors
94464,Nas,Me and my capers will be somewhere stackin plenty papers
94465,Nas,Keepin it real packin steel gettin high
94466,Nas, Cause lifes a bitch and then you die
94467,Nas,Lifes a bitch and then you die thats why we get high
94468,Nas, Cause you never know when youre gonna go
94469,Nas,Lifes a bitch and then you die thats why we puff lye
94470,Nas, Cause you never know when youre gonna go
94471,Nas,Lifes a bitch and then you die thats why we get high
94472,Nas, Cause you never know when youre gonna go
94473,Nas,Lifes a bitch and then you die thats why we puff lye
94474,Nas,I woke up early on my born day Im    its a blessin
94475,Nas,The essence of adolescence leaves my body now Im fresh and
94476,Nas,My physical frame is celebrated  cause I made it
94477,Nas,One quarter through life some godly like thing created
94478,Nas,Got rhymes    days annual plus some
94479,Nas,Load up the mic and bust one cuss while I pus from
94480,Nas,My skull  cause its pain in my brain vein money maintain
94481,Nas,Dont go against the grain simple and plain
94482,Nas,When I was young at this I used to do my thing hard
94483,Nas,Robbin foreigners take they wallets they jewels and rip they green cards
94484,Nas,Dipped to the projects flashin my quick cash
94485,Nas,And got my first piece of ass smokin blunts with hash
94486,Nas,Now its all about cash in abundance
94487,Nas,Niggas I used to run with is rich or doin years in the hundreds
94488,Nas,I switched my motto instead of sayin  Fuck tomorrow  
94489,Nas,That buck that bought a bottle couldve struck the lotto
94490,Nas,Once I stood on the block loose cracks produce stacks
94491,Nas,I cooked up and cut small pieces to get my loot back
94492,Nas,Time is illmatic keep static like wool fabric
94493,Nas,Pack a   matic to crack your whole cabbage
94494,Nas,Lifes a bitch and then you die thats why we get high
94495,Nas, Cause you never know when youre gonna go
94496,Nas,Lifes a bitch and then you die thats why we puff lye
94497,Nas, Cause you never know when youre gonna go
94498,Nas,Lifes a bitch and then you die thats why we get high
94499,Nas, Cause you never know when youre gonna go
94500,Nas,Lifes a bitch and then you die thats why we puff lye
94501,Nas, Cause you never know when youre gonna go
94502,Nas,Lifes a bitch and then you die
94503,Nas,The world is yours the world is yours
94504,Nas,Its mine its mine its mine whose world is this 
94505,Nas,Its mine its mine its mine whose world is this 
94506,Nas,The world is yours the world is yours
94507,Nas,Its mine its mine its mine whose world is this 
94508,Nas,I sip the Dom P watchin Gandhi til Im charged then
94509,Nas,Writin in my book of rhymes all the words past the margin
94510,Nas,Behold the mic Im throbbin mechanical movement
94511,Nas,Understandable smooth shit that murderers move with
94512,Nas,The thiefs theme play me at night they wont act right
94513,Nas,The fiend of hip hop has got me stuck like a crack pipe
94514,Nas,The mind activation react like Im facin
94515,Nas,Time like Pappy Mason with pens Im embracin
94516,Nas,Wipe the sweat off my dome spit the phlegm on the streets
94517,Nas,Suede Timbs on my feet makes my cipher complete
94518,Nas,Whether cruisin in a Six cab or Montero Jeep
94519,Nas,I cant call it the beats make me fallin asleep
94520,Nas,I keep fallin but never fallin six feet deep
94521,Nas,Im out for presidents to represent me  Say what  
94522,Nas,Im out for presidents to represent me  Say what  
94523,Nas,Im out for dead presidents to represent me
94524,Nas,The world is yours the world is yours
94525,Nas,Its mine its mine its mine whose world is this 
94526,Nas,The world is yours the world is yours
94527,Nas,Its mine its mine its mine whose world is this 
94528,Nas,Its mine its mine its mine whose world is this 
94529,Nas,The world is yours the world is yours
94530,Nas,Its mine its mine its mine whose world is this 
94531,Nas,To my peoples throughout Queens
94532,Nas,I trip we box up crazy bitches
94533,Nas,Aimin guns in all my baby pictures
94534,Nas,Beef with housing police release scriptures thats maybe Hitlers
94535,Nas,Yet Im the mild money gettin style rollin foul
94536,Nas,The versatile honey stickin wild golden child
94537,Nas,Dwellin in the Rotten Apple you get tackled
94538,Nas,Or caught by the devils lasso shit is a hassle
94539,Nas,Theres no days for broke days
94540,Nas,We sell it smoke pays while all the old folks pray
94541,Nas,To Jes s soakin their sins in trays of holy water
94542,Nas,Odds against Nas are slaughter
94543,Nas,Thinkin a word best describin my life to name my daughter
94544,Nas,My strength my son the star will be my resurrection
94545,Nas,Born in correction all the wrong shit I did
94546,Nas,Hell lead a right direction
94547,Nas,How you livin Large a broker charge cards are mediocre
94548,Nas,You flippin coke or playin spit spades and strip poker 
94549,Nas,Its mine its mine its mine whose world is this 
94550,Nas,The world is yours the world is yours
94551,Nas,Its mine its mine its mine whose world is this 
94552,Nas,Its mine its mine its mine whose world is this 
94553,Nas,Yo the world is yours the world is yours
94554,Nas,Its mine its mine its mine whose world is this 
94555,Nas,Im the young city bandit hold myself down single handed
94556,Nas,For murder raps I kick my thoughts alone get remanded
94557,Nas,Born alone die alone no crew to keep my crown or throne
94558,Nas,Im deep by sound alone caved inside      miles from home
94559,Nas,I need a new nigga for this black cloud to follow
94560,Nas, Cause while its over me its too dark to see tomorrow
94561,Nas,Tryin to maintain I flip fill the clip to the tip
94562,Nas,Picturin my peeps not eatin can make my heartbeat skip
94563,Nas,And Im amped up they locked the champ up
94564,Nas,Even my brains in handcuffs
94565,Nas,Headed for Indiana stabbin women like the Phantom
94566,Nas,The crew is lampin Big Willie style
94567,Nas,Check the chip toothed smile plus I profile wild
94568,Nas,Stash loot in fly clothes burnin dollars to light my stoge
94569,Nas,Walk the blocks with a bop checkin dames
94570,Nas,Plus the games people play bust the problems of the world today
94571,Nas,Its mine its mine its mine whose world is this 
94572,Nas,The world is yours the world is yours
94573,Nas,Its mine its mine its mine whose world is this 
94574,Nas,The world is yours the world is yours
94575,Nas,Its mine its mine its mine whose world is this 
94576,Nas,Yeah the world is yours the world is yours
94577,Nas,Its mine its mine its mine whose world is this 
94578,Nas,To everybody in Queens the foundation  Its yours  
94579,Nas,To everybody uptown yo the world is yours  Its yours  
94580,Nas,Yall know the world is yours  Its yours  
94581,Nas,Everybody in Mount Vernon the world is yours  Its yours  
94582,Nas,Long Island the world is yours  Its yours  
94583,Nas,Staten Island yeah the world is yours  Its yours  
94584,Nas,South Bronx the world is yours  Its yours  
94585,Nas,Fake thug no love you get the slug CB Gusto
94586,Nas,Your luck low I didnt know til I was drunk though
94587,Nas,You freak niggas played out get fucked and ate out
94588,Nas,Prostitute turned bitch I got the gauge out
94589,Nas,Ninety six ways I made out Montana way
94590,Nas,The Good F E L L A verbal AK spray
94591,Nas,Dipped attache jump out the Range empty out the ashtray
94592,Nas,A glass of ze make a man Cassius Clay
94593,Nas,Red dot plots murder schemes thirty two shotguns
94594,Nas,Seventeen rocks gleam from one ring
94595,Nas,They let me let yall niggas know one thing
94596,Nas,Theres one life one love so there can only be one King
94597,Nas,The highlights of livin Vegas style roll dice in linen
94598,Nas,Antera spinnin on Millenniums
94599,Nas,Twenty G bets Im winnin em threats Im sendin em
94600,Nas,Lex with TV sets the minimum
94601,Nas,Ill sex adrenaline party with villains
94602,Nas,A case of Demi Sec to chase the Henny
94603,Nas,Wet any clique with the semi TEC who want it 
94604,Nas,Diamonds I flaunt it chickenheads flock I lace em
94605,Nas,Fried broiled with basil taste em
94606,Nas,Crack the legs way out of formation
94607,Nas,Its horizontal how I have em fuckin me in the Benz wagon
94608,Nas,Can it be Vanity from Last Dragon 
94609,Nas,Grab your gun its on though
94610,Nas,Shit is grimy real niggas buck in broad daylight
94611,Nas,With the broke MAC that wont spray right
94612,Nas,Dont give a fuck who they hit as long as the dramas lit
94613,Nas,Yo overnight thugs bug  cause they aint promised shit
94614,Nas,Hungry ass hooligans stay on that piranha shit
94615,Nas,I never sleep  cause sleep is the cousin of death
94616,Nas,I aint the type of brother made for you to start testin
94617,Nas,I never sleep  cause sleep is the cousin of death
94618,Nas,I aint the type of brother made for you to start testin
94619,Nas,I never sleep  cause sleep is the cousin of death
94620,Nas,I aint the type of brother made for you to start testin
94621,Nas,I never sleep  cause sleep is the cousin of death
94622,Nas,I aint the type of brother made for you to start testin
94623,Nas,I peeped you frontin I was in the Jeep sunk in the seat
94624,Nas,Tinted with heat beats bumpin
94625,Nas,Across the street you was wildin
94626,Nas,Talkin about how you ran the Island in   
94627,Nas,Layin up playin the yard with crazy shine
94628,Nas,I cocked the baby   that nigga gravy mine
94629,Nas,Clanked him what was he thinkin
94630,Nas,On my corner when its pay me time 
94631,Nas,Somethin told me  Plug him  
94632,Nas,So dumb felt my leg burn then it got numb
94633,Nas,Heard shots and dropped son caught a hot one
94634,Nas,Somebody take this biscuit fore the cops come
94635,Nas,Then they came askin me my name
94636,Nas,What the fuck I got stitched up and went through
94637,Nas,Left the hospital that same night what
94638,Nas,Got my gat back time to backtrack
94639,Nas,I had the drop so how the fuck I get clapped 
94640,Nas,Black was in the Jeep watchin all he seen speed by
94641,Nas,And yo nobody in my hood got one
94642,Nas,That clown niggas through blazin at his crew daily
94643,Nas,The Bridge touched me up severely hear me 
94644,Nas,So when I rhyme its sincerely yours
94645,Nas,Be lightin Ls sippin Coors on all floors in project halls
94646,Nas,Contemplatin war niggas I was cool with before
94647,Nas,We used to score together Uptown coppin the raw
94648,Nas,But a thug changes and love changes
94649,Nas,And best friends become strangers word up
94650,Nas,There aint an army that could strike back
94651,Nas,There aint an army that could strike back
94652,Nas,There aint an army that could strike back
94653,Nas,There aint an army that could strike back
94654,Nas,Thug niggas yo to them thug niggas
94655,Nas,Gettin it on in the world you know 
94656,Nas,To them niggas thats locked down
94657,Nas,Doin they thing survivin yaknowmsayin 
94658,Nas,To my thorough niggas New York and worldwide
94659,Nas,Yo to the Queensbridge Militia
94660,Nas,Illmatic nigga It Was Written though
94661,Nas,Its been a long time comin
94662,Nas,Yall fake niggas tryin to copy
94663,Nas,Better come with the real though fake ass niggas yo
94664,Nas, They throw us slugs we throwin them back what 
94665,Nas,Bring the shit man Live man 
94666,Nas, Fuck that son word up    shit
94667,Nas,It aint hard to tell I excel then prevail
94668,Nas,The mic is contacted I attract clientele
94669,Nas,My mic check is life or death breathin a snipers breath
94670,Nas,I exhale the yellow smoke of buddha through righteous steps
94671,Nas,Deep like The Shining sparkle like a diamond
94672,Nas,Sneak a Uzi on the island in my army jacket linin
94673,Nas,Hit the Earth like a comet invasion 
94674,Nas,Nas is like the Afrocentric Asian half man half amazin
94675,Nas, Cause in my physical I can express through song
94676,Nas,Delete stress like Motrin then extend strong
94677,Nas,I drink Mo t with Medusa give her shotguns in Hell
94678,Nas,From the spliff that I lift and inhale it aint hard to tell
94679,Nas,The buddha monks in your trunk turn the bass up
94680,Nas,Place your loot up parties I shoot up
94681,Nas,Nas I analyze drop a jew el inhale from the L
94682,Nas,School a fool well you feel it like Braille
94683,Nas,It aint hard to tell I kick a skill like Shaquille holds a pill
94684,Nas,Vocabulary spills Im Ill plus Matic
94685,Nas,I freak beats slam it like Iron Sheik
94686,Nas,Jam like a TEC with correct techniques
94687,Nas,So analyze me surprise me but cant magmatize me
94688,Nas,Scannin while youre plannin ways to sabotage me
94689,Nas,I leave em froze like heroin in your nose
94690,Nas,Nas will rock well it aint hard to tell
94691,Nas,Is what your frame of mind has chosen
94692,Nas,Ill leave your brain stimulated niggas is frozen
94693,Nas,Speak with criminal slang begin like a violin
94694,Nas,End like Leviathan its deep well let me try again
94695,Nas,Wisdom be leakin out my grapefruit troop
94696,Nas,I dominate break loops givin mics men e strual cycles
94697,Nas,Streets disciple I rock beats thats mega trifle
94698,Nas,And groove even smoother than moves by Villanova
94699,Nas,Youre still a soldier Im like Sly Stone in Cobra
94700,Nas,Packin like a Rasta in the weed spot
94701,Nas,Vocals will squeeze Glocks
94702,Nas,MCs eavesdrop though they need not to sneak
94703,Nas,My poetrys deep I never fell
94704,Nas,Nas raps should be locked in a cell it aint hard to tell
94705,Nas,What up kid I know shit is rough doin your bid
94706,Nas,When the cops came you shoulda slid to my crib
94707,Nas,Fuck it black no time for lookin back its done
94708,Nas,Plus congratulations you know you got a son
94709,Nas,I heard he looks like ya why dont your lady write ya 
94710,Nas,Told her she should visit thats when she got hyper
94711,Nas,Flippin talkin about he acts too rough
94712,Nas,He didnt listen he be riffin while Im tellin him stuff
94713,Nas,I was like  Yeah  shorty dont care she a snake too
94714,Nas,Fuckin with them niggas from that fake crew that hate you
94715,Nas,But yo guess who got shot in the dome piece 
94716,Nas,Jeromes niece on her way home from Jones Beach
94717,Nas,Its bugged plus little Rob is sellin drugs on the dime
94718,Nas,Hangin out with young thugs that all carry  s
94719,Nas,And night time is more trife than ever
94720,Nas,What up with Cormega Did you see him Are yall together 
94721,Nas,If so then hold the fort down represent to the fullest
94722,Nas,Say whats up to Herb Ice and Bullet
94723,Nas,I left a half a hundred in your commissary
94724,Nas,You was my nigga when push came to shove
94725,Nas,One love one love one love one love
94726,Nas,One love one love one love one love
94727,Nas,One love one love one love one love
94728,Nas,One love one love one love one love
94729,Nas,Dear Born youll be out soon stay strong
94730,Nas,Out in New York the same shit is goin on
94731,Nas,The crackheads stalkin loudmouths is talkin
94732,Nas,Hold check out the story yesterday when I was walkin
94733,Nas,That nigga you shot last year tried to appear
94734,Nas,Word to mother I heard him frontin
94735,Nas,And he be pumpin on your block
94736,Nas,Your man gave him your Glock
94737,Nas,And now they run together  what up son Whatever
94738,Nas,Since Im on the streets Ima put it to a cease
94739,Nas,But I heard you blew a nigga with a ox for the phone piece
94740,Nas,Wildin on the Island but now in Elmira
94741,Nas,Better chill  cause them niggas will put that ass on fire
94742,Nas,Last time you wrote you said they tried you in the showers
94743,Nas,But maintain when you come home the corners ours
94744,Nas,On the reals all these crab niggas know the deal
94745,Nas,When we start the revolution all they probably do is squeal
94746,Nas,But chill see you on the next V I
94747,Nas,I gave your mom dukes loot for kicks plus sent you flicks
94748,Nas,Your brothers buckwildin in   Main he wrote me
94749,Nas,He might beat his case til he come home Ill play it lowkey
94750,Nas,So stay civilized time flies
94751,Nas,Though incarcerated your mind dies
94752,Nas,I hate it when your moms cries
94753,Nas,It kinda makes me want to murder for reala
94754,Nas,I even got a mask and gloves to bust slugs but one love
94755,Nas,One love one love one love one love
94756,Nas,One love one love one love one love
94757,Nas,One love one love one love one love
94758,Nas,One love one love one love one love
94759,Nas,Sometimes I sit back with a Buddha sack
94760,Nas,Minds in another world thinkin
94761,Nas, How can we exist through the facts  
94762,Nas,Written in school text books bibles et cetera
94763,Nas,Fuck a school lecture the lies get me vexed er
94764,Nas,So I be ghost from my projects
94765,Nas,I take my pen and pad for the weekend
94766,Nas,Hittin Ls while Im sleepin
94767,Nas,A two day stay you may say I need the time alone
94768,Nas,To relax my dome no phone left the  at home
94769,Nas,You see the streets had me stressed somethin terrible
94770,Nas,Fuckin with the corners have a nigga up in Bellevue
94771,Nas,Or HDM hit with numbers from  to   
94772,Nas,A future in a maximum state pen is grim
94773,Nas,So I comes back home nobodys out but Shorty Doo Wop
94774,Nas,Rollin two phillies together in the Bridge we call em oo wops
94775,Nas,He said  Nas niggas caught me bustin off the roof
94776,Nas,So I wear a bulletproof and pack a black tre deuce  
94777,Nas,He inhaled so deep shut his eyes like he was sleep
94778,Nas,Started coughin one eye peeked to watch me speak
94779,Nas,I sat back like The Mack my army suit was black
94780,Nas,We was chillin on these benches
94781,Nas,Where he pumped his loose cracks
94782,Nas,I took the L when he passed it this little bastard
94783,Nas,Keeps me blasted and starts talkin mad shit
94784,Nas,I had to school him told him dont let niggas fool him
94785,Nas, Cause when the pistol blows
94786,Nas,The one thats murdered be the cool one
94787,Nas,Tough luck when niggas are struck families fucked up
94788,Nas,Coulda caught your man but didnt look when you bucked up
94789,Nas,Mistakes happen so take heed never bust up
94790,Nas,At the crowd catch him solo make the right man bleed
94791,Nas,Shortys laugh was cold blooded as he spoke so foul
94792,Nas,Only twelve tryin to tell me that he liked my style
94793,Nas,Then I rose wipin the blunts ash from my clothes
94794,Nas,Then froze only to blow the herb smoke through my nose
94795,Nas,And told my little man Ima ghost I broze
94796,Nas,Left some jewels in his skull that he can sell if he chose
94797,Nas,Words of wisdom from Nas try to rise up above
94798,Nas,Keep an eye out for Jake Shorty Wop one love
94799,Nas,One love one love one love one love
94800,Nas,One love one love one love one love
94801,Nas,One love one love one love one love
94802,Nas,One love one love one love one love
94803,Nas,To all my niggas locked up
94804,Nas,From Queensbridge and all over
94805,Nas,Cant forget my motherfuckin heart Big  one love
94806,Nas,Imagine smoking weed in the streets without cops harassin
94807,Nas,Imagine going to court with no trial
94808,Nas,Lifestyle cruising blue Bahama waters no welfare supporters
94809,Nas,More conscious of the way we raise our daughters
94810,Nas,Days are shorter nights are colder
94811,Nas,Feeling like life is over these snakes strike like a cobra
94812,Nas,The worlds hot my son got knocked evidently
94813,Nas,Its elementary they want us all gone eventually
94814,Nas,Trooping out of state for a plate of knowledge
94815,Nas,If coke was cooked without the garbage
94816,Nas,Wed all have the top dollars
94817,Nas,Imagine everybody flashin fashion designer clothes
94818,Nas,Lacing your clique up with diamond Roles
94819,Nas,Your people holding dough no parole no rubbers
94820,Nas,Go in raw imagine law with no undercovers
94821,Nas,Just some thoughts for the mind
94822,Nas,I take a glimpse into time
94823,Nas,Watch the blimp read  The World Is Mine 
94824,Nas,If I ruled the world  imagine that 
94825,Nas,Id free all my sons I love em love em baby
94826,Nas, Could it be if you could be mine wed both shine  
94827,Nas, Still living for today in these last days and times 
94828,Nas,The way to be paradise like relaxin
94829,Nas,Black Latino and Anglo Saxon
94830,Nas,Cash Lost Tribe of Shabazz free at last
94831,Nas,Brand new whips to crash then we laugh in the iller path
94832,Nas,The Villa house is for the crew how we do
94833,Nas,Trees for breakfast dime sexes and Benz stretches
94834,Nas,So many years of depression make me vision
94835,Nas,The better livin type of place to raise kids in
94836,Nas,Open they eyes to the lies historys told foul
94837,Nas,But Im as wise as the old owl plus the Gold Child
94838,Nas,Seeing things like I was controllin click rollin
94839,Nas,Tricking six digits on kicks and still holdin
94840,Nas,Trips to Paris I civilized every savage
94841,Nas,Give me one shot I turn trife life to lavish
94842,Nas,Political prisoner set free stress free
94843,Nas,No work release purple M s and jet skis
94844,Nas,Feel the wind breeze in West Indies
94845,Nas,I make Coretta Scott King mayor the cities
94846,Nas,And reverse fiends to Willies
94847,Nas,It sounds foul but every girl I meetd go downtown
94848,Nas,Id open every cell in Attica send em to Africa
94849,Nas,If I ruled the world  imagine that 
94850,Nas,Id free all my sons I love em love em baby
94851,Nas, Could it be if you could be mine wed both shine  
94852,Nas, Still living for today in these last days and times 
94853,Nas,And then well walk right up to the sun
94854,Nas,Well walk right up to the sun
94855,Nas,Youd love to hear the story how the thugs live in worry
94856,Nas,Duck down in car seats heats mandatory
94857,Nas,Running from Jake getting chased hunger for papes
94858,Nas,These are the breaks many mistakes go down out of state
94859,Nas,Wait I had to let it marinate we carry weight
94860,Nas,Trying to get laced flip the ace stack the safe
94861,Nas,Millionaire plan to keep the gat with the cocked hammer
94862,Nas,Making moves in Atlanta back and forth scrambler
94863,Nas, Cause you could have all the chips be poor or rich
94864,Nas,Still nobody want a nigga having shit
94865,Nas,If I ruled the world and everything in it skys the limit
94866,Nas,It wouldnt be no such thing as jealousies or B Felonies
94867,Nas,Strictly living longevity to the destiny
94868,Nas,I thought Id never see but reality struck
94869,Nas,Better find out before your times out what the fuck 
94870,Nas,If I ruled the world  imagine that 
94871,Nas,Id free all my sons I love em love em baby
94872,Nas, Could it be if you could be mine wed both shine  
94873,Nas, Still living for today in these last days and times 
94874,Nas,If I ruled the world if I ruled if I ruled  imagine that 
94875,Nas,Id free all my sons if I ruled if I ruled
94876,Nas,Black diamonds and pearls black diamonds black diamonds
94877,Nas, Could it be if you could be mine wed both shine 
94878,Nas, Still living for today in these last days and times 
94879,Nas,If I ruled the world if I ruled
94880,Nas,If I ruled Id free all my sons
94881,Nas,Black diamonds I love em love em baby
94882,Nas,Black diamonds and pearls if I ruled
94883,Nas,For my brothers with daughters I call this
94884,Nas,For my brothers with daughters I call this
94885,Nas,For my brothers with daughters I call this
94886,Nas,For my brothers with daughters
94887,Nas,I saw my daughter send a letter to some boy her age
94888,Nas,Who locked up first I regretted it then caught my rage
94889,Nas,Like how could I not protect her from this awful phase 
94890,Nas,Never tried to hide who I was she was taught and raised
94891,Nas,Like a princess but while Im on stage I cant leave her defenseless
94892,Nas,Plus shes seen me switchin women Pops was on some pimp shit
94893,Nas,She heard stories of her daddy thuggin
94894,Nas,So if her husband is a gangster cant be mad Ill love him
94895,Nas,Never for her I want better homie in jail  dead that
94896,Nas,Wait til he come home you can see where his heads at
94897,Nas,Niggas got game they be tryna live
94898,Nas,He seen your Mama crib plus Im sure he know who your father is
94899,Nas,Although you real plus a honest kid
94900,Nas,Dont think Im slow I know you probably had that chronic lit
94901,Nas,You seventeen I got a problem with it
94902,Nas,She looked at me like Im not the cleanest father figure
94903,Nas,For my brothers with daughters I call this
94904,Nas,For my brothers with daughters I call this
94905,Nas,Not sayin that our sons are less important
94906,Nas,For my brothers with daughters I call this
94907,Nas,For my brothers with daughters I call this
94908,Nas,Not sayin that our sons are less important
94909,Nas,This morning I got a call nearly split my wig
94910,Nas,This social network said  Nas go and get your kid  
94911,Nas,Shes on Twitter I know she aint gon post no pic
