,artist,text
36122,Eazy-E,No not the doctor physician or the MD
36123,Eazy-E,Drestas an O G  Doc is a phony
36124,Eazy-E,Only the real real still can chill with me
36125,Eazy-E,And the rest cant fuck with E
36126,Eazy-E,Cause Im the O G thatll bring you down
36127,Eazy-E,The devils son in law king of the underground
36128,Eazy-E,Good to go with the flow that I throw
36129,Eazy-E,Givin ya mo to let a motherfucker know
36130,Eazy-E,That I can get wreck on the set and make ya small
36131,Eazy-E,Cause you know I aint a joke
36132,Eazy-E,Im a motherfuckin loc and my name is Eazy E
36133,Eazy-E,But you bitches can just call me E
36134,Eazy-E,A real nigga from the C P T
36135,Eazy-E,Kickin ass and asking questions later
36136,Eazy-E,Oh yeah dont get smoked loc
36137,Eazy-E,Straight off the streets of mothafuckin Compton
36138,Eazy-E,Its the downest nigga I know
36139,Eazy-E,Bout to kick your ass in   
36140,Eazy-E, Creep with me as I crawl through the hood 
36141,Eazy-E,And I creep and I crawl creep creep
36142,Eazy-E,I said I creep and I crawl
36143,Eazy-E,And I creep and I crawl creep creep
36144,Eazy-E,I got my niggas from Grape Street Watts
36145,Eazy-E,I got my niggas from the C P T
36146,Eazy-E,I got my niggas all across the mothafuckin land
36147,Eazy-E,Thats down with the E A Z Y E
36148,Eazy-E,Now early in the mornin I awake
36149,Eazy-E,Thinkin about this dead fools life that I had to take
36150,Eazy-E,Frontin on a true name I peep game at point blank range
36151,Eazy-E,Fuck em   Mothafuckin right yall   
36152,Eazy-E,Not givin a fuck about the nigga that I wet
36153,Eazy-E,Thats what he gotta shout for actin like a trick
36154,Eazy-E,Now hes six feet and Im deep in his bitch
36155,Eazy-E,Creepin creepin creepin on the marks that be sleepin
36156,Eazy-E,Catch you slippin slap the clip in buck em every weekend
36157,Eazy-E,A scandalous lil nigga with no heart to feel remorse
36158,Eazy-E,Dig the niggas corpse leave it on his mommas porch
36159,Eazy-E,Dont give a fuck about shit thats why I mellow
36160,Eazy-E,Or maybe its the fact that Im kin to the Devil
36161,Eazy-E,A psychopathic nigga thats always quick to fill a
36162,Eazy-E,Nigga full of lead cause Im a mothafuckin killer
36163,Eazy-E,Thrilla from Manila though Im shorter than the average
36164,Eazy-E,Try to test yo luck and get bucked by a mothafuckin savage
36165,Eazy-E,And I creep and I crawl creep creep
36166,Eazy-E,I said I creep and I crawl
36167,Eazy-E,And I creep and I crawl creep creep
36168,Eazy-E,I got my niggas from Grape Street Watts
36169,Eazy-E,I got my niggas from the C P T
36170,Eazy-E,I got my niggas all across the mothafuckin land
36171,Eazy-E,Thats down with the E A Z Y E
36172,Eazy-E,Now later on that night as Im rollin
36173,Eazy-E,Lookin for a nigga I can gat and pack a hole in
36174,Eazy-E,Stoppin at a light on the late night
36175,Eazy-E,Fire up a Philly blunt to get my head right
36176,Eazy-E,See some niggas slippin at a burger stand
36177,Eazy-E,And in my mind all Im thinkin is a murder plan
36178,Eazy-E,Creepin through the drive through kinda slow
36179,Eazy-E,I got my hot beams on the back of the   yo
36180,Eazy-E,Smokin on chronic with the rag down
36181,Eazy-E,Not knowin Im about to lay their ass down
36182,Eazy-E,Reach for who was fool make my move
36183,Eazy-E,Leaned out my jeep and I creep kinda smooth
36184,Eazy-E,With the gat to the niggas dome now he sleeps
36185,Eazy-E,One shot to the top body flopped on the seat peep
36186,Eazy-E,I dumped on the lil skinny passenger
36187,Eazy-E,A bitch is screamin in a rage so I blasted her
36188,Eazy-E,Smashed and I got about five blocks
36189,Eazy-E,Before I got stopped by a punk ass cop  Shit fuck em  
36190,Eazy-E, You cant kill a cop  FUCK YOU  shots 
36191,Eazy-E,I creep and I crawl and I creep
36192,Eazy-E,I creep and I crawl and I creep
36193,Eazy-E,I creep and I crawl and I creep
36194,Eazy-E,I creep and I crawl and I creep
36195,Eazy-E,Good evening and welcome to Eazys playhouse
36196,Eazy-E,Now that you got the album
36197,Eazy-E,What the fuck are you gonna do with it bitch 
36198,Eazy-E,I knew this nigga back in uh uh back since a nigga was little
36199,Eazy-E,The nigga come from Compton Michigan nigga
36200,Eazy-E, Compton what You aint never met no Eazy E 
36201,Eazy-E,Well Ima introduce him  You a damn liar  
36202,Eazy-E,This is the craziest motherfucka you done seen  You a damn liar  
36203,Eazy-E,This niggas crazy just listen 
36204,Eazy-E,The microphone because I aint no joke
36205,Eazy-E,Tell your momma to get off of my tip
36206,Eazy-E,I have no time to give her my dick
36207,Eazy-E,Im gonna hold it and walk around the stage and
36208,Eazy-E,If you fuck up Im goin to get my gauge and
36209,Eazy-E,Unload the barrel and laugh
36210,Eazy-E,Cause Im puttin lead in your mothafuckin ass
36211,Eazy-E,Psychopathic but the hoes are attracted
36212,Eazy-E,Because when Im on hard my dicks at least a yard
36213,Eazy-E,In the days of old I was a nut
36214,Eazy-E,Now Ill need at least  hoes when I fuck
36215,Eazy-E,Cause I do a check nut   nut  
36216,Eazy-E,Then I save a nut for when theres nothin else to do
36217,Eazy-E,Get used to the crew bitch cause I would never quit
36218,Eazy-E,As soon as you think thats it Im still talkin shit
36219,Eazy-E,Ha ha I told you that nigga was crazy
36220,Eazy-E,Eazy Eric thats my boy ha ha godamnit
36221,Eazy-E,Step up to the mic nigga  Ay bitch pass me my Ripple 
36222,Eazy-E,I got a fable that you need to listen to
36223,Eazy-E,Its a funky little rhyme about a bitch or a two
36224,Eazy-E,Ones Sharon the other one Shaun
36225,Eazy-E,I wanted to nut but which one do I want 
36226,Eazy-E,Shaun said  Eazy let me fuck you blind 
36227,Eazy-E,And Sharon said  E I want to blow your mind 
36228,Eazy-E,I said fuck it I know what should be done
36229,Eazy-E,Just pull your panties down and Ill fuck the biggest one
36230,Eazy-E,And then I get the other pussy put it in the freezer
36231,Eazy-E,So I can always have a on hold skeezer
36232,Eazy-E,Yeah thats the ticket Ill do it like that
36233,Eazy-E,So I told the hoes to take a big step back
36234,Eazy-E,Took the zipper down eyes wide and said
36235,Eazy-E, Heres what Im gonna put inside 
36236,Eazy-E,Grab it like a rabbit  grab it  lets work it  work it 
36237,Eazy-E,But I wont love you when Im done Ill still be talkin shit    
36238,Eazy-E,Ha ha that boy good  Yeah that boys good 
36239,Eazy-E, That muthafucka be talkin all kinds of shit 
36240,Eazy-E,I used to get pussy like Eazy Eric every day
36241,Eazy-E, You aint no motherfucker How you know muthafucka 
36242,Eazy-E, Youre lyin your dick cant get hard 
36243,Eazy-E,Oh suck my dick muthafucka  Nigga you lyin 
36244,Eazy-E,Who you talkin to Well get up then nigga shit   
36245,Eazy-E,Wait a minute wait a minute cut this shit
36246,Eazy-E,Ayo Yella boy why dont you rewind it
36247,Eazy-E,Niggas dont see Im a    percent legit
36248,Eazy-E,And you know it aint about all that bullshit
36249,Eazy-E,Its about fuckin this bitch and that bitch
36250,Eazy-E,But not the bitch with the  day itch like that ho
36251,Eazy-E,She says she wants to do it like a doggy
36252,Eazy-E,But she got more crabs than a seafood platter
36253,Eazy-E,Bitch on the gank move to skeaze me
36254,Eazy-E,Just to say  I got fucked by Eazy 
36255,Eazy-E,So I slapped the ho like a pimp
36256,Eazy-E,I might be a woman beater but Im not a pussy eater
36257,Eazy-E,So when the shit hits the fan its outta my mouth
36258,Eazy-E,You dont like what Im talkin about 
36259,Eazy-E,All of yall can just suck my dick
36260,Eazy-E,You could quote me now cause Im still talkin shit
36261,Eazy-E,The boys good I told you boy
36262,Eazy-E, Ay I knew him when he was knee high 
36263,Eazy-E,The nigga got talent you dont know a damn thing
36264,Eazy-E, I knew him when he was knee high 
36265,Eazy-E,He still is knee high muthafucka
36266,Eazy-E, Yeah I like that part bring that shit back one more time Maestro 
36267,Eazy-E,Thats that old Z Z Hill huh Ha ha ha
36268,Eazy-E,I tell ya boy I can do the Mashed Potato nigga what can you do 
36269,Eazy-E, Muthafucka I can do the bugaloo I can do the bugaloo 
36270,Eazy-E,Bugaloo  That old shit been played out back in     
36271,Eazy-E,Well it be the real niggas back with that hard street shit
36272,Eazy-E,Bitch niggas be pissin a fit but I say fuck em when I buck em
36273,Eazy-E,Its that nigga with the cool and mellow shit for your ass
36274,Eazy-E,Takin niggas back through the past
36275,Eazy-E,All up on my nuts shit be swingin like a fist
36276,Eazy-E,Cant even take a piss if I did niggas would cut they wrist
36277,Eazy-E,In a motherfuckin candy   beat that ass with the switch
36278,Eazy-E,Then blast on the bitch who was all in my shit
36279,Eazy-E,Its that nigga Ren back for the    
36280,Eazy-E,They say real niggas was dead but this nigga be alive
36281,Eazy-E,So Im puttin it down with that nigga E
36282,Eazy-E,For all of my niggas in the C P T
36283,Eazy-E,So here we go again with part  of the script
36284,Eazy-E,Making bitch made niggas bite their lip when we dip
36285,Eazy-E,So tell me how the fuck do it feel
36286,Eazy-E,To get hit with the motherfuckin real
36287,Eazy-E, Shouts goin out to the hardcore hip hop 
36288,Eazy-E, Buckin these niggas til they drop 
36289,Eazy-E,Now everythings good in my hood and its on and poppin
36290,Eazy-E,Eazy muthaphukkin E from east side south Compton
36291,Eazy-E,Straight givin up the real
36292,Eazy-E,On how a nigga feel talk that shit mothafuckers caps get peeled
36293,Eazy-E,Gettin high than a motherfucker  Niggas know whats up
36294,Eazy-E,Im that gangsta gangsta is that what theyre still yellin 
36295,Eazy-E,Nigga G to a T saggin and bailin
36296,Eazy-E,Live by the gun you know what Im sayin Ren  Yeah 
36297,Eazy-E,So I guess Ill die by that motherfucker then
36298,Eazy-E,So when I die niggas bury me
36299,Eazy-E,Make sure my shit reads Eazy muthaphukkin E
36300,Eazy-E,And its a fact to be exact my tombstone should read
36301,Eazy-E,He put Compton on that map
36302,Eazy-E,And thats how a nigga feel
36303,Eazy-E,When Im givin up the motherfuckin real
36304,Eazy-E, Shouts goin out to the hardcore hip hop 
36305,Eazy-E, Buckin these niggas til they drop 
36306,Eazy-E,Niggas be pissin on they self when the real niggas drop
36307,Eazy-E,While they rollin in they shit hittin corners on the block
36308,Eazy-E,Niggas fresh out the pen with two strikes
36309,Eazy-E,Be bumpin this real shit every fuckin night its alright niggas
36310,Eazy-E,Its two hard motherfuckers on the streets
36311,Eazy-E,Its the nigga MC Ren and the nigga Eazy   
36312,Eazy-E,   does it ya wish the fuck that you could do it
36313,Eazy-E,Got a nine millimeter dont make me have to shoot it
36314,Eazy-E,Who gives a fuck about the police
36315,Eazy-E,Cause them the main mothafucka that break the peace
36316,Eazy-E,Now let me know how the fuck do you feel
36317,Eazy-E,Gettin hit with the motherfuckin real
36318,Eazy-E, Shouts goin out to the hardcore hip hop 
36319,Eazy-E, Buckin these niggas til they drop 
36320,Eazy-E,Yeah keepin it real for the    
36321,Eazy-E,For all you niggas out there thats true to the motherfuckin game
36322,Eazy-E,N W A s back in this bitch
36323,Eazy-E,And busta ass niggas dont even understand it
36324,Eazy-E,Theyll never take me alive Im gettin high with my four five
36325,Eazy-E,Cocked on these suckas time to die
36326,Eazy-E,Even as a youngster causin ruckus on the back of the bus
36327,Eazy-E,I was a fool all through high school kickin up dust
36328,Eazy-E,But now Im labelled as a troublemaker who can you blame 
36329,Eazy-E,Smokin weed helped me take away the pain
36330,Eazy-E,So Im hopeless rollin down the freeway swervin dont worry
36331,Eazy-E,Im about to crash up on the curb cause my visions blurry
36332,Eazy-E,Maybe if they tried to understand me what should I do 
36333,Eazy-E,I had to feed my fuckin family what else could I do
36334,Eazy-E,But be a thug  out slangin with the homies
36335,Eazy-E,Fuck hangin with them phonies in the club
36336,Eazy-E,Never been a stranger to homicide
36337,Eazy-E,My citys full of gang bangers and drive bys
36338,Eazy-E,Why do we die at an early age
36339,Eazy-E,But still a victim of the   gauge
36340,Eazy-E,Mind full of sick thoughts
36341,Eazy-E,And I aint goin back to court
36342,Eazy-E,So fuck what you thought Im drinkin Hennessey
36343,Eazy-E,Runnin from my enemies will I live to be   
36344,Eazy-E,Gonna pay back niggas who did me wrong in the past
36345,Eazy-E,Some motherfuckers gotta die 
36346,Eazy-E,Im an evil motherfucker ready to tear shit up
36347,Eazy-E,Im gonna put these things on you and never let up
36348,Eazy-E,Gonna pay back niggas who did me wrong in the past
36349,Eazy-E,Some motherfuckers gotta die 
36350,Eazy-E,Im an evil motherfucker ready to tear shit up
36351,Eazy-E,Im gonna put these things on you and never let up
36352,Eazy-E,See my momma   she was wrong when I was born
36353,Eazy-E,That a nigga like E shoulda never been born
36354,Eazy-E,Gonna pay back niggas who did me wrong in the past
36355,Eazy-E,Lock up  niggs  kill up   pigs
36356,Eazy-E,Innocent and fuckers are also dyin too
36357,Eazy-E,Fuck fuck fuck and plant my seeds
36358,Eazy-E,Leavin kids in this world like me
36359,Eazy-E,The lunatic psycho mutherfucka Eazy E
36360,Eazy-E,To Evel Knievel stunt car drivin
36361,Eazy-E,Gonna pay back niggas who did me wrong in the past
36362,Eazy-E,Some motherfuckers gotta die 
36363,Eazy-E,Im an evil motherfucker ready to tear shit up
36364,Eazy-E,Im gonna put these things on you and never let up
36365,Eazy-E,Gonna pay back niggas who did me wrong in the past
36366,Eazy-E,Some motherfuckers gotta die 
36367,Eazy-E,Im an evil motherfucker ready to tear shit up
36368,Eazy-E,Im gonna put these things on you and never let up
36369,Eazy-E,They got me mobbin like Im
36370,Eazy-E,Loced and ready to get my slug on
36371,Eazy-E,And I load my clip and slip my motherfuckin gloves on
36372,Eazy-E,I aint scared to blast on these suckas if they test me
36373,Eazy-E,Trust I got my Glock cocked playa if they press me
36374,Eazy-E,Bust on motherfuckers with a  paaassion
36375,Eazy-E,Better duck cause I aint lookin when Im  b b blaaastin
36376,Eazy-E,Im a nut an drinkin Hennessey and gettin high
36377,Eazy-E,On the lookout for my enemies dont wanna die
36378,Eazy-E,Tell me why cause this stress is gettin major
36379,Eazy-E,A buck fifty across the face with my razor
36380,Eazy-E,What can I do but be a thug until Im dead and gone
36381,Eazy-E,Keep my brain on the game and stay head strong
36382,Eazy-E,Cause I dont really wanna die yet
36383,Eazy-E,Dizzy spells flashbacks in my head
36384,Eazy-E,Niggas aint want me to bein happy when Im dead
36385,Eazy-E,But I aint goin out unless   niggas die
36386,Eazy-E,Im dying anyway so Im thinking suicide
36387,Eazy-E,Gonna pay back niggas who did me wrong in the past
36388,Eazy-E,Some motherfuckers gotta die 
36389,Eazy-E,Im an evil motherfucker ready to tear shit up
36390,Eazy-E,Im gonna put these things on you and never let up
36391,Eazy-E,Gonna pay back niggas who did me wrong in the past
36392,Eazy-E,Some motherfuckers gotta die 
36393,Eazy-E,Im an evil motherfucker ready to tear shit up
36394,Eazy-E,Im gonna put these things on you and never let up
36395,Eazy-E,Inside the minds of real Gs
36396,Eazy-E,Death Row is looked upon as the studio gangstas of the   s
36397,Eazy-E,A joke  laughing in a game called  minutes of fame
36398,Eazy-E,Now you got seconds left kick it
36399,Eazy-E,Come on come all and let me ride nigga
36400,Eazy-E,Eazy E C P T how the hell you figure
36401,Eazy-E,To be the best on the west huh yeah
36402,Eazy-E,Fool I doubt it this is east side nigga
36403,Eazy-E,So what up Dogg Pound Crip
36404,Eazy-E,And thats comin straight from the ruthless gangsta Eazy E
36405,Eazy-E,Now what would I do haha lets see
36406,Eazy-E,Now I would take out Suge and stomp down the row
36407,Eazy-E,Since Dre is a bitch pimp slap the ho  ba by 
36408,Eazy-E,Now Im seein doubles aw man
36409,Eazy-E,Two dogs in a huddle aw goddamn
36410,Eazy-E,Now diggidi diggidi Daz I biggidi biggidi blast
36411,Eazy-E,Don t run or i ll smoke that ass
36412,Eazy-E,Now Kurupt dont even set trip
36413,Eazy-E,Yellin Long Beach    blood and puppy pound Crip
36414,Eazy-E,While Im all in your philly ho
36415,Eazy-E,So come with it fool and test your luck and Ill beat that ass
36416,Eazy-E,Now Im creepin through the fog yeah big dog blue
36417,Eazy-E,Got my  milla killa huntin dog named Snoop
36418,Eazy-E,You can run nigga but you cant hide
36419,Eazy-E,Eazy E straight creepin on the east side
36420,Eazy-E,Found Snoop freebasin in a rock house
36421,Eazy-E,I kicks in the door I said it before
36422,Eazy-E,I never let no bustas test me no more
36423,Eazy-E, Murder was the case that they gave me 
36424,Eazy-E, Murder was the case that they gave me 
36425,Eazy-E,Ill smoke all you fools even you boo boo and your baby
36426,Eazy-E, Murder was the case that they gave me 
36427,Eazy-E,What would you do if we rolled on you 
36428,Eazy-E,    so dont even think about    
36429,Eazy-E,What would you do if we rolled on you
36430,Eazy-E,    stepping in the goddamn house 
36431,Eazy-E,What would you do if we rolled on you
36432,Eazy-E,    so dont even think about    
36433,Eazy-E,What would you do Dirty Red
36434,Eazy-E,    stepping in the goddamn house 
36435,Eazy-E,Dirty Red I comes on the sneak
36436,Eazy-E,Hittin niggas low with the cappy ass flow
36437,Eazy-E,As I creep through the street peepin niggas from Death Row
36438,Eazy-E,Bet you I know which one of yall make the best ho
36439,Eazy-E,So let me break it down as Im lost in the mist
36440,Eazy-E,Take word of advice and dont come fuckin with this
36441,Eazy-E,It aint a joke niggas choke from the smoke that I blaze
36442,Eazy-E,Purple haze you be dazed in a stun
36443,Eazy-E,Ill put you on your back nigga what
36444,Eazy-E,The year is   and Im runnin the house
36445,Eazy-E,Now tell me what can you do
36446,Eazy-E,If me and a few of my homies came through
36447,Eazy-E,Dumpin real on you trick made bitch made niggas
36448,Eazy-E,Wut could you do if we rolled on you
36449,Eazy-E,Never broke a law in his life
36450,Eazy-E,Besides beatin up Ricky Harris wife
36451,Eazy-E,From a high top fade to sportin braids
36452,Eazy-E,And gettin played not payed played
36453,Eazy-E,And we all know whos doin the pimpin
36454,Eazy-E,Daz dont be a follower be a leader
36455,Eazy-E,And stay off the next mans nuts
36456,Eazy-E,Kurupt the Kingpin sticks with the    s
36457,Eazy-E,Cause you dont need those other hoes
36458,Eazy-E,Cause theyre about to go up in you
36459,Eazy-E,Death Row really doe ba by
36460,Eazy-E,Perched up high on a roof top
36461,Eazy-E,Like a bird Im havin evil thoughts
36462,Eazy-E,A black hood covers my face
36463,Eazy-E,And death flows through my mind at its own pace
36464,Eazy-E,Sometimes I feel like a super hero
36465,Eazy-E,I shoot ya heart with a dime
36466,Eazy-E,Now Im back to the moral of my tale
36467,Eazy-E,I see a victim and then my thoughts fail
36468,Eazy-E,My minds still fumblin with the present slavery
36469,Eazy-E,Im here to save you but whos to save me
36470,Eazy-E,I hold my strap so long that my palms all wet
36471,Eazy-E,I put my finger on the button then the sight I check
36472,Eazy-E,I make the kill heres the deal
36473,Eazy-E,After the triggers pulled then the death is sealed
36474,Eazy-E,So its the shots that sing out like a piper
36475,Eazy-E,Everyones scared Im the neighborhood sniper
36476,Eazy-E,They say that some of them bust them pieces and some of them run up to get that leak leak
36477,Eazy-E,Everybody else everybody else Imma shoot to kill ya
36478,Eazy-E,Some of them bust them pieces some of them run up to get that leak leak
36479,Eazy-E,Everybody else everybody else Imma shoot to kill ya
36480,Eazy-E,Boom boom boom boom had to murda  em
36481,Eazy-E,Boom boom had to murda  em
36482,Eazy-E,I put my gun up to his head
36483,Eazy-E,And simply scared the bitch boo
36484,Eazy-E,Being the E ya know Im thinkin devious thoughts
36485,Eazy-E,Take off ya clothes nigga and here comes a plot
36486,Eazy-E,His bitch was scared she made a move I pulled the trigger
36487,Eazy-E,Now theres nothing left but a snitch
36488,Eazy-E,Heres a four leaf clover punk make a wish
36489,Eazy-E,One  three strikes your out
36490,Eazy-E,This nigga is dead and now Im lookin for a window to get out
36491,Eazy-E,I made my escape the cops chase
36492,Eazy-E,Duckin to an alley so they dont recognize my face
36493,Eazy-E,The boy had to pay the piper
36494,Eazy-E,So they all stayin scared of the neighborhood sniper
36495,Eazy-E,Im Doin dirt as I continue my mission
36496,Eazy-E,Killin all fools as an addiction
36497,Eazy-E,As the E lovin the game leavin a shame
36498,Eazy-E,And in my heart I feel no motherfuckin pain
36499,Eazy-E,Because my heart is cold as I was told
36500,Eazy-E,And with my A K   I stand bold
36501,Eazy-E,Rippin up shit with the fury of my gun shot
36502,Eazy-E,Pop pop pow as I watch the motherfucker drop
36503,Eazy-E,Lovin the site as the blood spill
36504,Eazy-E,Take a photograph To keep in my hall of thrills I m stayin calm
36505,Eazy-E,And never hyper as I succeed in my mission
36506,Eazy-E,I be a neighborhood sniper
36507,Eazy-E, Hi Claude again You remember I told you about my cousin when I was    Well the year after that I killed this kid Louie Bashed his head in with my Louisville Slugger hahaha I got away with it haha But erm I wanna apologize to Louie Im sorry Louie hahaha  
36508,Eazy-E,Bashed his head in with my Louisville Slugger
36509,Eazy-E,I knew this motherfucker named Louie
36510,Eazy-E,Every day the nigga talked shit but today he tried to do me
36511,Eazy-E,He rolled down my block with a pistol and a stare
36512,Eazy-E,A black khaki suit and dooky braids in his hair
36513,Eazy-E,The motherfucker thinks Im slippin
36514,Eazy-E,But I got my gat and a bat and a   and Im sippin
36515,Eazy-E,Waitin for the fool to get out the car
36516,Eazy-E,The stupid motherfucker thinks Im a star
36517,Eazy-E,Im the type thatll kick the niggas ass
36518,Eazy-E,Eazy Es a nigga thatll blast
36519,Eazy-E,Hold up wait the nigga started to load his gat
36520,Eazy-E,I grabbed my bat and ran around the back yo
36521,Eazy-E,Hes at my window thinkin I play Nintendo
36522,Eazy-E,But the stupid nigga dont know Im behind him so
36523,Eazy-E,He dropped the gat like a stupid motherfucker
36524,Eazy-E,So I bashed his head in with my Louisville Slugger
36525,Eazy-E,I knew this bitch named Peaches
36526,Eazy-E,She often wanted me to fuck her trampy ass on the beaches
36527,Eazy-E,Be fuckin around with me instead of fuckin her man
36528,Eazy-E,Shes butt naked with my dick in her hand yo
36529,Eazy-E,As soon as Peaches started suckin
36530,Eazy-E,Nigga behind my car and he was duckin
36531,Eazy-E,So I told the bitch to hold on
36532,Eazy-E,You stupid bitch put your motherfuckin clothes on
36533,Eazy-E,I wonder if this niggas tryna jack me
36534,Eazy-E,Cause I aint got my gat with me shit
36535,Eazy-E,The nigga started runnin up fast
36536,Eazy-E,I thought he was gonna blast so I hid behind her ass
36537,Eazy-E,She started howlin out  wait 
36538,Eazy-E,But the punk nigga pulled out mace
36539,Eazy-E,He asked the stupid ass bitch did I mug her
36540,Eazy-E,So I bashed his head in with my Louisville Slugger
36541,Eazy-E,Im a motherfuckin psycho and I dont give a fuck about em
36542,Eazy-E,I kill the nigga cut off his dick so you know I got em
36543,Eazy-E,Cut his vein ate his brain left the nigga for dead
36544,Eazy-E,Now its a gallon of blood drippin from under his bed
36545,Eazy-E,  Oh no What happened to my lover   
36546,Eazy-E,Bitch I bashed his head in with my Louisville Slugger
36547,Eazy-E,Bitch tried to call the cops fuck that
36548,Eazy-E,I gotta take the girl out with my motherfuckin bat
36549,Eazy-E,Cause I aint doin ten in the pen
36550,Eazy-E,For a bitch and her dead ass boyfriend
36551,Eazy-E,Im reachin for my weapon slow
36552,Eazy-E,Thats when I notice some nigga standin by the door
36553,Eazy-E,The little nigga said  dont kill my mother 
36554,Eazy-E,So I bashed his head in with my Louisville Slugger
36555,Eazy-E,Just sit back and light a spliff to this and dont slip
36556,Eazy-E,On a funky ass track jump back
36557,Eazy-E,Strapped with a gat and a sack in a    Lac
36558,Eazy-E,Come clean gangsta lean I got green
36559,Eazy-E,Bud I serve dubs like it aint no thing
36560,Eazy-E,I hang with O G niggas dont set trip
36561,Eazy-E,Or you might get a slug in your fuckin back
36562,Eazy-E,I dont slack when it come to street
36563,Eazy-E,I kick real G shit to a gangsta beat
36564,Eazy-E,Its so sweet when you got money to spend
36565,Eazy-E,I got a cool ass tilt and a fly ass Benz
36566,Eazy-E,I make ends spend my dough on no ho
36567,Eazy-E,Thats how it is and thats how it goes
36568,Eazy-E,Act like you know when I creep real slow
36569,Eazy-E,Givin love to them niggas that I know is real Gs
36570,Eazy-E,If you got love for dem gangstas
36571,Eazy-E,If you down for the crime   Thats right fool   
36572,Eazy-E,If you got love for dem hustlas
36573,Eazy-E,If you makin straight dough   hooooo  
36574,Eazy-E,If you got love for dem playas
36575,Eazy-E,Let me hear you say ooooh ladies we want you   ooooooh  
36576,Eazy-E,If you got love for dem straight Gs
36577,Eazy-E,Let me hear you mothafuckas just scream   heeeeeeey  
36578,Eazy-E,The ruthless network drive by expert
36579,Eazy-E,Straight outta Compton kickin up dust
36580,Eazy-E,The ruthless network drive by expert
36581,Eazy-E,Dump dump on a nigga with a quickness
36582,Eazy-E,And they got no cure for this sickness
36583,Eazy-E,I get paid for the way that I kick this
36584,Eazy-E,Like a G ster an O G  ster
36585,Eazy-E,  Whos that   A real nigga named Eazy
36586,Eazy-E,And I live my life straight crazy
36587,Eazy-E,Dont need no punk niggas payin me
