,artist,text
104730,Pusha-T,Ring ring a nigga wont sing
104731,Pusha-T,Ring ring I keep that bitch clean
104732,Pusha-T,Ring ring a nigga wont sing
104733,Pusha-T,less he is an insomniac hell die in a dream
104734,Pusha-T,I sit with the liars duck tape and tiers
104735,Pusha-T,Been lost their soul they just waiting on the fire
104736,Pusha-T,Innocent faces with a shit load of priors
104737,Pusha-T,Something out of nothing a team full of MacGyvers
104738,Pusha-T,Deep sea dive for the fishscale
104739,Pusha-T,Tryna find a better price man that ship sailed
104740,Pusha-T,Take a breath and head back if that shit failed
104741,Pusha-T,Drop weight like an anchor then you set sail
104742,Pusha-T,Hell freeze over like the watch I put the sleeve over
104743,Pusha-T,Engine devil scream when I turn the key over
104744,Pusha-T,Pirellis on the street rolling like a steam roller
104745,Pusha-T,Bitches double team when I have my sleepovers
104746,Pusha-T,Yeah Re Up Gang with the G Unit
104747,Pusha-T,This is tailor made drug dealer theme music
104748,Pusha-T,Test it on your tongue or either watch a fiend do it
104749,Pusha-T,I got you hooked and I laugh as you lean to it
104750,Pusha-T,It s like raid spraying on you roaches
104751,Pusha-T,The AK is an animal it is ferocious
104752,Pusha-T,A nigga wanna sing hope he is the dopest
104753,Pusha-T,Watch that nigga disappear hocus pocus
104754,Pusha-T,Ring ring a nigga wont sing
104755,Pusha-T,Ring ring I keep that bitch clean
104756,Pusha-T,Ring ring a nigga wont sing
104757,Pusha-T,less he is an insomniac hell die in a dream
104758,Pusha-T,Big up di numba one awtist inna di rap game Pusha T
104759,Pusha-T,Me waa unnu kno seh nuhbody nah fuck wid da bwoy yah in or outta music
104760,Pusha-T,Nuhbody nuh ave di lyrics nuh body nuh ave di style or fashion weh him have
104761,Pusha-T,Fi him program sort out differnt from unnu
104762,Pusha-T,Unnu a rampin business caa who 
104763,Pusha-T,When him touch mike everybody haffi puddung an run weh
104764,Pusha-T,My niggas still in prison though
104765,Pusha-T,Til they free nones forgiven
104766,Pusha-T,Its only one mission its only one magician
104767,Pusha-T,All Stars in Houston this year Im still fishin
104768,Pusha-T,The plugs playground where them hoes play around
104769,Pusha-T,Galleria Mr Trick Bag when Im in town
104770,Pusha-T,Thats the energy Im missin
104771,Pusha-T,A thousand drug dealers with the cruelest intentions
104772,Pusha-T,Vengeance is mine says the Lord
104773,Pusha-T,Throwin shots at niggas cause Im bored and they whores  Pussy  
104774,Pusha-T,Im Kobe goin for his sixth ring while that church choir sing
104775,Pusha-T,Imma lean til they crown me king of New Orleans
104776,Pusha-T,Now everybody so   s   s inspired
104777,Pusha-T,But none of you niggas   s and   s rhymin
104778,Pusha-T,You laptop hot just internet warm
104779,Pusha-T,Down low for downloads dont get caught up in my storm  Dont do it 
104780,Pusha-T,Fuck nigga you just internet porn
104781,Pusha-T,Now we dont gotta fake it no more the lines drawn
104782,Pusha-T,Im too much dope dealer for rap niggas
104783,Pusha-T,Too much closer to every trap nigga
104784,Pusha-T,Im just preachin facts nigga
104785,Pusha-T,Im more biased to the coke dealin Coupe drivers
104786,Pusha-T,And bad bitches steered wrong by they loose mamas
104787,Pusha-T,Its the wrath of the caine
104788,Pusha-T,Preludes the debut My Name Is My Name
104789,Pusha-T,Ay yo they said its   points higher up there
104790,Pusha-T,Lord Father I dont mean to be a bother
104791,Pusha-T,Im just prayin youll protect me on this road
104792,Pusha-T,From the rascal alf alphabet boys
104793,Pusha-T,Trackin choppers in the highway patrol
104794,Pusha-T,It aint right but its white and its right
104795,Pusha-T,And I know once I get there that its sold
104796,Pusha-T,Lord Father I dont mean to be a bother
104797,Pusha-T,Im just prayin youll protect me on this road
104798,Pusha-T,One man cowboy speed limit timid
104799,Pusha-T,Chevy Malibu we graduated from them renteds
104800,Pusha-T,Lost    large on the last time we sent it
104801,Pusha-T,Its only four letters I aint worried bout a sentence  k i l o 
104802,Pusha-T,Travelin the distance stayin off the white line
104803,Pusha-T,Alphabet boys out prayin what they might find
104804,Pusha-T,I hate the Carolinas racial profiler
104805,Pusha-T,Say you smokin marijuanas fuck you talkin bout
104806,Pusha-T,My piss is clearer than my mamas with her church wig on
104807,Pusha-T,Thousand grams thousand hands thousand furs thousand bands
104808,Pusha-T,Hundred thousand dollar horse all star we stylin in
104809,Pusha-T,You niggas aint takin road trips for real
104810,Pusha-T,Route   with the vacuum seal
104811,Pusha-T,Pre paid Legal on my window shield
104812,Pusha-T,The ice cream mans on his Jack  Jill
104813,Pusha-T,Moving weight state to state MACK trucks I deal MACK trucks I fill
104814,Pusha-T,I feel better knowin that the donor is anonymous
104815,Pusha-T,Tugboat or car tow we summertime snowin
104816,Pusha-T,Reasonable Doubt flowin on your niggas
104817,Pusha-T,Been gettin it since   in black AC Vigors
104818,Pusha-T,Snub    with the matte black trigger
104819,Pusha-T,When How Can I Be Down was filled with crack niggas
104820,Pusha-T,This track dictates everything Im supposed to say
104821,Pusha-T,So have mercy on this soul that Ive thrown away
104822,Pusha-T,Although its cliche the devil had a hold of me
104823,Pusha-T,This greedy motherfucker couldnt put the blow away
104824,Pusha-T,Bitches blowing kisses and rappers throwing disses
104825,Pusha-T,Hoping to land their ass on all top  lists
104826,Pusha-T,I wish you niggas well you niggas wish I fail
104827,Pusha-T,You gonna make me bear these arms like a Chippendale
104828,Pusha-T,Squeeze off on him leave cross on him
104829,Pusha-T,By the time the bodies found theres peat moss on him
104830,Pusha-T,I could show all you the ways in which crime pays
104831,Pusha-T,My drug rings a multi million dollar crime wave
104832,Pusha-T,Two ranch homes both dockside
104833,Pusha-T,Get this money back counter clockwise
104834,Pusha-T,Little bubble on the cut like peroxide
104835,Pusha-T,The poison in the car is not carbon monoxide
104836,Pusha-T,I ask forgiveness lord in hopes of getting more
104837,Pusha-T,Then beg forgiveness for the same thing he forgave me for
104838,Pusha-T,I wasnt crazy poor see I was lazy more
104839,Pusha-T,A thousand kilos cross his lines that you cant ignore
104840,Pusha-T,I felt entitled to it not how the bible do it
104841,Pusha-T,My bright eyes exposed to how the hood idols do it
104842,Pusha-T,I just took a page then I took the stage
104843,Pusha-T,Then put the face of that Rollie in that diamond cage
104844,Pusha-T,I tried to tame the beast best I could no leash
104845,Pusha-T,I stood the test of time air tight no leaks
104846,Pusha-T,Not a squeak not a peep of a word
104847,Pusha-T,I done lived half my life in arms reach of a bird
104848,Pusha-T,Have mercy on me they put curses on me
104849,Pusha-T,I couldve been six feet or had nurses on me
104850,Pusha-T,It was written like these tatted Bible verses on me
104851,Pusha-T,I feel the weight upon my shoulders like the church is on me
104852,Pusha-T,You dont do all the shit that I done and make it through and not be forgiven
104853,Pusha-T,This is the Wrath of Caine motherfuckers
104854,Pusha-T,My Name is My name coming soon
104855,Royce Da 59,You will not be able to stay home brotha
104856,Royce Da 59,You will not be able to plug in turn on and cop out
104857,Royce Da 59,You will not be able to lose yourself on skag and skip out for beer during commercials
104858,Royce Da 59,Because the revolution will not be televised
104859,Royce Da 59,This right here for the number one
104860,Royce Da 59,Number ones here with your number one
104861,Royce Da 59,You aint number one just another one
104862,Royce Da 59,Now everybody sayin that they number one
104863,Royce Da 59,Ring the alarm the caterpillar keeps firing
104864,Royce Da 59,Ohh we in the war where butterflies keep dyin  ahh 
104865,Royce Da 59,Im a product of Parker Lewis and Kubiak
104866,Royce Da 59,If I didnt do this where in the fuck would you be at 
104867,Royce Da 59,See theres a difference between us what I spit hit arenas
104868,Royce Da 59,You a drip from my penis I eat lions and sip hyenas
104869,Royce Da 59,You number one when it come to slaughtering mics
104870,Royce Da 59,Im tryna be number one in my son and daughter life
104871,Royce Da 59,Uhh all you niggas my little rapper babies
104872,Royce Da 59,Yall my children yall bit my shit and contracted rabies
104873,Royce Da 59,Dont you grade me next to these rappers baby thats degrading
104874,Royce Da 59,My style got so many different facets
104875,Royce Da 59,I switch into so many different passions
104876,Royce Da 59,Im skippin class to be fascinatin
104877,Royce Da 59,My pen is like Big Ben this shits just a classic waiting
104878,Royce Da 59,Your favorite rapper come at me I just decapitate him
104879,Royce Da 59,I hate congratulating these has beens who had their highs
104880,Royce Da 59,These rappers only won their matches because they strategize
104881,Royce Da 59,I bring Attica to these patterns and heres my battle cry
104882,Royce Da 59,Ring the alarm the caterpillar is firing
104883,Royce Da 59,Ohh we in the war where butterflies keep dyin  ahh 
104884,Royce Da 59,This right here for the number one
104885,Royce Da 59,Number ones here with your number one
104886,Royce Da 59,You aint number one just another one
104887,Royce Da 59,Now everybody sayin that they number one
104888,Royce Da 59,Kid think your number wont quit
104889,Royce Da 59,Number one song get your number one chick
104890,Royce Da 59,Number one fly with your number one kick
104891,Royce Da 59,When its all done then your number gon switch
104892,Royce Da 59,Guess what Ima never do Show so much respect to you
104893,Royce Da 59,That I feel like were friends so now we no longer competitors
104894,Royce Da 59,That could be the death of you
104895,Royce Da 59,Never let someone whos not as smart as you
104896,Royce Da 59,Gas you up and tell you somethin you never knew
104897,Royce Da 59,Always stay professional you always gon make revenue
104898,Royce Da 59,Dont let people next to you that dont want the best for you
104899,Royce Da 59,Its completely normal to hold on to a regret or two
104900,Royce Da 59,I do what I wanna do they do what I let them do
104901,Royce Da 59,Everything these niggas be sayin is a fuckin lie
104902,Royce Da 59,Its nothing I can say to you that is realer
104903,Royce Da 59,Remember when you praisin the butterfly
104904,Royce Da 59,Dont you ever disrespect the fuckin caterpillar
104905,Royce Da 59,This right here for the number one
104906,Royce Da 59,Number ones here with your number one
104907,Royce Da 59,You aint number one just another one
104908,Royce Da 59,Now everybody sayin that they number one
104909,Royce Da 59,Kid think your number wont quit
104910,Royce Da 59,Number one song get your number one chick
104911,Royce Da 59,Number one fly with your number one kick
104912,Royce Da 59,When its all done then your number gon switch
104913,Royce Da 59,Youre looking at Attila the psychopathic killer the caterpillar
104914,Royce Da 59,Dont tell me when Im supposed to rap until
104915,Royce Da 59,Especially when your favorite rapper aint even half as ill
104916,Royce Da 59,A savage still the tracks a banana peel attack of the silverback gorilla
104917,Royce Da 59,Youre havin a little trouble fathomin this is actually happenin
104918,Royce Da 59,Like Anderson Silva back when he snapped his shin in half
104919,Royce Da 59,And then had the shit hangin by a flap of skin
104920,Royce Da 59,After he tried to plant the shit back on the mat again
104921,Royce Da 59,Pad to pen I m batty like eyelids when theyre blinkin a lot
104922,Royce Da 59,You cant be butterflies my offsprings are just moths
104923,Royce Da 59,I see that thing Ima squash it and rip the wings of it off
104924,Royce Da 59,So ring the alarm pull the extinguishers off of the wall
104925,Royce Da 59,Set the sprinklers off like Jada Pinkett and Queen Latifah
104926,Royce Da 59,Till the shingles come off the roof well shout at the ceiling
104927,Royce Da 59,Slaughterhouse in the building middle fingers aloft
104928,Royce Da 59,Say what I think when I rhyme in ink pen I talk
104929,Royce Da 59,And the language I speak is my mind
104930,Royce Da 59,Kingpin and Penguin combined
104931,Royce Da 59,Spit like its King of the Dot
104932,Royce Da 59,A singular thought I think of will help you distinguish apart
104933,Royce Da 59,The frauds from the cream of the crop
104934,Royce Da 59, Wait a minute Hold up like a flashcard
104935,Royce Da 59,Damn dawg is that copyin or payin homage 
104936,Royce Da 59,Its sad because dad taught you to rap as a damn toddler
104937,Royce Da 59,My dad is your grandfather Ill have to re hatch on you
104938,Royce Da 59,Come back as a black wasp half yellow jacket you cant swat a
104939,Royce Da 59,Sasquatch dancing on top of an ant trample it and stomp it
104940,Royce Da 59,Smash it and stand on it dammit I cant stop it
104941,Royce Da 59,The rap is a vag and Im goin in like a tampon in this bitch
104942,Royce Da 59,Stampin out grasshoppers you cant be no Rap Gods
104943,Royce Da 59,In fact youre exact opposites you make a wack song
104944,Royce Da 59,And cant hold a candle but even Daniel san whacks off
104945,Royce Da 59,You jack offs need to come to grips like a hand job
104946,Royce Da 59,The boom bap is coming back with an axe to mumble rap
104947,Royce Da 59,Number one but my pencils are number twos
104948,Royce Da 59,Cause thats all I dos with em poop is my pseudonym
104949,Royce Da 59,On the john like a prostitute when Im droppin a deuce
104950,Royce Da 59,And when Im producing them lyrical bowel movements
104951,Royce Da 59,These beats are like my saloons
104952,Royce Da 59,Cause these bars always got my stools in em
104953,Royce Da 59,And I dont need Metamucil to loosen em
104954,Royce Da 59,Bitch shit is real like I pooped Jerusalem
104955,Royce Da 59,Im bout to go spin another cocoon
104956,Royce Da 59,Then Im cuttin you from your mothers womb
104957,Royce Da 59, Cruising down the river dancing till your feet got numb cool summer breezes blowing through your hair as you stood gazing down the river in anticipation of the thrill of the dizzying rides at the amusement park ah memories of Bob Lo Island  
104958,Royce Da 59,All is your world ain t nothing but a squirrel tryna get a nut Just jealous of everybody that s headed out on that Bob Lo boat It is the perfect weather and the perfect time to enjoy a few snacks Aw man I wish I was joining you a little cheese and crackers a little Cana wine a little Riunite on ice some Harvey s Bristol Cream but let s do this only on Smooth FM 
104959,Royce Da 59,Nothing compared to our family trips
104960,Royce Da 59,My uncle shook hands with a manly grip
104961,Royce Da 59,All this hand me down shit I had had an uncanny fit
104962,Royce Da 59,All the gangstas I had in my family had me anti bitch
104963,Royce Da 59,My granddaddy mistress caught the business from my granny fist
104964,Royce Da 59,That was back  fore I was born
104965,Royce Da 59,Pop told stories  bout it that would last for hours long
104966,Royce Da 59,And as a family we was just so happy
104967,Royce Da 59,When him and mama got along on the Bob Lo boat
104968,Royce Da 59,Uh on our way to that black amusement park
104969,Royce Da 59,Wood rollercoasters crack sold on plastic scooter cars
104970,Royce Da 59,Uh smoking grass at the vintage food court
104971,Royce Da 59,Broken glass waiting on you on the swimming pool floor
104972,Royce Da 59,I came across my identity on the Bob Lo boat
104973,Royce Da 59,That s where I lost my virginity no condom though
104974,Royce Da 59,That s when paranoia hit me like when superstition does
104975,Royce Da 59,Left my inhibitions I guess where my supervision was
104976,Royce Da 59,Parties on the way to the island would be the livest though
104977,Royce Da 59,First time big bro hit the bottle was on the Bob Lo boat
104978,Royce Da 59,But neither one of us knew that we would both
104979,Royce Da 59,Grow up and turn to alcoholics though the Bob Lo boat
104980,Royce Da 59,Hey hey hey lil Craig come here Aye hit this nigga Nigga don t worry  bout what the fuck it is just drink 
104981,Royce Da 59,Some of my better times I shared with you
104982,Royce Da 59,Shit all of my better days I shared with you
104983,Royce Da 59,And now I gotta wake up wake up wake up wake up wake up
104984,Royce Da 59,Shit stuck inside a rat race  fuck 
104985,Royce Da 59,Wake up wake up wake up wake up again
104986,Royce Da 59,Stuck inside this rat race  fuck 
104987,Royce Da 59,Twist the cap lift the bottle back swig it
104988,Royce Da 59,Dig it ten inch rims on my mama s Civic
104989,Royce Da 59,Ten inch woofers in the trunk to be specific
104990,Royce Da 59,They bump rattle the license plate plus the windows tinted
104991,Royce Da 59,Don t even give a fuck that it s dented bitch I m the man now
104992,Royce Da 59,I m rolling driving it slow as if it s stolen
104993,Royce Da 59,Piling up bros like we was clothing on a dresser
104994,Royce Da 59,Calling up hoes like we was Jodeci let s check her
104995,Royce Da 59,Double D s like double deckers I wanna sex her
104996,Royce Da 59,But these keys don t come with game on how to finesse her
104997,Royce Da 59,Five semesters left until college I m under pressure
104998,Royce Da 59,I m not a real nigga  til I undress her I gotta  press her
104999,Royce Da 59,This was my main concern back when concerns were lesser
105000,Royce Da 59,Nowadays I often yearn to press the
105001,Royce Da 59,Backspace button or hit return but life is not no word processor
105002,Royce Da 59,Most folks would burn the sess to burn the stress of
105003,Royce Da 59,My real life trauma plus fickle niggas thinking they done heard the best of
105004,Royce Da 59,Jermaine Lamarr but that s insane it couldn t be further left of
105005,Royce Da 59,The truth is that my new shit slap you never heard it better
105006,Royce Da 59,Give me a sec I murder sectors prefer to let ya
105007,Royce Da 59,See it rather than say it but it spill out I gotta chill out
105008,Royce Da 59,Say  Fuck the world and never pull out
105009,Royce Da 59,We had no Bob Lo boat but I could note
105010,Royce Da 59,Those times is like a Bible quote
105011,Royce Da 59,BC before cell phones the first time I would smoke
105012,Royce Da 59,I was six years old but that s for another chapter
105013,Royce Da 59,That s for another story to God be the glory
105014,Royce Da 59,I made it out unscathed and now I sunbathe
105015,Royce Da 59,With my son in Tanzanian sunrays thinking  bout them days
105016,Royce Da 59,Nigga dont worry about what the fuck it is just drink
105017,Royce Da 59,Yeah I don t know what else to say
105018,Royce Da 59,I can t I can t think of nothin
105019,Royce Da 59,On your feet Stand up Everybody hands up 
105020,Royce Da 59,Every time I go to think of something played out to say
105021,Royce Da 59,I aint callin names cause all of yall the same
105022,Royce Da 59,Plus Im the king all my past pain all done changed up
105023,Royce Da 59,All these plains all these lames since the Slaughters came up
105024,Royce Da 59,Cause they know their hands tied feet ball and chained up
105025,Royce Da 59,Niggas be quick to call me the new   Cent
105026,Royce Da 59,Because of my relationship with Marshall
105027,Royce Da 59,Used to make me a little partial but heres the brain fuck
105028,Royce Da 59,Im probably bout to fall out with a young buck
105029,Royce Da 59,While I attempt to fuck the fuckin game up
105030,Royce Da 59,Bitch splat Only thing I fear in here is chit chat
105031,Royce Da 59,You are hearin bars like your ear against a Kit Kat
105032,Royce Da 59,Shady guys like the Navy try us wavey bye bye
105033,Royce Da 59,Maybe my Glock can turn your top to Babys Maybach
105034,Royce Da 59,My shit is parvo literally sick
105035,Royce Da 59,Trust me nigga its ugly to kill the thing is the bigger I get
105036,Royce Da 59,The more disgustin and fuckin disfigured it gets
105037,Royce Da 59,Niggas expect me to go pop oh stop
105038,Royce Da 59,Yall about the Champagne Im about the toast I
105039,Royce Da 59,Only fuck with mailmen with heroin from Boca
105040,Royce Da 59,Niggas thatll smoke you while you starin in your postbox
105041,Royce Da 59,Only incense he enlightens when hes thinkin
105042,Royce Da 59,While that sinks in I got a Brinks ink pen
105043,Royce Da 59,Im back Motherfucker notice the flyness on the cover
105044,Royce Da 59,Of the XXL Im back from the dead
105045,Royce Da 59,Like Tobey Maguire from the Brothers
105046,Royce Da 59,How yall realer If I said it I did it
105047,Royce Da 59,If I didnt I seen it first hand like a card dealer
105048,Royce Da 59,Give up the throne your lease up I am the Mona Lisa
105049,Royce Da 59,That decoded Da Vinci Code you throwin your piece up
105050,Royce Da 59,Is a waste of fake like a phony B cup
105051,Royce Da 59,Makin the mistake was like my only teacher
105052,Royce Da 59,Wait til they get a load of me cause 
105053,Royce Da 59,Ive got Guccis on my feet diamonds on my neck
105054,Royce Da 59,Diamonds on my wrist bitches on my dick
105055,Royce Da 59,But yall already said that
105056,Royce Da 59,Choppers in the trunk models in the front
105057,Royce Da 59,Bottles in the club but I dont give a fuck
105058,Royce Da 59,But yall already said that
105059,Royce Da 59,Cause sometimes I feel like its so hard for me
105060,Royce Da 59,To come up with shit to say ayy
105061,Royce Da 59,Im at a loss for words cause yall already said it all
105062,Royce Da 59,I think Im runnin outta clich s
105063,Royce Da 59,Im gettin writers block psyche 
105064,Royce Da 59,When I stand up in this booth niggas notice it
105065,Royce Da 59,Sittin on the same boat that Noah built
105066,Royce Da 59,Floatin on the same water Moses split
105067,Royce Da 59,Poetry in motion but we sittin on your grave site overkill
105068,Royce Da 59,Arent you tired Why are you so loud Quiet
105069,Royce Da 59,Real dudes move in silence like a mute drivin a new hybrid
105070,Royce Da 59,You a dude thatd try to sue a dude thats suicidal
105071,Royce Da 59,You will just be another victim
105072,Royce Da 59,Im like a nickel of weed rolled in a doobie Im a little twisted
105073,Royce Da 59,I roll like the end credits in movies yall just got scripted
105074,Royce Da 59,Got yall niggas bitches bobbin to this one when she wit ya
105075,Royce Da 59,When she with me she bobbin not vibin
105076,Royce Da 59,Tryna put her mind into the inside of my zipper
105077,Royce Da 59,Im a serpent with a purpose
105078,Royce Da 59,Havin problems Not a problem
105079,Royce Da 59,Ive encountered I have found elephants lions clowns
105080,Royce Da 59,Will jump through hoops like they workin for the circus
105081,Royce Da 59,If the fire round the circles right in front of them fire rounds
105082,Royce Da 59,Pun intended gun extended what are you marks askin 
105083,Royce Da 59,Cars Aston started as a hard top and I saw past it
105084,Royce Da 59,Since I decided to start class this all black all glass
105085,Royce Da 59,Panoramic roof been gettin marked absent
105086,Royce Da 59,I authorize my own all access
105087,Royce Da 59,Your bitch a whore Im a catch she ball catchin
105088,Royce Da 59,All across the globe from the store to Japan
105089,Royce Da 59,Her pussy need to be blocked and reported as spam
105090,Royce Da 59,Interscope I been this dope
105091,Royce Da 59,Now sell it my voicemail is full
105092,Royce Da 59,Got bitches screamin inside of envelopes
105093,Royce Da 59,And they tryna mail  em to me
105094,Royce Da 59,Tryna reach my phone I dont know which one is harder 
105095,Royce Da 59,Tryin not to take your bitch or tryna get rid of my own
105096,Royce Da 59,Ive got Guccis on my feet diamonds on my neck
105097,Royce Da 59,Diamonds on my wrist bitches on my dick
105098,Royce Da 59,But yall already said that
105099,Royce Da 59,Choppers in the trunk models in the front
105100,Royce Da 59,Bottles in the club but I dont give a fuck
105101,Royce Da 59,But yall already said that
105102,Royce Da 59,Cause sometimes I feel like its so hard for me
105103,Royce Da 59,To come up with shit to say ayy
105104,Royce Da 59,Im at a loss for words cause yall already said it all
105105,Royce Da 59,I think Im runnin outta clich s
105106,Royce Da 59,Im gettin writers block psyche 
105107,Royce Da 59,We need to start bringin that shit back  Mad flava  
105108,Royce Da 59,Man fuck it Im bout to catch some wreck
105109,Royce Da 59,Mad props to Royce for keepin it real
105110,Royce Da 59,On the strength no diggity
105111,Royce Da 59,Im bout to go pull some hoes get my mack on
105112,Royce Da 59,Im the verbal spit Smith Wesson
105113,Royce Da 59,The quick wit could split a split second
105114,Royce Da 59,Bomb with a lit wick expression
105115,Royce Da 59,You hear a tick tick then you testin
105116,Royce Da 59,My saliva and spit could split thread into fiber and bits
105117,Royce Da 59,So trust me Im as live as it gets
105118,Royce Da 59,Everybody claim they the best and they head the throne
105119,Royce Da 59,Since B I G is gone if you ask me they  Dead Wrong 
105120,Royce Da 59,My flow is hotter than the flash from the click
105121,Royce Da 59,When the hammer slaps the bullet on the ass from the clip
105122,Royce Da 59,You wind up in a room full of my dogs
105123,Royce Da 59,Ill have you feeling like a fire hydrant in a room full of dogs
105124,Royce Da 59,So come come now get pissed on shitted on
105125,Royce Da 59,Tough talk turns to  Cant we all just get along 
105126,Royce Da 59,You get blazed when the mics off shot when its on
