,artist,text
97545,Nas,Let go of the illusion start some restraining
97546,Nas,Oooooooooooh ahhhhhhhhh    
97547,Nas,Ahhhhhhhh ahhhhhh ahhhhhh   ahhh  
97548,Nas,Just hold on  just hold on 
97549,Nas,Just hold on  just hold on 
97550,Nas,Just hold on  just hold on 
97551,Nas,Just hold on  just hold on 
97552,Nas,Just hold on  just hold on 
97553,Nas,Just hold on  just hold on 
97554,Nas,Just hold on  just hold on 
97555,Nas,They plan was to knock me out the top of the game
97556,Nas,But I overstand they truth is all lame
97557,Nas,I hold cannons that shoot balls of flame
97558,Nas,Right in they fat mouth then I carve my name
97559,Nas,Nas  too real Nas  true king
97560,Nas,Its however you feel go head you swing
97561,Nas,Your arms too short to box with God
97562,Nas,I dont kill soloists only kill squads
97563,Nas,Fame went to they head so now its  Fuck Nas 
97564,Nas,Yesterday you begged for a deal today you tough guys
97565,Nas,Soon as I popped my first bottle
97566,Nas,I spotted my enemies tryna do what I do
97567,Nas,Came in with my style so I fathered you
97568,Nas,I kept changing on the world since     Barbeque 
97569,Nas,Now you wanna hang with niggas I hung with
97570,Nas,Fuck bitches I hit its funny I once said
97571,Nas,If I ever make a record I take a cheque
97572,Nas,And put something away for a rainy day to make my exit
97573,Nas,But look at me now ten years deep
97574,Nas,Since the project bench with crack in my sock asleep
97575,Nas,I never asked to be top of raps elite
97576,Nas,Just a ghetto child tryna learn the traps of the streets
97577,Nas,Youre the man youre the man
97578,Nas,Youre the man youre the man
97579,Nas,Youre the man youre the man
97580,Nas,Youre the man youre the man
97581,Nas,Youre the man youre the man
97582,Nas,Now wait a sec give me time to explain women and fast cars
97583,Nas,And diamond rings can poison a rap star
97584,Nas,Was suicidal high smoking so much lye
97585,Nas,I saw a dead bird flying through a broken sky
97586,Nas,Wish I could flap wings and fly away
97587,Nas,To where black kings in Ghana stay
97588,Nas,So I could get old my flesh rot away
97589,Nas,But thatll be the day when its peace
97590,Nas,When my gat dont need to spray
97591,Nas,When these streets are safe to play
97592,Nas,Sex with death indulge in these women
97593,Nas,Vision my own skeleton swimming in eternal fire
97594,Nas,Broads play with pentagrams in they vagina
97595,Nas,Like the Exorcist then they gave birth to my seeds
97596,Nas,I beg for Gods help why they love hurting me 
97597,Nas,Im your disciple a thug certainly
97598,Nas,Im the N the A to the S I R
97599,Nas,If I wasnt I mustve been Escobar
97600,Nas,   in my waist staring at my reflection
97601,Nas,In the mirror sitting still in the chair like Mike Concepcion
97602,Nas,When everything around me got cloudy
97603,Nas,The chair became a kings throne my destiny found me
97604,Nas,It was clear why the struggle was so painful
97605,Nas,Metamorphosis this is what I changed to
97606,Nas,Youre the man youre the man
97607,Nas,Youre the man youre the man
97608,Nas,Youre the man youre the man
97609,Nas,Youre the man youre the man
97610,Nas,Youre the man youre the man
97611,Nas,Youre the man youre the man
97612,Nas,Ayo its poison ecstasy coke you say its love it is poison
97613,Nas,Schools where I learned they should be burned it is poison
97614,Nas,Physicians prescriptin us medicine which is poison
97615,Nas,Doctors injectin our infants with the poison
97616,Nas,Religion misoverstood is poison
97617,Nas,Niggas up in my hood be gettin shot given poison
97618,Nas,In hospitals shots riddle the block little
97619,Nas,Children and elderly women run for they lives
97620,Nas,Drizzlin rain come out the sky every time somebody dies
97621,Nas,Must be out my fuckin mind what is this the hundredth time 
97622,Nas,Sendin flowers to funerals readin Rest In Peace
97623,Nas,You know the usual death comes in threes
97624,Nas, Life is short is what some nigga said
97625,Nas,Not if you measure life by how one lives and what he did
97626,Nas,And funny how these black killer companies is makin money off us
97627,Nas,Fast food Cola soda Skull and Bone crosses  its all poison
97628,Nas,Ecstasy coke you say its love it is poison
97629,Nas,Schools where I learned they should be burned it is poison
97630,Nas,Physicians prescriptin us medicine which is poison
97631,Nas,Doctors injectin our infants with the poison
97632,Nas,Religion misoverstood is poison
97633,Nas,Sisters up in my hood try to do good given choices
97634,Nas,When pregnant drop out of school or have abortions
97635,Nas,Stop workin hopin that they find a man that will support them
97636,Nas,Up late night on they mothers cordless
97637,Nas,Thinkin a perm or bleachin cream will make them better when theyre gorgeous
97638,Nas,White girls tannin liposuction
97639,Nas,Fake titties are implanted fake lips thats life destruction
97640,Nas,Light skinned women bi racial
97641,Nas,Hateful toward themselves denyin even their blood
97642,Nas,But I overstand the mental poison thats even worser than drugs
97643,Nas,Yo its poison ecstasy coke you say its love it is poison
97644,Nas,Schools where I learned they should be burned it is poison
97645,Nas,Physicians prescriptin us medicine which is poison
97646,Nas,Doctors injectin our infants with the poison
97647,Nas,Religion misoverstood is poison
97648,Nas,Radio and TV poison white Jesus poison
97649,Nas,And any thoughts of takin me down is poison
97650,Nas,Who want beef now My heat shall anoint em PLAOW 
97651,Nas,Never to worry all the wrong doers got it coming back to em a thousand times over
97652,Nas,Every dog has its day and everything flips around
97653,Nas,Even the most greatest nation in the world has it coming back to em
97654,Nas,Everybody reaps what they sews thats how it goes
97655,Nas,Innocent lives will be taken
97656,Nas,It may get worse but well get through it yall be strong 
97657,Nas,The China men built the railroad the Indians saved the Pilgrim
97658,Nas,And in return the Pilgrim killed em
97659,Nas,They call it Thanksgiving I call your holiday  hell day 
97660,Nas, Cause Im from poverty neglected by the wealthy
97661,Nas,Me and my niggas share gifts every day like Christmas
97662,Nas,Slay bitches and party everyday like this is the last
97663,Nas,Im with my heckles connectin and we hittin the lab
97664,Nas,This is my level fuck if it get you mad
97665,Nas,Its all poison all of my words to enemies it is poison
97666,Nas,Rappers only talk about kis its all poison
97667,Nas,How could you call yourself MCs You aint poison
97668,Nas,Think about the kids you mislead with the poison
97669,Nas,And any thoughts of takin me down is all poison
97670,Nas,Who want beef now My heat shall anoint em plaow 
97671,Nas,What goes around comes around my nigga
97672,Nas,And what goes up it must come down my nigga
97673,Nas,The soldiers found below the ground my nigga
97674,Nas,Just hold it down we older now my nigga
97675,Nas,This nigga Ike with the Iverson jersey light skinned with herpes
97676,Nas,Fuckin sisters in Harlem Brooklyn and D C 
97677,Nas,This is the problem  cause he never tell em he got it
97678,Nas,From lettin fags suck him off Rikers Island in   
97679,Nas,Drives a Benz hangs at all the parties
97680,Nas,All the concerts backstage where the stars be
97681,Nas,Rockin they shirts in bitches faces like clockwork
97682,Nas,Whats your name Where you from 
97683,Nas,Chain blingin thinkin girls everywhere is dumb
97684,Nas,Takin pride in ruinin their lives
97685,Nas,So they could never have babies and they could never be wives
97686,Nas,He never used a condom give him head He got ya
97687,Nas,Met the wrong bitch and now he dead from the monster AIDS
97688,Nas,I contemplate believin in karma
97689,Nas,Those on top could just break and wont be eatin tomorrow
97690,Nas,I know some bitches who be sleepin on a niggas dreams
97691,Nas,They leave when that nigga blow she the first bitch on her knees
97692,Nas,Knowin dudes thats neglectin their seeds
97693,Nas,Instead of takin care of em theyre spendin money on trees
97694,Nas,I pray for you deadbeat daddies
97695,Nas,Cause when them kids get grown
97696,Nas,Its too late for you now you old and you gettin shitted on
97697,Nas,Its all scientific mystic you know the Earth and the stars
97698,Nas,Dont hesitate to say you heard it from Nas
97699,Nas,George Bush killer til George Bush kills me
97700,Nas,Much blessings be healthy remember 
97701,Nas,What goes around comes around my nigga
97702,Nas,And what goes up it must come down my nigga
97703,Nas,The soldiers found below the ground my nigga
97704,Nas,Just hold it down we older now my nigga
97705,Nas,Everybody knows that you are so beautiful
97706,Nas,But I feel a thorn on my hide
97707,Nas,We cant repair what we broke
97708,Nas,But I held you close too close
97709,Nas,I shouldve left your roses at the door
97710,Nas,Theyre sharper than before
97711,Nas,And I dont want them no more
97712,Nas,I shouldve left your roses at the door
97713,Nas,Theyre sharper than before
97714,Nas,And I dont need them no more
97715,Nas,I have no time to give you guidance
97716,Nas,Barely have any fuck time either
97717,Nas,Hefner minded like I think youre fine but
97718,Nas,I seen the finest women that ever came out a beaver
97719,Nas,Mind reader can tell she vegan or not when I meet her
97720,Nas,Or if she insecure most are
97721,Nas,If shes mixed a possible psycho alert goes off
97722,Nas,Not a judge cause a judge dont wear no draws yet he allows
97723,Nas,Everything to go to your spouse when you end your vows
97724,Nas,My tax bracket not enough blacks have it
97725,Nas,Who should I date   Project chick or Cuban actress 
97726,Nas,A White chick they might flip talking that Blackness
97727,Nas,Should only attract Black shit Im an ass magnet
97728,Nas,If you mad at that youll be mad forever
97729,Nas,Never played you I prayed we would stay together
97730,Nas,Wished itd last forever know what I mean
97731,Nas,Heard you tear a rose from the roots the rose screams
97732,Nas,Everybody knows that you are so beautiful
97733,Nas,But I feel a thorn on my hide
97734,Nas,We cant repair what we broke
97735,Nas,But I held you close too close
97736,Nas,Them Xanax cant manage your maniac manic depressive expressions
97737,Nas,They some silent killers that stress shit
97738,Nas,That put ulcers in a lot of niggas
97739,Nas,Im blowing medical it helps chill a violent temper
97740,Nas,I done went to hell and back you always think you right
97741,Nas,You know when you wrong and still you want to fight
97742,Nas,When people like my song you want to kill em right 
97743,Nas,You resent me every time I make a million right 
97744,Nas,You want to experience life when you calling all the shots
97745,Nas,Ordering bottles for all your girls up in the spot
97746,Nas,Have your own cash own your own Benz
97747,Nas,Your own house everything me I understand
97748,Nas,Thought you would bask in the glory as Queen Bee
97749,Nas,Put you on under Martin Scorsese Mean Street
97750,Nas,The first movie he made thought that was fly
97751,Nas,I thought you was flyer you a fucking liar
97752,Nas,Everybody knows that you are so beautiful
97753,Nas,But I feel a thorn on my hide
97754,Nas,We cant repair what we broke
97755,Nas,But I held you close too close
97756,Nas,I shouldve left your roses at the door
97757,Nas,Theyre sharper than before
97758,Nas,And I dont want them no more
97759,Nas,I shouldve left your roses at the door
97760,Nas,Theyre sharper than before
97761,Nas,And I dont need them no more
97762,Nas,The whole city is mine prettiest Don
97763,Nas,I dont like the way P Diddy did Shyne with different lawyers
97764,Nas,Why its mentioned in my rhymes Fuck it
97765,Nas,Its just an intro hate it or love it like it bump it or dump it
97766,Nas,Write it across the stomach spell  God son 
97767,Nas,Life is like a jungle black its like the habitat of Tarzan
97768,Nas,Matter of fact its harder than most can imagine
97769,Nas,Most of my niggas packed in correctional facilities
97770,Nas,Half of them passed on Mack strong couple of shots
97771,Nas,Made the ghost leave a body now they hauntin the block
97772,Nas,Where they used to stand at somebodys takin they place
97773,Nas,A younger man perhaps hand slaps cant understand that
97774,Nas,Same walk same talk I wonder can that be possible 
97775,Nas,A thug dies another step inside his shoes
97776,Nas,And they will hurt you layin low with a bottle
97777,Nas,Im blowin circles my state of mind purple
97778,Nas,Yall just wanna deal with drama
97779,Nas,Talk about niggas who got things yall ready to kill his mama
97780,Nas,Everything you into is underworld related
97781,Nas,You sell your man out not even your girl is sacred
97782,Nas,You dont trust a soul hold up you moldin soldiers
97783,Nas,To pull guns quick and always look behind the shoulder
97784,Nas,Think of how many dudes died tryna be down with you
97785,Nas,Everybodys under six feet of ground but you
97786,Nas,Still standin still roamin through the streets thats real
97787,Nas,You a survivor knowin all the beef is ill
97788,Nas,You got a bunch of thugs with you even now thats ready
97789,Nas,Trustin your judgment quick to put it down they deadly
97790,Nas,The hood love you but behind your back they pray for the day
97791,Nas,A bullet hit your heart and ambulances take you away
97792,Nas,That aint love its hate think of all the mothers at wakes
97793,Nas,Whose sons you killed and you aint got a cut on your face 
97794,Nas,Unmarked police cars roam the streets hard the heat is God
97795,Nas,Somebody tell these shorties reach for the stars
97796,Nas,Instead they tell em how to reach through the bars holdin a mirror
97797,Nas,Lookin down a tear in jail makin weapons to kill ya
97798,Nas,Weed smoke three tokes nigga pour more Henny
97799,Nas,He sighs with eyes that seen a war too many
97800,Nas,Cold blooded murderers universal
97801,Nas,Hood to hood blowin smoke state of mind is purple
97802,Nas,Light it up light it up light it up uhh
97803,Nas,Light it up light it up light it up uhh
97804,Nas,Uhh uhh uhh light it light it uhh
97805,Nas,These hot headed youngsters always get into trouble
97806,Nas,Reactin before thinkin they easily irritated
97807,Nas,And murders premeditated its a fact that we sinkin
97808,Nas,When we should be climbin in a nutshell its just jail drug sales liquor and diamonds niggas rewindin
97809,Nas,Instead of movin forward to blow up so whats the science 
97810,Nas,People shoutin police pushin the crowd
97811,Nas,And on the grounds a young soldier with meat hangin out him
97812,Nas,Am I hallucinatin off the hazin 
97813,Nas,Or did I just see a nigga shoot another niggas face in 
97814,Nas,Its a ugly nation cops circle the block with mug shots
97815,Nas,Photograph pictures of suspect faces
97816,Nas,Its usually two or three niggas who innocent
97817,Nas,But if they lock the wrong ones up then someonell snitch
97818,Nas,A divide and fall strategy they arent fair
97819,Nas,I dig in my bag of weed thats covered with orange hair
97820,Nas,This Color Purple will make Whoopi give me the pussy
97821,Nas,And Celie Oprah and Danny Glover gots to feel me
97822,Nas,This is how I escape the madness
97823,Nas,Too much of anythingll hurt you so my state of minds all purple
97824,Nas,QB where the fuck yall at 
97825,Nas,Chain gleamin switchin lanes two seater
97826,Nas,Hate him or love him for the same reason  fresh 
97827,Nas,Cant leave it the game needs him
97828,Nas,Plus the people need someone to believe in  yes 
97829,Nas,Cause they know Ima give em what they want
97830,Nas,I guess that makes me a  hero 
97831,Nas,Another chapter of the cleanest rapper distinguished gentlemen
97832,Nas,Crooks  Castle on his back Maybacher
97833,Nas,Exotic lady eye catcher holla at ya call me the chiropractor
97834,Nas,Workin like Muay Thai class get perspire out ya
97835,Nas,And of course Ive been the boss since back when
97836,Nas,Rockin D Boy Fila velour in one ninety black Benz
97837,Nas,Now they shut down the stores when Im shoppin
97838,Nas,Used to be train robbin face covered in stockin Im him
97839,Nas,Chain gleamin switchin lanes two seater
97840,Nas,Hate him or love him for the same reason  fresh 
97841,Nas,Cant leave it the game needs him
97842,Nas,Plus the people need someone to believe in  yes 
97843,Nas,Cause they know Ima give em what they want
97844,Nas,I guess that makes me a  hero 
97845,Nas,Rubber grip holder reloader
97846,Nas,Come at me Ima rip your soliders in half
97847,Nas,Silverback ape nickel plated mag
97848,Nas,Young rich and flashy young bitch Im nasty
97849,Nas,All black clothes til ice lay on me so classy
97850,Nas,And every time I close my lids
97851,Nas,I can still see the borough I can still see the Bridge
97852,Nas,I can still see the dreams that my niggas aint never lived to see
97853,Nas,Tell them angels open the door for me
97854,Nas,From nine Berettas and movin raw
97855,Nas,To chillin in wine cellars sticks and humidors
97856,Nas,Thats what I call a G thats what I call a pimp
97857,Nas,Thats what I call a gangsta to the fullest shit
97858,Nas,By every September   th thats my dream
97859,Nas,So I can be more clean as I grow yearly
97860,Nas,I can see things more clearly thats why they fear me  lets go  
97861,Nas,Chain gleamin switchin lanes two seater
97862,Nas,Hate him or love him for the same reason  fresh 
97863,Nas,Cant leave it the game needs him
97864,Nas,Plus the people need someone to believe in  yes 
97865,Nas,Cause they know Ima give em what they want
97866,Nas,I guess that makes me a  hero 
97867,Nas,This universal apartheid Im hog tied the corporate side
97868,Nas,Blockin yall from goin to stores and buyin it
97869,Nas,First L A and Doug Morris was ridin with it
97870,Nas,But Newsweek article startled big wigs
97871,Nas,They said  Nas why is he tryin it  
97872,Nas,My lawyers only see the Billboard charts as winnin
97873,Nas,Forgettin Nas the only true rebel since the beginnin
97874,Nas,Still in musical prison in jail for the flow
97875,Nas,Try tellin Bob Dylan Bruce or Billy Joel
97876,Nas,They cant sing whats in their soul
97877,Nas,I never change nothin but people remember this
97878,Nas,If Nas cant say it think about these talented kids
97879,Nas,With new ideas bein told what they can and cant spit
97880,Nas,I cant sit and watch it so shit Ima drop it
97881,Nas,Like it or not you aint gotta cop it
97882,Nas,Im a hustler in the studio cups of Don Julio
97883,Nas,No matter what the CD called Im unbeatable yall lets go 
97884,Nas,I know you can feel the magic baby
97885,Nas,Turn the motherfuckin lights down
97886,Nas,Esco whattup  Whattup homie  
97887,Nas,I mean its what you expected aint it  Hahaha 
97888,Nas,Lets go   uhh uh uhh uh uhh uh
97889,Nas,Turn the music up in the headphones
97890,Nas,Uh yeah thats perfect  yeah right right 
97891,Nas,Uhh uh you gotta take ya time make a nigga wait on this muhfucka  hahaha  
97892,Nas,Make niggas mad and shit like
97893,Nas,Niggas usually just start rappin after four bars nigga go in 
97894,Nas,Just start dancin in this muhfucka
97895,Nas,Yeah  yeah we just come outta nowhere
97896,Nas,I feel like a black republican money I got comin in
97897,Nas,Cant turn my back on the hood I got love for them
97898,Nas,Cant clean my act up for good too much thug in him  nah 
97899,Nas,Probably end up back in the hood like  Fuck it then 
97900,Nas,Huddlin over the oven we was like brothers then  what  
97901,Nas,Though you was nothin other than a son of my mothers friend
97902,Nas,We had covenant who wouldve thought the love would end 
97903,Nas,Like Ice Colds album  uhh  all good things
97904,Nas,Never thought we sing the same song that all hoods sang
97905,Nas,Thought it was all wood grain all good brain
97906,Nas,We wouldnt bicker like the other fools talk good game
97907,Nas,Never imagine all the disaster that one good reign could bring
97908,Nas,Should blame the game and I could
97909,Nas,Its kill or be killed how could I refrain 
97910,Nas,And forever be in debt and thats never a good thing
97911,Nas,So the pressure for success can put a good strain
97912,Nas,On a friend you call best and yes it could bring
97913,Nas,Out the worst in every person even the good and sane
97914,Nas,Although we rehearsed it it just aint the same
97915,Nas,When you put in the game at age sixteen
97916,Nas,Then you mix things like cars jewelry and miss thing
97917,Nas,Jealousy ego and pride and this brings
97918,Nas,It all to a head like a coin cha ching
97919,Nas,The root of evil strikes again this could sting
97920,Nas,Now the team got beef between the Post and the Point
97921,Nas,This puts the ring in jeopardy  indefinitely
97922,Nas,I feel like a black republican money I got comin in
97923,Nas,Cant turn my back on the hood I got love for them  uhh uhh 
97924,Nas,Cant clean my act up for good too much thug in him  nah 
97925,Nas,Probably end up back in the hood Im like  Fuck it then 
97926,Nas,I feel like a black militant takin over the government
97927,Nas,Cant turn my back on the hood too much love for them  nah 
97928,Nas,Cant clean my act up for good too much thug in him
97929,Nas,Probably end up back in the hood Im like  Fuck it then 
97930,Nas,Im back in the hood they like  Hey Nas  uh 
97931,Nas,Blowin on purp reflectin on they lives  uh 
97932,Nas,Couple of fat cats couple of A I s
97933,Nas,Dreamin of fly shit instead of them gray skies
97934,Nas,Gray  s hatahs wishin our reign dies
97935,Nas,Pitch sling pies and niggas they sing  Why   uhh 
97936,Nas,Guess they aint strong enough to handle their jail time
97937,Nas,Weak minds keep tryin follow the street signs
97938,Nas,Im standing on the roof of my building
97939,Nas,Im feelin the whirlwind of beef I inhale it
97940,Nas,Just like an acrobat ready to hurl myself through the hoops of fire
97941,Nas,Sippin   proof bulletproof under my attire
97942,Nas,Could it be the forces of darkness
97943,Nas,Against hood angels of good that form street politics 
97944,Nas,Makes a sweet honest kid turn illegal for commerce  uhh 
97945,Nas,To get his feet out of them Converse  thats my word
97946,Nas,I feel like a black republican money keep comin in
97947,Nas,Cant turn my back on the hood I got love for them  uhh uhh 
97948,Nas,Cant clean my act up for good too much thug in him  nah 
97949,Nas,Probably end up back in the hood ah  Fuck it then 
97950,Nas,I feel like a black militant takin over the government
97951,Nas,Cant turn my back on the hood too much love for them
97952,Nas,Cant clean my act up for good too much thug in him
97953,Nas,Probably end up back in the hood Im like  Fuck it then 
97954,Nas,Im the type of nigga that write rhymes
97955,Nas,Right on the spot in the studio soon as I hear the track
97956,Nas,Word but I wanted to bring
97957,Nas,A couple of books to the studio today man
97958,Nas,I found these shits up in the crib man in boxes man
97959,Nas,I dont even remember when I was writin these shits
97960,Nas,Or whats in these shits man
97961,Nas,Probably a bunch of bullshit man fuck it check it
97962,Nas,How can I trust you when I cant trust me 
97963,Nas,Picture myself a old man a O G 
97964,Nas,Some niggas will conversate with liars all day
97965,Nas,Time pass  Nah let me start somethin else 
97966,Nas,Soul on ice death threats given by clowns
97967,Nas,I guess livin is prison when you live around clowns
97968,Nas,Im hexed cursed worse I been blessed first
97969,Nas, Cause I would overcome any tasked called to
97970,Nas,So there it is Im a prince Im against lames
97971,Nas,Who do minor shit swear they on the top of they game
97972,Nas,Your rhymin is called  Vagina Monologue  it kinda supports
97973,Nas,Theories of scary niggas who should lie in the morgue
97974,Nas,Rarely yall come in contact with the real
97975,Nas,Since Pun passed he was the last shine of sun I could feel
97976,Nas,Yo said theres a few left since musics expressions of life
97977,Nas,Damn I wish I took more time to write in my book of rhymes
97978,Nas,I been lookin for this bitch number damn
97979,Nas,This is weak I remember this bullshit right here
97980,Nas,Gandhi was a what the fuck 
97981,Nas,Gandhi was a fool nigga fight to the death
97982,Nas,The US Army is a school that teach you plights of conquest
97983,Nas, I wonder when I wrote this nah its weak 
97984,Nas,The moneys your religion sky the limit live life
97985,Nas,Numbers is big business makes the poor live trife
97986,Nas,The glimmers of hope provoke those without dollars to dream
97987,Nas,Through your existence become wealthy knowledge is king
97988,Nas,Pimps and card sharks thiefs murderers with hard luck
97989,Nas,Addicts and fiends prostitutes passin for teens is my society
97990,Nas,Cops that shoot blacks is routine for notoriety
97991,Nas,Grow up watchin well dressed niggas with charms
97992,Nas,Beautiful ladies on their arms
97993,Nas,Dangerous new cars was my fantasy for Nas
97994,Nas,Rubbin my lips with Campophenique
97995,Nas,Still behind the ears wet turned out to be
97996,Nas,Pioneers vets amongst hustlers crack sellers and liars and squares
97997,Nas,My people be projects or jail never Harvard or Yale
97998,Nas,Pardon me type in my two way while Im chargin my cell
97999,Nas,Its hard to be iced up with Gucci God povertys real
98000,Nas,I cant fight you  cause you would sue me niggas be groupies
98001,Nas,I see imitators tryin to make albums spittin my style
98002,Nas,And they dont even realize that I notice they stealin Nas shit
98003,Nas,I pump some Rick James with that Teena Marie
98004,Nas,My nina lean on me like Scoob and Scrap
98005,Nas,This cant be my book of rhymes
98006,Nas,This cant be my book of rhymes writin this bullshit 
98007,Nas,Aw why you laughin Alchemist 
98008,Nas,Naw yeah  My book of rhymes 
98009,Nas,Im tellin you Ima come up with some new shit now
98010,Nas,Fuck that Ima write again now fuck that 
