,artist,text
109761,Scarface,She put it on so I paid for it and then I told her she could keep it
109762,Scarface,Then I walked out the store its our secret
109763,Scarface,But peep it made it down the hall she came running
109764,Scarface,Bags about to bust blouse wrinkled but still stunning
109765,Scarface,Ive done it made mack move with girl chasing me
109766,Scarface,And shortly thereafter exchanged our fuck faces
109767,Scarface,Its tasteless but honey mustve missed being treated
109768,Scarface,Like something more than niggas just humping and dudes beating
109769,Scarface,Her ass behind the silly shit
109770,Scarface,And I can see it in her eyes she was sick of this
109771,Scarface,Lets see the sights its me tonight
109772,Scarface,Lets leave him stuck home pacing
109773,Scarface,Blowing up your pager exchanging fuck faces
109774,Scarface,You must be used to all the finer things
109775,Scarface,Infatuated by what money brings
109776,Scarface,It seems to me you hoes will never change
109777,Scarface,So all thats left is for us to exchange
109778,Scarface,I called her up on the phone said  Ill be there in a minute 
109779,Scarface,Cause all them faces she be making when Im in it
109780,Scarface,They make a nigga feel like he doing something
109781,Scarface,The pussy so good have you through with money
109782,Scarface,But you aint knowing shes a tramp and a slut and all that shit
109783,Scarface,Every chance you get you trying to call that bitch
109784,Scarface,Quite a few niggas got the pussy
109785,Scarface,But everytime I see her got to stop and look
109786,Scarface,Cause she so damn fine bitch
109787,Scarface,I want to make you mine bitch
109788,Scarface,I want to fuck one time bitch
109789,Scarface,Short Doggs on your mind bitch
109790,Scarface,I give a fuck about any nigga you fuck with stuck with
109791,Scarface,I love the way she suck dick and make me bust this
109792,Scarface,Its hard to hold back when its this good
109793,Scarface,You said she wouldnt I knew the bitch would
109794,Scarface,Cause Im a veteran twist them in the game so fast
109795,Scarface,With this pimping bitch you know you aint gon last
109796,Scarface,I got to get em let em know Im pimping really
109797,Scarface,Unless Im getting paid the shit is temporary
109798,Scarface,Exchanging fuck faces making hella noise
109799,Scarface,Getting freaky as fuck and go and tell my boys
109800,Scarface,Thats how we do this shit bitch
109801,Scarface,You must be used to all the finer things
109802,Scarface,Infatuated by what money brings
109803,Scarface,It seems to me you hoes will never change
109804,Scarface,So all thats left is for us to exchange
109805,Scarface,Let me holla at cha B Short check this
109806,Scarface,Just got through fucking this bitch
109807,Scarface,Who swallowed my cum and drunk my piss
109808,Scarface,I stuck my fist up in her cock she didnt budge or move it
109809,Scarface,Sucking and fucking mayne she loved to do it
109810,Scarface,I bust       nuts in her mouth when she come to my house
109811,Scarface,I know thats my bitch and she dont tell nobody shit
109812,Scarface,She keeps it cool she said that pussys mine
109813,Scarface,And because the way I rhyme she let me fuck her all the time
109814,Scarface,Im thinking about keeping this bitch by my side
109815,Scarface,Girl so fine niggas dreamed they fucked her and lied
109816,Scarface,But Im numero uno the one and only
109817,Scarface,Bitch be all on me chewing my nuts like bologna
109818,Scarface,Then click she licked on my dick like plop
109819,Scarface,Then nut skeeted out like thick white snot
109820,Scarface,She saw it was still hard and said  Look what I got 
109821,Scarface,Then rubbed it hugged it and shoved it in her cock
109822,Scarface,Tried to tell her to stop but the bitch wouldnt listen
109823,Scarface,I guess a dick thats hard and rock is what these hoes be missing
109824,Scarface,And in return she used a stolen credit card to by me cases
109825,Scarface,And later on she get this bone and gives me fuck faces
109826,Scarface,You must be used to all the finer things
109827,Scarface,Infatuated by what money brings
109828,Scarface,It seems to me you hoes will never change
109829,Scarface,So all thats left is for us to exchange
109830,Scarface,I got a call from Laquesha and some of her nieces
109831,Scarface,Saying its about six or seven dime pieces
109832,Scarface,We can hook up with no chains and no leashes
109833,Scarface,Tied to this fucking affair and slow leases
109834,Scarface,See what we gon do is fall through with crushed ice
109835,Scarface,Man these hoes been talking bout fucking for three Nights
109836,Scarface,Whole damn grill so slick its kind of nice
109837,Scarface,Not too expensive but comfortable and its quiet
109838,Scarface,The Remy that she give me and feel me its tranquilized
109839,Scarface,Thinking to myself at this time and realized
109840,Scarface,She aint got on panties so damn me its in the signs
109841,Scarface,Somebodys getting fucked tonight to my surprise
109842,Scarface,Enter the room with the cat ass eyes
109843,Scarface,Rochelle who do nails with them thick ass thighs
109844,Scarface,See I love these kind cause they aint with that bullshit
109845,Scarface,Get a nigga off in the room and pull shit
109846,Scarface,Girl stop licking right there you killing me
109847,Scarface,Go ahead and touch it right there and feel the P
109848,Scarface,This some cold blooded shit with a bitch you let me sit through
109849,Scarface,Damn hoe I must admit thats why I dig you
109850,Scarface,So I put you to the world of forgotten fuck faces
109851,Scarface,You getting buck places drinking love and sex chases
109852,Scarface,You know what Im saying baby Its either now or never
109853,Scarface,Too  hort Tela Devin Scarface in style
109854,Scarface,You must be used to all the finer things
109855,Scarface,Infatuated by what money brings
109856,Scarface,It seems to me you hoes will never change
109857,Scarface,So all thats left is for us to exchange
109858,Scarface,You must be used to all the finer things   
109859,Scarface,Circumstances are like my first fight I lost
109860,Scarface,It was swinging my arms bugging adrenaline pumping
109861,Scarface,Oh shit this little niggas thugging
109862,Scarface,I mean I was thirteen I was nursing a knot on my face
109863,Scarface,But chose another time and a place
109864,Scarface,That I would avenge my last fight cuz the same shit
109865,Scarface,Aint gonna happen that just happened last night
109866,Scarface,Knuckle game changed quicker than lightning
109867,Scarface,Either stick em or blast pipes its the fastlife
109868,Scarface,I try to give another nigga advice shoot dice
109869,Scarface,Do plenty of shit cause this life how many you get 
109870,Scarface,How many niggas do you know get two 
109871,Scarface,Besides a nigga who snitch to skip a life bid be one a your crew
109872,Scarface,I dont respect killers I respect O G knowledge
109873,Scarface,Codes of the streets got new rules but no guidance
109874,Scarface,Lessons detrimental to a young disciple
109875,Scarface,Focus take care of your brothers niggas do as I do
109876,Scarface,Keep your enemies close where they can see you
109877,Scarface,Its not your enemy who get you
109878,Scarface,Its always your own people  x  
109879,Scarface,Got me wondering can I trust my friends 
109880,Scarface,Cuz they stick me in my back every chance they get
109881,Scarface,Am I paranoid and if thats the case
109882,Scarface,Is it curable Can you help me find my place 
109883,Scarface,I cant handle this Im losing it
109884,Scarface,With a loose grip Im hanging on to emptiness
109885,Scarface,Help your brother save him from the
109886,Scarface,Evil demons in between us came between us
109887,Scarface,I know you hate me dont you
109888,Scarface,I bet you sit and wish my time never came
109889,Scarface,You probably rather see me die in the game
109890,Scarface,You probably rather see me die in a plane
109891,Scarface,Well yall see me up on top of my dough
109892,Scarface,I get my money shit changed
109893,Scarface,And niggas start looking at me different than this
109894,Scarface,And downplay the real nigga shit to get with a bitch
109895,Scarface,But Imma tell a motherfucker like this
109896,Scarface,You only good as what you come up against
109897,Scarface,Nigga you get what you get
109898,Scarface,Sure the grass is greener on the other side of the fence
109899,Scarface,But any attempts and you gonna need the guy in the trench
109900,Scarface,Ima starter while you riding the bench
109901,Scarface,You saying you a player well Im the one designing your prints
109902,Scarface,Something to go by to let these niggas know I
109903,Scarface,Dont believe in letting shit slide nigga gonna die
109904,Scarface,Best friends since high school seniors
109905,Scarface,But let the bullshit come between us
109906,Scarface,Got me wondering can I trust my friends 
109907,Scarface,Cuz they stick me in my back every chance they get
109908,Scarface,Am I paranoid and if thats the case
109909,Scarface,Is it curable Can you help me find my place 
109910,Scarface,I cant handle this Im losing it
109911,Scarface,With a loose grip Im hanging on to emptiness
109912,Scarface,Help your brother save him from the
109913,Scarface,Evil demons in between us came between us
109914,Scarface,This song right here dedicated to the homie Curtis Davis
109915,Scarface,We love you home Big Mello RIP
109916,Scarface,If I had to play God for a day
109917,Scarface,I would open up the gates let the world see my face
109918,Scarface,Remove all doubt from the ones without the faith
109919,Scarface,And put them on the path of the straight
109920,Scarface,A safe place for the young to come out if they want to play
109921,Scarface,I let their mommas know that they ok
109922,Scarface,And when yall pray Ill respond so you can all see a sign
109923,Scarface,And answer every pray one at a time
109924,Scarface,If Im God huh all the stabbings all the war would come to cease
109925,Scarface,My whole entire hood would be at peace no more beef
109926,Scarface,And you could sleep without the fears of being woke
109927,Scarface,By the sounds of sirens screams of people being smoked
109928,Scarface,No more dope you dont need it youll be cured of all diseases
109929,Scarface,Your whole entire life would be deleted
109930,Scarface,Please forgive me Ive been dreaming
109931,Scarface,And rudely interrupted by the demons
109932,Scarface,Laughed at the picture I was seeing on the ceiling
109933,Scarface,Who pulls the strings of the world as we struggle today
109934,Scarface,I dont want to wait wait wait til I die
109935,Scarface,Wait wait wait for my eyes to close
109936,Scarface,Smile on your child so he knows
109937,Scarface,Just imagine if the devil had a day
109938,Scarface,And God had took a break and walked away would you feel safe 
109939,Scarface,If everything you loved turned into hate
109940,Scarface,Will the dark angels evil show you grace
109941,Scarface,Only to be eaten by a snake one life one mistake
109942,Scarface,Be careful of the choices that you make cause one day
109943,Scarface,Youll be standing on your feet and then the next
109944,Scarface,Youre underneath the sheet greeting death
109945,Scarface,I wonder when I sleep is he there sitting on my chest
109946,Scarface,Stealing breath shortening my days even less
109947,Scarface,Lost souls never rest a killer walks the streets seeking flesh
109948,Scarface,A adolescent hangs shes depressed
109949,Scarface,A priest who confessed a judged typing a nigga in a text
109950,Scarface,Your honor what the fuck did you expect 
109951,Scarface,A father kills his son look at life its a mess
109952,Scarface,Just imagine what would happen if the lord up and left
109953,Scarface,Who pulls the strings of the world as we struggle today
109954,Scarface,I dont want to wait wait wait til I die
109955,Scarface,Wait wait wait for my eyes to close
109956,Scarface,Smile on your child so he knows
109957,Scarface,When all that you believed in was a lie
109958,Scarface,Are you willing to accept it when you find out
109959,Scarface,Or try to reason with yourself thats what it is when its not
109960,Scarface,And all the whole while its been a plot
109961,Scarface,To poison our minds and leave us blind to the fact
109962,Scarface,That they keep us in the dark know they act
109963,Scarface,We react all surprised and not realize that this shit a trap
109964,Scarface,Thought religion was the answer but the answer wasnt that
109965,Scarface,The church and these politics they all full of crap
109966,Scarface,Its a shame but thats how were blaming its for the scratch
109967,Scarface,So I dont knock Im tryna to put a black card in my wallet
109968,Scarface,But some dollars in my pocket aint the topic
109969,Scarface,This is just crazy these little babies ticking time bombs
109970,Scarface,Walking around the lunchroom pulling guns
109971,Scarface,If momma and daddy took the time to raise their son
109972,Scarface,Then the sister wouldnt be the mom before she twenty one huh
109973,Scarface,Who pulls the strings of the world as we struggle today
109974,Scarface,I dont want to wait wait wait til I die
109975,Scarface,Wait wait wait for my eyes to close
109976,Scarface,Smile on your child so he knows
109977,Scarface,Dope sold on the cut make our hands bleed
109978,Scarface,Fuck broke it aint an option penitentiary
109979,Scarface,Or the grave is the only way we fall back
109980,Scarface,Do our time A T W then crawl back
109981,Scarface,To them streets where we come from taught life
109982,Scarface,Look alive know niggas better walk right
109983,Scarface,Real with it quick trigger finger gun play
109984,Scarface,I only know how to deal with these niggas one way
109985,Scarface,And someday I swear to God Imma change that
109986,Scarface,But I cant cause them evil demons came back
109987,Scarface,And when Im high yall I cant explain
109988,Scarface,What it feels like wishing I could die and just end the pain
109989,Scarface,Cause mane Ive been a loyal dude and you can trust that
109990,Scarface,But loyalty versus greed equals fuck that
109991,Scarface,I need to talk but there aint no one to listen
109992,Scarface,Lost inside a mental exorcism
109993,Scarface,Sometimes I close my eyes trying to hide from the pain
109994,Scarface,Things in my past are catching up fast living life against the grain
109995,Scarface,Just one time I wanna clear my mind the silence seems so loud
109996,Scarface,If I could I would fly away and live my life beyond the grey cloud
109997,Scarface,I woke up from a dream feeling all good
109998,Scarface,Prayed for better days ahead but what was yall doing
109999,Scarface,Lost stuck in a stand still waiting for a hand out
110000,Scarface,Hustling for tennis shoe paper never panned out
110001,Scarface,My sister tripping got my grandmother stressing
110002,Scarface,Cause shes only   and shes already pregnant
110003,Scarface,Another segment of them ghetto soap operas
110004,Scarface,Bgs is tripping aint nothing left to stop them
110005,Scarface,Uncle in jail daddy dead and their mammas
110006,Scarface,Cant teach them how to be men grow up being followers
110007,Scarface,The streets swallow them then life overpower them
110008,Scarface,Then off to the pen where the old heads devour them
110009,Scarface,Crash tested a dummy high volume
110010,Scarface,Only God can judge but yall niggas is comical
110011,Scarface,  percent of our futures off in prison
110012,Scarface,Prescription for my mental exorcism
110013,Scarface,Sometimes I close my eyes trying to hide from the pain
110014,Scarface,Things in my past are catching up fast living life against the grain
110015,Scarface,Just one time I wanna clear my mind the silence seems so loud
110016,Scarface,If I could I would fly away and live my life beyond the grey cloud
110017,Scarface,Another kid killed in cold blood a mothers heart broke
110018,Scarface,Family crying on the first few my heart spoke
110019,Scarface,Hurtful words I would never dare speak
110020,Scarface,In the house of the lord still Im in the devils reach
110021,Scarface,I dont wanna hear the preacher preach that shit a lie
110022,Scarface,Plus he knowing how that evil be but who am I
110023,Scarface,To judge a man when I see him try
110024,Scarface,FOX news tried to justify him
110025,Scarface,And aint no way that you can clarify
110026,Scarface,In cold blood our lil homies dying
110027,Scarface,Another sign of the times but its terrifying
110028,Scarface,That you could kill us off have us outlined in chalk
110029,Scarface,Get arrested go to jail go to court and get the fuck off
110030,Scarface,That shit is fucked off we worried about the money lost
110031,Scarface,While the clans about to light another cross
110032,Scarface,I aint denying it I speak from intuition
110033,Scarface,Its also from my mental exorcism
110034,Scarface,Sometimes I close my eyes trying to hide from the pain
110035,Scarface,Things in my past are catching up fast living life against the grain
110036,Scarface,Just one time I wanna clear my mind the silence seems so loud
110037,Scarface,If I could I would fly away and live my life beyond the grey cloud
110038,Scarface,What do you mean  Where am I at  
110039,Scarface,No you cant be my girlfriend
110040,Scarface,Cause I dont need that stress up in my life and
110041,Scarface,No you cant be my girlfriend
110042,Scarface,I think if Adam would of had another squeeze he might
110043,Scarface,Not have ate those fruits from the leaves of life
110044,Scarface,Far as Eve there couldnt have been a more deceivin wife
110045,Scarface,Seen that Adam had a weak spot and she was right
110046,Scarface,I just call it how I see it she in love with him
110047,Scarface,And he in love too but still fuckin all of them
110048,Scarface,Can you imagine you on lock with one breeze for life 
110049,Scarface,Wakin up in the mornin and layin down at night
110050,Scarface,With the same face lookin at you all the time
110051,Scarface,Realizin now that happiness was hard to find
110052,Scarface,You wanna go out and try to find that smile and face
110053,Scarface,Plus shes always mad and her sex aint great
110054,Scarface,And she dont suck dick like she used to do
110055,Scarface,Force a nigga into tryna find him somethin new
110056,Scarface,And on the real I done seen it when it went like this
110057,Scarface,But girl theres one thing happenin that you cant forget
110058,Scarface,No you cant be my girlfriend
110059,Scarface,Cause I dont need that stress up in my world and
110060,Scarface,No you cant be my girlfriend
110061,Scarface,And we can get it on and on and on
110062,Scarface,Im gone when the sun come again
110063,Scarface,You cant be my you cant be my
110064,Scarface,But you can never be my main boo we can remain cool
110065,Scarface,But we cant be seen and for this I can blame you
110066,Scarface,Because you got more miles than a F    
110067,Scarface,You been ran through and I know for a fact you got history
110068,Scarface,But since we met Ive been hearin your name in certain circles
110069,Scarface,Pussy got a snap like a turtle
110070,Scarface,And you can catch a nigga on the late night
110071,Scarface,Comin out the club half drunk off Remy and Sprite
110072,Scarface,And make a man out of him quick cause of how you handle the dick
110073,Scarface,Its unlike no other she a bad motherfucker
110074,Scarface,But Im too strong to let a hoe undercover
110075,Scarface,Make me look fucked up cause unlike those others
110076,Scarface,I done met a lot of freaky girls in my lifespan
110077,Scarface,So you cant get mad cause I am not your man
110078,Scarface,Your understandin was bad it was not my plan
110079,Scarface,For you to fall in love with me girl its not like that
110080,Scarface,No you cant be my girlfriend
110081,Scarface,Cause I dont need that stress up in my world and
110082,Scarface,No you cant be my girlfriend
110083,Scarface,And we can get it on and on and on
110084,Scarface,Im gone when the sun come again
110085,Scarface,You cant be my you cant be my
110086,Scarface,For me to say that  I do  would be a lie cause I dont
110087,Scarface,Believe no woman is right for me so I wont
110088,Scarface,Try to talk myself into thinkin she is
110089,Scarface,And if she leaves me for this thats just one less bitch
110090,Scarface,And trust me I tried to be a one woman man
110091,Scarface,But for every one woman theres a man home man
110092,Scarface,Sayin  Damn I done spent six years in this shit
110093,Scarface,The first two was cool and then the bitch just flipped 
110094,Scarface,And then thats it had to make some new plans
110095,Scarface,Cause your brand new woman got a brand new man
110096,Scarface,Now youre hurt all alone steady hittin her phone
110097,Scarface,But a bigger whip and longer bankroll she gone
110098,Scarface,And if I ever say  Maybe  and you thought that I might
110099,Scarface,You consider just imagine what my wife was like
110100,Scarface,And if you aint love my kids like you loved your own
110101,Scarface,And me unconditionally when I was wrong I was gone
110102,Scarface,No you cant be my girlfriend
110103,Scarface,Cause I dont need that stress up in my world and
110104,Scarface,No you cant be my girlfriend
110105,Scarface,And we can get it on and on and on
110106,Scarface,Im gone when the sun come again
110107,Scarface,You cant be my you cant be my girl
110108,Scarface,Cos I aint ever change on you motherfuckers
110109,Scarface,And OGs spitting game on you motherfuckers
110110,Scarface,You should be ashamed like a motherfucker
110111,Scarface,The streets packed with all these lame lil motherfuckers
110112,Scarface,Everybody wanna be a hard stopper
110113,Scarface,You wont find too many riding out without a chopper
110114,Scarface,They end up dead or somewhere in lock up
110115,Scarface,Where somebody will break em off something proper
110116,Scarface,These youngsters think that Im so cool
110117,Scarface,They wanna learn the game from an old school
110118,Scarface,I give em strategies to sleep on
110119,Scarface,So when they put me in the grave they could keep on
110120,Scarface,Now first on your check list
110121,Scarface,Be your own man cos your friends aint shit
110122,Scarface,They only come around when they need to
110123,Scarface,Use that home boy shit to deceive you
110124,Scarface,Remember you dont owe nobody niggas
110125,Scarface,Niggas put the bite to the hand that feeds that s your body
110126,Scarface,And they forgetting how they got there
110127,Scarface,This is life its a game but its not fair
110128,Scarface,Its hard enough trynna get by
110129,Scarface,Day to day struggling with shit so you get high
110130,Scarface,And staying drunk on the regular
110131,Scarface,Talking dope talk on your cellular
110132,Scarface,But in this game thats a no no
110133,Scarface,The streets aint the only ones watching taking photos
110134,Scarface,And life aint bitches and money
110135,Scarface,This lifes bout getting this money
110136,Scarface,Because that bitch is a problem
110137,Scarface,Cant live with and cant live without her
110138,Scarface,My advice to you is stay on your grind
110139,Scarface,Keep that bitch on her back and your bank on your mind nigga
110140,Scarface,And we dont talk to police
110141,Scarface,Thats the number one rule on the streets
110142,Scarface,Cause if you cant do the time then you dont do the crime
110143,Scarface,Nigga keep the streets quiet
110144,Scarface,You dont upstrap unless you have to
110145,Scarface,Bullshit with these niggas and they clap you
110146,Scarface,Dig two graves just in case its two bodies
110147,Scarface,And never bring a stick to a gunfight
110148,Scarface,One shot one kill you get one life
110149,Scarface,And shitting where you sleep aint an option
110150,Scarface,People knowing where you sleep thats a problem
110151,Scarface,You got to watch these niggas
110152,Scarface,They aint your home boys not these niggas
110153,Scarface,First chance you call sleep they could murk you
110154,Scarface,So dont put squares in your circle
110155,Scarface,Cos these streets dont love nobody
110156,Scarface,You gotta pay attention to the signs Johnny
110157,Scarface,If you a weak nigga dont try to play hard
110158,Scarface,Better keep your punk ass out the yard
110159,Scarface,And dont get fronted just avoid that
110160,Scarface,But if you have to pay them boys back
110161,Scarface,Cos niggas aint playing its a drought
110162,Scarface,The border is closed the cash running out
110163,Scarface,And broke mother fuckers make the best crooks
110164,Scarface,Every nigga in the way getting shook
110165,Scarface,You got to play the game by the book
110166,Scarface,I fuck around and your life getting took
110167,Scarface,And last but not least when you make that money
110168,Scarface,Keep it low pro dont say shit dummy
110169,Scarface,And dont say shit to your girlfriend
110170,Scarface,Pillow talk will send your ass to the state pen
110171,Scarface,Take notes to the game Im providing
110172,Scarface,Stop using momma names trynna hide shit
110173,Scarface,Nigga them feds aint stupid
110174,Scarface,You aint the only nigga trynna do this
110175,Scarface,Riding round the hood in a four door
110176,Scarface,Flying spur ol rims trynna showboat
110177,Scarface,You drawing too much attention
110178,Scarface,And then be surprised when you catch a life sentence
110179,Scarface,The game is a thing that you boys should be proud of
110180,Scarface,But once you in it its hard to get out of
110181,Scarface,And greed will kill a nigga like a gun do
110182,Scarface,So when you get the chance to make a break for it run fool
110183,Scarface,Staring down the barrel of a Colt    
110184,Scarface,Im feeling mad suicidal so I think Im gonna drive
110185,Scarface,Everything is hazy and I cant see my lanes
