,artist,text
73431,Kendrick Lamar,Just ride with me just die with me that gun store right there
73432,Kendrick Lamar,When you fight dont fight fair cause youll never win yeah
73433,Kendrick Lamar,Right I had the yapper and I tore they ass up
73434,Kendrick Lamar,We really out here my nigga you niggas dont understand my nigga
73435,Kendrick Lamar,Im off of pill and Remy Red my nigga trippin my nigga
73436,Kendrick Lamar,Smoking out pouring up keep that lean up in my cup
73437,Kendrick Lamar,All my car got leather and wood in my hood we call it buck
73438,Kendrick Lamar,Everybody wanna ball holla at broads at the mall
73439,Kendrick Lamar,If he up watch him fall I cant fuck with yall
73440,Kendrick Lamar, Pussy ass ho niggas I cant fuck with yall
73441,Kendrick Lamar, Bitches all up in my business I cant fuck with yall
73442,Kendrick Lamar, Industry of counterfeits I cant fuck with yall
73443,Kendrick Lamar,Taking off when you landing
73444,Kendrick Lamar,Bitch niggas gonna throw tantrums
73445,Kendrick Lamar,And Im dancing on them stars
73446,Kendrick Lamar,The galaxy aint got room for yall
73447,Kendrick Lamar,Aint nothing gonna happen soon for yall
73448,Kendrick Lamar,While Im here and every day I hear
73449,Kendrick Lamar,Reason why you never dealt with me
73450,Kendrick Lamar,Reason why your girl dealt with me
73451,Kendrick Lamar,Hands up in the building we get busy and say
73452,Kendrick Lamar,R I P Aaliyah R I P  yep R I P Aaliyah R I P  yep
73453,Kendrick Lamar,Thats exactly what this sound like
73454,Kendrick Lamar,A to the A to the L I Y A H give it up  times
73455,Kendrick Lamar,Then give it right back dont blow my high
73456,Kendrick Lamar,Smoking out pouring up keep that lean up in my cup
73457,Kendrick Lamar,All my car got leather and wood in my hood we call it buck
73458,Kendrick Lamar,Everybody wanna ball holla at broads at the mall
73459,Kendrick Lamar,If he up watch him fall I cant fuck with yall
73460,Kendrick Lamar, Pussy ass ho niggas I cant fuck with yall
73461,Kendrick Lamar, Bitches all up in my business I cant fuck with yall
73462,Kendrick Lamar, Industry of counterfeits I cant fuck with yall
73463,Kendrick Lamar,Look at my life then look at yours
73464,Kendrick Lamar,Get some ambition why you bored 
73465,Kendrick Lamar,Timell never wait on no man
73466,Kendrick Lamar,Society will never hold your hand
73467,Kendrick Lamar,Niggas like the gossip like bitches
73468,Kendrick Lamar,Got me thinking you dont like bitches
73469,Kendrick Lamar,Wonder whats behind them Ray Bans
73470,Kendrick Lamar,Eyes of a coward I understand
73471,Kendrick Lamar,Niggas like the gossip like bitches
73472,Kendrick Lamar,Sip Don Perignon when we finish we say
73473,Kendrick Lamar,R I P Aaliyah R I P  yep R I P Aaliyah R I P  yep
73474,Kendrick Lamar,Thats exactly what this sound like
73475,Kendrick Lamar,But never will I ever forget Left Eye
73476,Kendrick Lamar,Roll up put a ribbon in the sky
73477,Kendrick Lamar,And a button on your lips dont blow my high
73478,Kendrick Lamar,Smoking out pouring up keep that lean up in my cup
73479,Kendrick Lamar,All my car got leather and wood in my hood we call it buck
73480,Kendrick Lamar,Everybody wanna ball holla at broads at the mall
73481,Kendrick Lamar,If he up watch him fall I cant fuck with yall
73482,Kendrick Lamar, Pussy ass ho niggas I cant fuck with yall
73483,Kendrick Lamar, Bitches all up in my business I cant fuck with yall
73484,Kendrick Lamar, Industry of counterfeits I cant fuck with yall
73485,Kendrick Lamar,Now everybody sing this shit
73486,Kendrick Lamar,Im sending him a four page letter
73487,Kendrick Lamar,And I enclosed it with a kiss  a kiss 
73488,Kendrick Lamar,And when I write him he better
73489,Kendrick Lamar,Look at my life and look at yours
73490,Kendrick Lamar,Get some ambition why you bored
73491,Kendrick Lamar,Complexion dont mean a thing  its a Zulu love 
73492,Kendrick Lamar,It all feels the same  its a Zulu love 
73493,Kendrick Lamar,Dark as the midnight hour or bright as the mornin sun
73494,Kendrick Lamar,Give a fuck about your complexion I know what the Germans done
73495,Kendrick Lamar,Sneak me through the back window I m a good field nigga
73496,Kendrick Lamar,I made a flower for you outta cotton just to chill with you
73497,Kendrick Lamar,You know Id go the distance you know Im ten toes down
73498,Kendrick Lamar,Even if master listenin cover your ears he bout to mention
73499,Kendrick Lamar,Complexion dont mean a thing  its a Zulu love 
73500,Kendrick Lamar,It all feels the same  its a Zulu love 
73501,Kendrick Lamar,Dark as the midnight hour Im bright as the mornin sun
73502,Kendrick Lamar,Brown skinned but your blue eyes tell me your mama cant run
73503,Kendrick Lamar,Sneak me through the back window I m a good field nigga
73504,Kendrick Lamar,I made a flower for you outta cotton just to chill with you
73505,Kendrick Lamar,You know Id go the distance you know Im ten toes down
73506,Kendrick Lamar,Even if masters listenin I got the worlds attention
73507,Kendrick Lamar,So Ima say somethin thats vital and critical for survival
73508,Kendrick Lamar,Of mankind if he lyin color should never rival
73509,Kendrick Lamar,Beauty is what you make it I used to be so mistaken
73510,Kendrick Lamar,By different shades of faces
73511,Kendrick Lamar,Then Whit told me  A woman is woman love the creation 
73512,Kendrick Lamar,It all came from God then you was my confirmation
73513,Kendrick Lamar,I came to where you reside
73514,Kendrick Lamar,And looked around to see more sights for sore eyes
73515,Kendrick Lamar,Let the Willie Lynch theory reverse a million times with   
73516,Kendrick Lamar,Complexion dont mean a thing  its a Zulu love 
73517,Kendrick Lamar,It all feels the same  its a Zulu love 
73518,Kendrick Lamar, Where the homegirl Rapsody at 
73519,Kendrick Lamar,I need you to speak your mind real quick loved one  
73520,Kendrick Lamar,Let me talk my Stu Scott  scuse me on my  Pac
73521,Kendrick Lamar,Keep your head up when did you stop loving thy
73522,Kendrick Lamar,Color of your skin Color of your eyes
73523,Kendrick Lamar,That s the real blues baby like you met Jay s baby
73524,Kendrick Lamar,You blew me away you think more beauty in blue green and grey
73525,Kendrick Lamar,All my solemn men up north   years a slave
73526,Kendrick Lamar,  years of age thinkin my shade too dark
73527,Kendrick Lamar,I love myself I no longer need Cupid
73528,Kendrick Lamar,Enforcin my dark side like a young George Lucas
73529,Kendrick Lamar,Light don t mean you smart bein dark don t make you stupid
73530,Kendrick Lamar,And frame of mind for them bustas ain t talkin  Woo hah  
73531,Kendrick Lamar,Need a paradox for the pair of docs they tutored
73532,Kendrick Lamar,Like two Todds L L you lose two times
73533,Kendrick Lamar,If you don t see you beautiful in your complexion
73534,Kendrick Lamar,It ain t complex to put it in context
73535,Kendrick Lamar,Find the air beneath the kite that s the context
73536,Kendrick Lamar,Yeah baby I m conscious ain t no contest
73537,Kendrick Lamar,If you like it I love it all your earth tones been blessed
73538,Kendrick Lamar,Ain t no stress jiggaboos wanna be
73539,Kendrick Lamar,I ain t talkin Jay I ain t talkin Bey
73540,Kendrick Lamar,I m talkin days we got school watchin movie screens
73541,Kendrick Lamar,And spike your self esteem
73542,Kendrick Lamar,The new James Bond gon be black as me
73543,Kendrick Lamar,Black as brown hazelnut cinnamon black tea
73544,Kendrick Lamar,And it s all beautiful to me
73545,Kendrick Lamar,Call your brothers magnificent call all the sisters queens
73546,Kendrick Lamar,We all on the same team blues and pirus no colors ain t a thing
73547,Kendrick Lamar,Barefoot babies with no cares
73548,Kendrick Lamar,Teenage gun toters that don t play fair should I get out the car 
73549,Kendrick Lamar,I don t see Compton I see something much worse
73550,Kendrick Lamar,The land of the landmines the hell that s on earth
73551,Kendrick Lamar,I know a lot of people that smile in my face
73552,Kendrick Lamar,But talk behind my back every time Im gone
73553,Kendrick Lamar,So when they call my number I dont never pick up
73554,Kendrick Lamar,I dont owe you shit bitch leave me alone
73555,Kendrick Lamar,Too many niggas not enough hoes
73556,Kendrick Lamar,And some of you niggas acting like hoes
73557,Kendrick Lamar,Stay to myself like loners do
73558,Kendrick Lamar,Get high by myself Im not in the mood
73559,Kendrick Lamar,To politic or be fake with you
73560,Kendrick Lamar,We apologize if you ever knew
73561,Kendrick Lamar,Too many niggas and not enough hoes
73562,Kendrick Lamar,And most of you niggas acting like hoes
73563,Kendrick Lamar,Everything I do is too alumni
73564,Kendrick Lamar,Imma take my time Imma master it
73565,Kendrick Lamar,You should be mindful of a mastermind
73566,Kendrick Lamar,Put a landmine right where your momma live
73567,Kendrick Lamar,Now blow up blow up hold up Ive seen your kind before
73568,Kendrick Lamar,See me as a dollar sign til I resign or you report
73569,Kendrick Lamar,That I done you wrong and I mean to know my homie never
73570,Kendrick Lamar,Nigga right now its now or never nigga right now Im high as ever
73571,Kendrick Lamar,I know a lot of people that smile in my face
73572,Kendrick Lamar,But talk behind my back every time Im gone
73573,Kendrick Lamar,So when they call my number I dont never pick up
73574,Kendrick Lamar,I dont owe you shit bitch leave me alone
73575,Kendrick Lamar,Too many niggas not enough hoes
73576,Kendrick Lamar,And some of you niggas acting like hoes
73577,Kendrick Lamar,Stay to myself like loners do
73578,Kendrick Lamar,Get high by myself Im not in the mood
73579,Kendrick Lamar,To politic or be fake with you
73580,Kendrick Lamar,We apologize if you ever knew
73581,Kendrick Lamar,Too many niggas and not enough hoes
73582,Kendrick Lamar,And most of you niggas acting like hoes
73583,Kendrick Lamar,Everybody heard that I fuck with Dre
73584,Kendrick Lamar,And they wanna tell me I made it
73585,Kendrick Lamar,Nigga I aint made shit if he gave me a handout
73586,Kendrick Lamar,Imma take his wrist and break it
73587,Kendrick Lamar,Nigga Im faded off of that Nuvo chilling with two hoes in here
73588,Kendrick Lamar,And they tie my laces living the Matrix as them pills disappear
73589,Kendrick Lamar,Me and my niggas just acting bad HiiiPower conglomerate
73590,Kendrick Lamar,Living that life and counting this cash old friends I no longer have
73591,Kendrick Lamar,I know a lot of people that smile in my face
73592,Kendrick Lamar,But talk behind my back every time Im gone
73593,Kendrick Lamar,So when they call my number I dont never pick up
73594,Kendrick Lamar,I dont owe you shit bitch leave me alone
73595,Kendrick Lamar,Too many niggas not enough hoes
73596,Kendrick Lamar,And some of you niggas acting like hoes
73597,Kendrick Lamar,I remember when I came out and shit
73598,Kendrick Lamar,Man its been so long since they see my dick
73599,Kendrick Lamar,Probably been five months since I seen my seed
73600,Kendrick Lamar,Goddammit K Dot when it come to this 
73601,Kendrick Lamar,When I was sleeping on couches
73602,Kendrick Lamar,Nigga couldnt get a call just a Glock for my vouch
73603,Kendrick Lamar,Nigga I was mothafuckin out yeah
73604,Kendrick Lamar,With the flashing lights had me stuck like reindeer
73605,Kendrick Lamar,When I should have been making bank yeah
73606,Kendrick Lamar,I was somewhere stuck where the flame is
73607,Kendrick Lamar,Mothafucka see how far that I came here
73608,Kendrick Lamar,Went broke and I came up in the same year  Can I get a hell yeah  
73609,Kendrick Lamar,Drop my tear hold my joy  Show my pride 
73610,Kendrick Lamar, Music saved my fucking life Im doing right and you left behind 
73611,Kendrick Lamar, Feel my pain now Im styling Herm s shit I spent a thousand 
73612,Kendrick Lamar, Different homes different islands 
73613,Kendrick Lamar,Dropped my mixtape and it sold like an album
73614,Kendrick Lamar,Reason why Im be going big bitch suck my dick
73615,Kendrick Lamar,Yeah Im going big bitch suck my dick
73616,Kendrick Lamar,Tell em Im going big bitch suck my dick
73617,Kendrick Lamar,Yeah Im going big bitch suck my dick  Yeah  
73618,Kendrick Lamar,Too many niggas not enough hoes
73619,Kendrick Lamar,And some of you niggas acting like hoes
73620,Kendrick Lamar,Stay to myself like loners do
73621,Kendrick Lamar,Get high by myself Im not in the mood
73622,Kendrick Lamar,To politic or be fake with you
73623,Kendrick Lamar,We apologize if you ever knew
73624,Kendrick Lamar,Too many niggas and not enough hoes
73625,Kendrick Lamar,And most of you niggas acting like hoes
73626,Kendrick Lamar,Like hoes like hoes like hoes like hoes
73627,Kendrick Lamar,Like hoes nigga actin like a hoe
73628,Kendrick Lamar,Like hoes like hoes like hoes
73629,Kendrick Lamar,You actin like a hoe you actin like a hoe
73630,Kendrick Lamar,You actin like a hoe niggas actin like a hoe
73631,Kendrick Lamar,Like hoes like hoes like hoes like hoes
73632,Kendrick Lamar,So I met this young lady ya know when I went back home I was tryna spit my best game to her you know give her my best cap but she kept on snapping her fingers like  snaps  I said  You know what girl You crazy  Then she asked me what he said   
73633,Kendrick Lamar, What did the Asian say   A peace of mind 
73634,Kendrick Lamar,Thats what the Asian said I need a divine
73635,Kendrick Lamar,Intervention was his religion and I was surprised
73636,Kendrick Lamar,Him believing in Buddha me believing in God
73637,Kendrick Lamar,Asked him what are you doing he said  taking my time 
73638,Kendrick Lamar,Meditation is a must it dont hurt if you try
73639,Kendrick Lamar,See you thinking too much plus you too full of yourself
73640,Kendrick Lamar,Worried about your career you ever think of your health 
73641,Kendrick Lamar, What did the Indian say   A piece of land 
73642,Kendrick Lamar,Thats what the Indian said I needed the man
73643,Kendrick Lamar,Telling me longevity is in the dirt
73644,Kendrick Lamar,Should buy some property first
73645,Kendrick Lamar,Should profit a better dollar with generational perks
73646,Kendrick Lamar,Equity at his best really you should invest
73647,Kendrick Lamar,These tangible things expire dont you expect
73648,Kendrick Lamar,Income with so much outcome and yes
73649,Kendrick Lamar,Look at my heritage we blessed
73650,Kendrick Lamar, Now what the black man say   A piece of pussy 
73651,Kendrick Lamar,Thats what the black man said I needed to push me
73652,Kendrick Lamar,To the limit to satisfy my hunger
73653,Kendrick Lamar,We do it all for a woman from haircut to a war
73654,Kendrick Lamar,We like to live in the jungle like to play in the peach
73655,Kendrick Lamar,He said  nigga come back to reality for a week 
73656,Kendrick Lamar,Pussy is power fuck on a new bitch every night
73657,Kendrick Lamar,I wouldnt be prouder you should allow it
73658,Kendrick Lamar, What the white man say  A piece of mines
73659,Kendrick Lamar,Thats what the white man wanted when I rhyme
73660,Kendrick Lamar,Telling me that he selling me just for       
73661,Kendrick Lamar,If I go platinum from rapping I do the company fine
73662,Kendrick Lamar,What if I compromise He said it dont even matter
73663,Kendrick Lamar,You make a million or more you living better than average
73664,Kendrick Lamar,You losing your core following gaining it all
73665,Kendrick Lamar,He put a price on my talent I hit the bank and withdraw
73666,Kendrick Lamar,Hit the bank and withdraw hit the bank and withdraw
73667,Kendrick Lamar,Put myself in the rocket ship and I shot for the stars
73668,Kendrick Lamar,Look at what you accomplished and what he said to the boy
73669,Kendrick Lamar, Ima make you some promises that you just cant ignore
73670,Kendrick Lamar,Your profession anonymous as an artist if I dont target your market
73671,Kendrick Lamar,If you aint signing your signature when I throw you my wallet
73672,Kendrick Lamar,A lot of rappers are giving their demo all in the toilet
73673,Kendrick Lamar,Your world tour your masters mortgage I need a piece 
73674,Kendrick Lamar,I holler  What you do What you say  
73675,Kendrick Lamar,I shall enjoy the fruits of my labor if I get freed today
73676,Kendrick Lamar,I holler  What you do What you say  
73677,Kendrick Lamar,I shall enjoy the fruits of my labor if I get freed today
73678,Kendrick Lamar,Tell em we dont die tell em we dont die
73679,Kendrick Lamar,Tell em we dont die we multiply
73680,Kendrick Lamar,Tell em we dont die tell em we dont die
73681,Kendrick Lamar,Tell em we dont die we multiply
73682,Kendrick Lamar,Tell em we dont die tell em we dont die
73683,Kendrick Lamar,Tell em we dont die we multiply
73684,Kendrick Lamar,Tell em we dont die tell em we dont die
73685,Kendrick Lamar,Tell em we dont die we multiply
73686,Kendrick Lamar,Fancy girls on Long Beach Boulevard
73687,Kendrick Lamar,Flagging down all of these flashy cars
73688,Kendrick Lamar,Uh and Lord knows shes beautiful
73689,Kendrick Lamar,Lord knows the usuals leaving her body sore
73690,Kendrick Lamar,She take the little change she make to fix her nail cuticles
73691,Kendrick Lamar,Lipstick is suitable to make you fiend for more
73692,Kendrick Lamar,She play Mr Shakur thats her favorite rapper
73693,Kendrick Lamar,Bumping  Brendas Got a Baby while a pervert yelling at her
73694,Kendrick Lamar,And she capture features of a woman but only   
73695,Kendrick Lamar,The  cars start honking she start running like Flo Jo
73696,Kendrick Lamar,Dont care if they Joe Blow
73697,Kendrick Lamar,If they got money to blow a blow job is a sure go
73698,Kendrick Lamar,And sure enough dont see a dime of dirty dollars
73699,Kendrick Lamar,She give all to her daddy but she dont know her father thats ironic
73700,Kendrick Lamar,See a block away from Lueders Park I seen the El Camino parked
73701,Kendrick Lamar,In her heart she hate it there but in her mind she made it where
73702,Kendrick Lamar,Nothing really matters so she hit the back seat
73703,Kendrick Lamar,Rosa Parks never a factor when she making ends meet
73704,Kendrick Lamar,Fancy girls on Long Beach Boulevard
73705,Kendrick Lamar,Flagging down all of these flashy cars
73706,Kendrick Lamar,And Lord knows shes beautiful
73707,Kendrick Lamar,Lord knows the usuals leaving her body sore
73708,Kendrick Lamar,Her anatomy is Gods temple
73709,Kendrick Lamar,And its quite simple her castle is bout to be destroyed
73710,Kendrick Lamar,Shes always paranoid watching the law inside the streets
73711,Kendrick Lamar,Undercovers the dummies that look like decoys
73712,Kendrick Lamar,Remember the sergeant let her slide said if he seen
73713,Kendrick Lamar,Whats between her thighs hed compromise to no surprise
73714,Kendrick Lamar,She took the ultimatum round the alleyway and gave him
73715,Kendrick Lamar,A warm welcome that filled him right below the navel
73716,Kendrick Lamar,Though he was wired up like a pair of jumping cables
73717,Kendrick Lamar,His eyes was closed shut prior charges he had waived em
73718,Kendrick Lamar,It was a block away from Lueders Park I seen a squad car parked
73719,Kendrick Lamar,And in her heart she hate it there but in her mind she made it where
73720,Kendrick Lamar,Nothing really matters so she hit the back seat
73721,Kendrick Lamar,Cause Rosa Parks never a factor when she topping off police
73722,Kendrick Lamar,Fancy girls on Long Beach Boulevard
73723,Kendrick Lamar,Flagging down all of these flashy cars
73724,Kendrick Lamar,And Lord knows shes beautiful
73725,Kendrick Lamar,Lord knows the usuals leaving her body sore
73726,Kendrick Lamar,As she bust down like a   bunk on tour
73727,Kendrick Lamar,She suddenly realized shell never escape the allure
73728,Kendrick Lamar,Of a black man white man needing satisfaction
73729,Kendrick Lamar,At first it became a practice but now shes numb to it
73730,Kendrick Lamar,Sometimes she wonder if she can do it like nuns do it
73731,Kendrick Lamar,But she never heard of Catholic religion or sinners redemption
73732,Kendrick Lamar,That sounds foolish and you can blame it on her mother
73733,Kendrick Lamar,For letting her boyfriend slide candy under her cover
73734,Kendrick Lamar,Ten months before she was ten he moved in and thats when he touched her
73735,Kendrick Lamar,This mothafucka is the fucking reason why Keisha rushing through that
73736,Kendrick Lamar,Block away from Lueders Park I seen the El Camino park
73737,Kendrick Lamar,And in her heart she hate it there but in her mind she made it where
73738,Kendrick Lamar,Nothing really matters still she hit the back seat
73739,Kendrick Lamar,And caught a knife inside the bladder left for dead raped in the street
73740,Kendrick Lamar,My little sister eleven I looked her right in the face
73741,Kendrick Lamar,The day that I wrote this song sat her down and pressed play
73742,Kendrick Lamar,Fancy girls on Long Beach Boulevard
73743,Kendrick Lamar,Flagging down all of these flashy cars
73744,Kendrick Lamar,I wrote this record while thirty thousand feet in the air
73745,Kendrick Lamar,Stewardess complimenting me on my nappy hair
73746,Kendrick Lamar,If I can fuck her in front of all of these passengers
73747,Kendrick Lamar,Theyll probably think Im a terrorist eat my asparagus
73748,Kendrick Lamar,Then Im asking her thoughts of a young nigga
73749,Kendrick Lamar,Fast money and freedom a crash dummy for dollars
73750,Kendrick Lamar,I know you dying to meet him Ill probably die in a minute
73751,Kendrick Lamar,Just bury me with twenty bitches twenty million and a Comptown fitted
73752,Kendrick Lamar,Hol up  hol up  hol up  hol up 
73753,Kendrick Lamar,Hol up  hol up  hol up  hol up 
73754,Kendrick Lamar,Yeah big shit popping  Section   
73755,Kendrick Lamar,Back in this bitch in the back of that bitch
73756,Kendrick Lamar,With my back against the wall
73757,Kendrick Lamar,And your bitch on the edge of my dick  
73758,Kendrick Lamar,I call a bitch a bitch a hoe a hoe a woman a woman
73759,Kendrick Lamar,I never did nothing but break the ground on top of the asphalt
73760,Kendrick Lamar,Tire mark gave you evidence that Im easily peddling
73761,Kendrick Lamar,With the speed of a lightning bolt as a kid I killed two adults
73762,Kendrick Lamar,Im too advanced I lived my twenties at two years old the wiser man
73763,Kendrick Lamar,Truth be told Im like eighty seven
73764,Kendrick Lamar,Wicked as eighty reverends in a pool of fire with devils holding hands
73765,Kendrick Lamar,From a distance dont know which one is a Christian damn
73766,Kendrick Lamar,Who can I trust in two thousand and twelve 
73767,Kendrick Lamar,Theres no one not even myself
73768,Kendrick Lamar,A Gemini screaming for help somebody
73769,Kendrick Lamar,Hol up  hol up  hol up  hol up 
73770,Kendrick Lamar,Hol up  hol up  hol up  hol up 
73771,Kendrick Lamar,Yeah big shit poppin everybody watchin
73772,Kendrick Lamar,When you do it like this nigga losing aint a option
73773,Kendrick Lamar,Hol up  hol up  hol up  hol up 
73774,Kendrick Lamar,Hol up  hol up  hol up  hol up 
73775,Kendrick Lamar,Hey hey kick her out the studio Ali
73776,Kendrick Lamar,Twenty four seven nigga working his ass for it she popping that ass for it
73777,Kendrick Lamar,The King of Diamonds with diamonds I never do ask for it
73778,Kendrick Lamar,They checking my passport Im too accustomed with customs
73779,Kendrick Lamar,She callin the task force I killed it somebody cuff him
73780,Kendrick Lamar,They want me to fast forward the game and why you complain
73781,Kendrick Lamar,When you niggas is past poor Youll never hop in my lane
73782,Kendrick Lamar,When you pushing a RAV  you wrecking my Jaguar
73783,Kendrick Lamar,You play like a bad sport her feet on the dashboard
73784,Kendrick Lamar,Hol up  hol up  hol up  hol up 
73785,Kendrick Lamar,Hol up  hol up  hol up  hol up 
73786,Kendrick Lamar,Yeah big shit poppin everybody watchin
73787,Kendrick Lamar,When you do it like this nigga losing aint an option
73788,Kendrick Lamar,Hol up  hol up  hol up  hol up 
73789,Kendrick Lamar,Hol up  hol up  hol up  hol up 
73790,Kendrick Lamar,Yeah big shit poppin everybody watchin
73791,Kendrick Lamar,When you do it like this nigga
73792,Kendrick Lamar,I wrote this record while thirty thousand feet in the air
73793,Kendrick Lamar,Stewardess complimenting me on my nappy hair
73794,Kendrick Lamar,If I can fuck her in front of all of these passengers
73795,Kendrick Lamar,Theyll probably think Im Osama
73796,Kendrick Lamar,The plane emergency landed it was an honor
73797,Kendrick Lamar,Gather around Im glad everybody came out tonight As we stand on our neighborhood corner know that this fire thats burning represents the passion you have Listen Keisha Tammy come up front I recognize all of you Every creed and color With that being said   fuck your ethnicity You understand that We gon talk about a lot of shit that concerns you All of you   
73798,Kendrick Lamar,Now everybody throw your hands up high
73799,Kendrick Lamar,If you dont give a fuck throw your hands up high
73800,Kendrick Lamar,Now I dont give a fuck if you
73801,Kendrick Lamar,Black White Asian Hispanic goddammit
73802,Kendrick Lamar,Fire burning inside my eyes this the music that saved my life
73803,Kendrick Lamar,Yall be calling it hip hop I be calling it hypnotize
73804,Kendrick Lamar,Yeah hypnotize trapped my body but freed my mind
73805,Kendrick Lamar,What the fuck is you fighting for Aint nobody gon win that war
73806,Kendrick Lamar,My details be retail man I got so much in store
73807,Kendrick Lamar,Racism is still alive yellow tape and colored lines
73808,Kendrick Lamar,Fuck that nigga look at that line its so diverse
73809,Kendrick Lamar,They getting off work and they wanna see Kendrick
73810,Kendrick Lamar,Everybody cant drive Benzs and I been there so I make it my business
