,artist,text
62527,Joey Bada,Thought cause we was cool before that we gon take yo ass on tour 
62528,Joey Bada,Fuck nah this my chance to get it
62529,Joey Bada,How you entitled to my shine Nigga you aint help me get it
62530,Joey Bada,Now these niggas see me getting it check the statements on my debit
62531,Joey Bada,My profile get requested but I never hit  accept 
62532,Joey Bada,Hit the sour to the chest I reflect
62533,Joey Bada,When I was fourteen up late eyes glued to the sampler screen
62534,Joey Bada,Eyes beam cause we can make it better
62535,Joey Bada,Smoking on that Jack Herer welcome to the Progressive Era
62536,Joey Bada,Suspect niggas dont come outside
62537,Joey Bada,You might get your wig pushed back tonight
62538,Joey Bada,Brains dont matter if your wig get split on some third eye shit
62539,Joey Bada,Suspect niggas dont come outside
62540,Joey Bada,You might get your wig pushed back tonight
62541,Joey Bada,Cause I deserve my respect
62542,Joey Bada,And brains dont matter but tell me what really matters
62543,Joey Bada,When you pissed off at the world like you got a crazy bladder
62544,Joey Bada,And momma always said that shit dont come on silver platters
62545,Joey Bada,So I gather my thoughts and make use of all these synonyms
62546,Joey Bada,Cause I could never swallow the truth like its cinnamon
62547,Joey Bada,The sinning men in my hood could leave a nigga quivering
62548,Joey Bada,Like goddamn deliver him the venom and his liver is
62549,Joey Bada,Corrupting all his ligaments
62550,Joey Bada,Now hes at a standstill so tell me if hell live again
62551,Joey Bada,The fire in his heart still seem to be simmering
62552,Joey Bada,Now take that little simmer and turn it into adrenaline
62553,Joey Bada,Penicillin could not stop the drive he be giving em like mad fours
62554,Joey Bada,But fast forward lets get to the part where his records
62555,Joey Bada,Could ford him a couple Fords like  Lord aint he gifted  
62556,Joey Bada,Christmas just doesnt fit him I need my own holiday
62557,Joey Bada,And by the way Imma possibly own Monopoly
62558,Joey Bada,And all McDonalds property cause I wont live in poverty like
62559,Joey Bada,Suspect niggas dont come outside
62560,Joey Bada,You might get your wig pushed back tonight
62561,Joey Bada,Brains dont matter if your wig get split on some third eye shit
62562,Joey Bada,Suspect niggas dont come outside
62563,Joey Bada,You might get your wig pushed back tonight
62564,Joey Bada,Brains dont matter if your wig get split on some third eye shit
62565,Joey Bada,In the clouds come and find me son Im flier than Hermione
62566,Joey Bada,Homie tripping got em sounding like Hansen in the nineties
62567,Joey Bada,Charlie Manson your whole body cause that damage in your party
62568,Joey Bada,Can you manage what Im dishing out Go get your wishing count
62569,Joey Bada,You sell me something then I flip that amount
62570,Joey Bada,I just switched that account get that profit then Im out
62571,Joey Bada,Yeah they all wonder but its Nyck bitch dont doubt
62572,Joey Bada,Rip your lips off your mouth
62573,Joey Bada,Man Im violent ring the siren with these bars Im reciting
62574,Joey Bada,Hard man Im feeling like a spartan with a trident
62575,Joey Bada,Damn picture perfect bet Ill make that picture worth it
62576,Joey Bada,Ill be doubling my spot no Louisiana Purchase
62577,Joey Bada,So declare that with my hair back
62578,Joey Bada,You want a fair one catch a fair smack
62579,Joey Bada,So pray I aint hunting on your ass today like be afraid
62580,Joey Bada,Suspect niggas dont come outside
62581,Joey Bada,You might get your wig pushed back tonight
62582,Joey Bada,Brains dont matter if your wig get split on some third eye shit
62583,Joey Bada,Suspect niggas dont come outside
62584,Joey Bada,You might get your wig pushed back tonight
62585,Joey Bada,Cause I deserve my respect
62586,Joey Bada,Brains dont matter if your wig get split on some third eye shit
62587,Joey Bada,Cool cuts flow the deli cant touch this
62588,Joey Bada,Slipping like fishes choking when you hit the cypher
62589,Joey Bada,And I aint talking weed smoke but I let the weed blow
62590,Joey Bada,Anything just let the leaves know oh
62591,Joey Bada,Suckas fuck around get clapped where you rest at
62592,Joey Bada,Nigga saying you cracking fire break you imagination
62593,Joey Bada,Its assassin when I come up on the track
62594,Joey Bada,Its a curse that I always try to find sex in these verses
62595,Joey Bada,But I got your attention its part of my ascension
62596,Joey Bada,But if I keep toking this strain
62597,Joey Bada,Its gonna leave me stranded in this dimension
62598,Joey Bada,Or to mention niggas is snitching
62599,Joey Bada,Might charge me with battery
62600,Joey Bada,But fuck that cause piss was never in your anatomy
62601,Joey Bada,So dont try to lie on a nigga that got mine on my third eye shit
62602,Joey Bada,Suspect niggas dont come outside
62603,Joey Bada,You might get your wig pushed back tonight
62604,Joey Bada,Brains dont matter if your wig get split on some third eye shit
62605,Joey Bada,Suspect niggas dont come outside
62606,Joey Bada,You might get your wig pushed back tonight
62607,Joey Bada,I tell you I deserve my respect
62608,Joey Bada,Brains dont matter if your wig get split on some third eye shit
62609,Joey Bada,Man Im onto higher degrees without my masters
62610,Joey Bada,I could use my words to urge into disasters
62611,Joey Bada,Niggas wanna know how my wheels keep on spinning
62612,Joey Bada,And they see we getting love cause they see the Pros is winning
62613,Joey Bada,Cause we giving love back so they peeping how we fitting
62614,Joey Bada,Aint gonna have no sus nigga stepping to me
62615,Joey Bada,I like to keep my chakras open so respect my G
62616,Joey Bada,I got the bush going in repping FPT
62617,Joey Bada,So sus niggas watch your back Pros next to me
62618,Joey Bada,I got Chuck on the team to collect the green
62619,Joey Bada,And show these suspect niggas what it mean to scheme
62620,Joey Bada,Another apex predator crushing your dreams
62621,Joey Bada,Gonna get your wig pushed back between my cream
62622,Joey Bada,Taking all you sus niggas throw you out the scene
62623,Joey Bada,Im taking all you sus niggas throwin out the scene
62624,Joey Bada,Taking all you sus niggas throw you out the scene
62625,Joey Bada,Suspect niggas dont come outside
62626,Joey Bada,You might get your wig pushed back tonight
62627,Joey Bada,Brains dont matter if your wig get split on some third eye shit
62628,Joey Bada,Suspect niggas dont come outside
62629,Joey Bada,You might get your wig pushed back tonight
62630,Joey Bada,Brains dont matter if your wig get split on some third eye shit
62631,Joey Bada,The P the R the O the Dette
62632,Joey Bada,Never am I vexed Im always calm cool collect
62633,Joey Bada,Unless you disrespect I wreck you verbally
62634,Joey Bada,So expect the worst from me I beck you with my intellect
62635,Joey Bada,You best be circumspect check made you making all the wrong moves
62636,Joey Bada,Do I intimidate you or more infuriate you 
62637,Joey Bada,Cause I annihilate all who participating for the gore
62638,Joey Bada,Lovers I decapitate with everything I say see
62639,Joey Bada,Come sneak a peak and tell me what you peeping
62640,Joey Bada,Then struggle to say it aint greatness that you seeing
62641,Joey Bada,It is what here sits in the midst of us yeah its quite mysterious
62642,Joey Bada,No youre not delirious Im serious its clear to us
62643,Joey Bada,Add some crystals gonna see gold
62644,Joey Bada,Then platinum seen it on some tarots before
62645,Joey Bada,So I know how it is all gonna go down
62646,Joey Bada,Gotta go more uptown more in the cloud
62647,Joey Bada,Cause didnt ya know by now Im skyline bound
62648,Joey Bada,And my times now I dont graze ground Im new in your town
62649,Joey Bada,So assume what you please but you dont know me
62650,Joey Bada,Say what you please but you dont know Tnah
62651,Joey Bada,Suspect niggas dont come outside
62652,Joey Bada,You might get your wig pushed back tonight
62653,Joey Bada,Brains dont matter if your wig get split on some third eye shit
62654,Joey Bada,Suspect niggas dont come outside
62655,Joey Bada,You might get your wig pushed back tonight
62656,Joey Bada,Brains dont matter if your wig get split on some third eye shit
62657,Joey Bada,Who that mofo that came to showboat just cause he float like no other 
62658,Joey Bada,Style smooth as butter and slick like lubricant rubbers
62659,Joey Bada,So going in on tracks aint a real test the real quest
62660,Joey Bada,Is making real tracks with feelings people aint feel yet
62661,Joey Bada,Dessy be that suspect for subjects for all the records
62662,Joey Bada,Set in for all the records I spit in a split of seconds
62663,Joey Bada,So you cant reckon that I wasnt checking for beats unpleasant
62664,Joey Bada,I eat up a track and hit your producer up for seconds
62665,Joey Bada,Remember Im the face so lace me in the line up
62666,Joey Bada,The bars that I could line up could probably bump the fine up
62667,Joey Bada,Define what never can judge rap is in my blood
62668,Joey Bada,So much my capularies adapted a sanctuary
62669,Joey Bada,From the  th of January every punchline turned into crunch time
62670,Joey Bada,Was cutting records more times than my schools lunch line
62671,Joey Bada,So if this hits mine go ahead and pop your wrist fine
62672,Joey Bada,Been spitting dirty the vocals recording spit shine
62673,Joey Bada,Suspect niggas dont come outside
62674,Joey Bada,You might get your wig pushed back tonight
62675,Joey Bada,Brains dont matter if your wig get split on some third eye shit
62676,Joey Bada,Suspect niggas dont come outside
62677,Joey Bada,You might get your wig pushed back tonight
62678,Joey Bada,Brains dont matter if your wig get split on some third eye shit
62679,Joey Bada,Til the day I die Ill be puffing lye fuck the world fuck it dry
62680,Joey Bada,Tell them government spies I wont cover my eyes
62681,Joey Bada,Wont cower wont move cause I dont move like a coward
62682,Joey Bada,Knowledge is power and the flower of life is ours
62683,Joey Bada,Get as high as ours maybe you could see the towers
62684,Joey Bada,Scour your dirty mind and maybe you unleash the power
62685,Joey Bada,We all got the potential in our body and soul probably you know
62686,Joey Bada,I found mines right through the pencil started bodying flows
62687,Joey Bada,But fuck that this be the preview of primeval hip hop retrieval
62688,Joey Bada,I hold illegal like them coppers hold weasels to squeal
62689,Joey Bada,This one for my people headed to the top no redo
62690,Joey Bada,Thinking up evil but see no evil just be knievel
62691,Joey Bada,Cause I aint ask to be this good they just made me better
62692,Joey Bada,They told me cheese at the cams and they made me cheddar
62693,Joey Bada,And the green only made me clever
62694,Joey Bada,See God made three Bigs two Pacs but he only made one error
62695,Joey Bada,Suspect niggas dont come outside
62696,Joey Bada,You might get your wig pushed back tonight
62697,Joey Bada,Brains dont matter if your wig get split on some third eye shit
62698,Joey Bada,Suspect niggas dont come outside
62699,Joey Bada,You might get your wig pushed back tonight
62700,Joey Bada,Brains dont matter if your wig get split on some third eye shit
62701,Joey Bada,Im a beast with these flows
62702,Joey Bada,Two birds one stoned you get geese d when trees rolled
62703,Joey Bada,They say Im evil cause I trained my ego to see gold
62704,Joey Bada,Cause he know seagulls couldnt see these goals please
62705,Joey Bada,Its the return of the Beast Coast
62706,Joey Bada,No cash flashed but the cheese still make teeth show
62707,Joey Bada,Incognito is how you move on the strip
62708,Joey Bada,What you tryna be Vito Well theres rules to this shit
62709,Joey Bada,Dont get clapped yall aint real spitters yall lips chapped
62710,Joey Bada,Better watch it Mr Nice Watch dont risk that
62711,Joey Bada,I got a six pack of bare skill that I spill like that
62712,Joey Bada,And everybody know  that shit crack  
62713,Joey Bada,Yall niggas softspoken down below choking
62714,Joey Bada,The type to drop the soap when you soakin in front of most men
62715,Joey Bada,Theres makes sense why you want beef well this frozen
62716,Joey Bada,Its nuts for you screwed in the tool and cant hold em
62717,Joey Bada,Better shoot yourself Plaxico because Im next to go
62718,Joey Bada,The Progressive flows from New York to New Mexico
62719,Joey Bada,My lyrical span is what the fans is demandin
62720,Joey Bada,Step into my box and thats exactly whatchu stand in
62721,Joey Bada,Aint no half steppin around me
62722,Joey Bada,And you gotta drown a fish before you clown me
62723,Joey Bada,The young cop killer Im that ill so doc will ya
62724,Joey Bada,Give me two shots for  Pac killer nigga
62725,Joey Bada,Soul searchin til my flows are perfect
62726,Joey Bada,I aint tryna be a slave to grow old from workin
62727,Joey Bada,Sorry Bada   you lucky that I peeped it second
62728,Joey Bada,Tell them niggas keep it steppin with they beat selection
62729,Joey Bada,Check the melodies its so heavenly
62730,Joey Bada,That shitll get your hipster move with no  Ds
62731,Joey Bada,Audi opium can I bust soliloquies 
62732,Joey Bada,Got that shit mix and mastered both remedies
62733,Joey Bada,Grab a spoonful we sturrin up a pot
62734,Joey Bada,And you know we gotta serve it while its hot
62735,Joey Bada,Im flowin like a volcano and drippin verses off the top
62736,Joey Bada,Dirty cops still swervin on the block
62737,Joey Bada,Lookin for black kids that spittin up acid
62738,Joey Bada,Its in my jeans so dont worry what my pants is
62739,Joey Bada,Get with the script its that ignorant shit
62740,Joey Bada,And they bound to get sick of us quick but I aint sealin my lips
62741,Joey Bada,Its a shift I know you feel it man
62742,Joey Bada,We blowin up like a ceiling fan
62743,Joey Bada,Droppin off jewels like Killa Cams man
62744,Joey Bada,When it comes to kickin verses Im Mr Van Damme
62745,Joey Bada,Crushin strawberries its a jam
62746,Joey Bada,So throw up both hands if you can
62747,Joey Bada,Ironic how Im killin this shit until they bury me
62748,Joey Bada,My volume is going in depth with longevity
62749,Joey Bada,I come here today to talk about how I feel
62750,Joey Bada,And I feel like that we are treated differently than other people
62751,Joey Bada,And I dont like how we re treated
62752,Joey Bada,Just because of our color doesnt mean anything to me
62753,Joey Bada,Minds been racing so long yeah
62754,Joey Bada,And I really cant take it no more
62755,Joey Bada,Ive been fighting temptations my Lord
62756,Joey Bada, And I really cant help it 
62757,Joey Bada,I never felt selfish before
62758,Joey Bada,Ive been living so reckless I know
62759,Joey Bada,Tell me Lord can you help me 
62760,Joey Bada, I said Lord can you help me  
62761,Joey Bada,Now everybody got problems yeah
62762,Joey Bada,But wouldnt know what way to solve  em
62763,Joey Bada,I really came up from the bottom
62764,Joey Bada,Strugglin  my momma on her last dollar
62765,Joey Bada,Hustlin and I ve been puttin in these hours
62766,Joey Bada,The government been tryna take away whats ours
62767,Joey Bada,Its really all about the money and the power
62768,Joey Bada,I just wanna see my people empowered
62769,Joey Bada,Uh uh tell me how we gon shape this vision
62770,Joey Bada,Complainin all day but in the same condition
62771,Joey Bada,If you wanna make change its gon take commitment
62772,Joey Bada,Some people enslaved by they religion
62773,Joey Bada,Cant emancipate them from the mental prisons
62774,Joey Bada,What I seen through optics transform to wisdom
62775,Joey Bada,Watch me use my prophets get em all to listen
62776,Joey Bada,And I really cant take it no more
62777,Joey Bada,Ive been fighting temptations my Lord
62778,Joey Bada, And I really cant help it 
62779,Joey Bada,I never felt selfish before
62780,Joey Bada,Ive been living so reckless I know
62781,Joey Bada,Tell me Lord can you help me 
62782,Joey Bada, I said Lord can you help me  
62783,Joey Bada,Now everybody got vices yeah
62784,Joey Bada,But wouldnt know what good advice is
62785,Joey Bada,Until they leave em lifeless
62786,Joey Bada,Another mama cryin its another crisis
62787,Joey Bada,Lord knows we just tryna live righteous
62788,Joey Bada,Are you willin just to make the sacrifices 
62789,Joey Bada,I know we cant continue livin like this
62790,Joey Bada,And Ill never sell my soul cause thats priceless uh uh
62791,Joey Bada,Tell me how we gon make a livin
62792,Joey Bada,Hustle on the block who gon save the children 
62793,Joey Bada,Man its all a plot and Im just revealin
62794,Joey Bada,The media just tryna make a villain
62795,Joey Bada,I just take the pain and a paint a picture
62796,Joey Bada,Voices in my head I hear the whispers
62797,Joey Bada,When I feel this way inhale the swisher
62798,Joey Bada,And I really cant take it no more
62799,Joey Bada,Ive been fighting temptations my Lord
62800,Joey Bada, And I really cant help it 
62801,Joey Bada,I never felt selfish before
62802,Joey Bada,Ive been living so reckless I know
62803,Joey Bada,Tell me Lord can you help me 
62804,Joey Bada, I said Lord can you help me  
62805,Joey Bada,Minds been racing so long yeah
62806,Joey Bada,And I really cant take it no more
62807,Joey Bada,Ive been fighting temptations my Lord
62808,Joey Bada, I said Lord can you help me  
62809,Joey Bada,I never felt selfish before
62810,Joey Bada,Ive been living so reckless I know
62811,Joey Bada,Tell me Lord can you help me 
62812,Joey Bada, I said Lord can you help me  
62813,Joey Bada,We are black people and we shouldnt have to feel like this
62814,Joey Bada,We shouldnt have to protest because you are treating us wrong
62815,Joey Bada,We do this because we need to and we have rights
62816,Joey Bada,Check my style check check check it out
62817,Joey Bada,Check my style check check check it out
62818,Joey Bada, Check it out yall check check check check it out yall 
62819,Joey Bada,Check my style check check check it out
62820,Joey Bada,Check my style check check check it out
62821,Joey Bada, Check it out yall check check check check it out yall 
62822,Joey Bada,Check my style check check check it out
62823,Joey Bada,Fuck jumping the broom honey moons I I hit the pot
62824,Joey Bada,Soak me up like a mop know Im up know theres levels
62825,Joey Bada,Staring down at the devil hello guess I got the memo
62826,Joey Bada,Pulling strings like Geppetto you just a puppet fellow
62827,Joey Bada,I came out of the tomb don t drop a L uh
62828,Joey Bada,You dont want to see the evils which I dwell in hell
62829,Joey Bada,To excel this shit never fails always excels
62830,Joey Bada,They been swallowing sons before the double XL
62831,Joey Bada,Sex cell ex ask why it never work out
62832,Joey Bada,I guess I exercise too much when I work out
62833,Joey Bada,Shows too turnt out return home burnt out
62834,Joey Bada,Now I got to hear all the shit that you heard bout
62835,Joey Bada,Can I live What these niggas want me off a bridge 
62836,Joey Bada,If I say its turnt down do I burn that shit 
62837,Joey Bada,Truth is if it aint real I dont feel it
62838,Joey Bada,If it dont hit my spirit I dont get near it
62839,Joey Bada,And thats point blank period know some niggas that fear it
62840,Joey Bada,Same niggas who know that we the illest
62841,Joey Bada,Lines so deep a great shark is what I reel up
62842,Joey Bada,Hit the flow and it cant go realer my whole camp gorillas nigga
62843,Joey Bada, Check check check it out 
62844,Joey Bada,Check my style check check check it out
62845,Joey Bada,Check my style check check check it out
62846,Joey Bada,Check my style check check check it out
62847,Joey Bada,Check my style check check check it out
62848,Joey Bada,Check my style check check check it out
62849,Joey Bada,I stand juxtaposed to all my Pros realest illest niggas I know
62850,Joey Bada,See these foes biting the flows they even jooks the pose
62851,Joey Bada,I guess my CD really shaking the coast
62852,Joey Bada,Cause this really be the year that I feast capisce 
62853,Joey Bada,Nothing defeats the beast I speak my piece
62854,Joey Bada,Know niggas in the streets that heat seek for me
62855,Joey Bada,Might put a Halloween between your spleen
62856,Joey Bada,Retreat or trickle down to your last pound of green
62857,Joey Bada,This shit is like taking candy from the babies
62858,Joey Bada,Under these rappers is just a bunch of Now and Laters
62859,Joey Bada,They too sweet plus they lease their Mercedes
62860,Joey Bada,Cant be second greatest Im the best and def your favorite
62861,Joey Bada,My flow in depth nigga I got my wave up
62862,Joey Bada,Its either get your tidal waved or you could be my neighbor
62863,Joey Bada,Cause if I cant eat then you cant either
62864,Joey Bada,I need to know need the pizza dough fuck Im spitting ether for 
62865,Joey Bada,Reigning rap supreme in this bitch
62866,Joey Bada,Cause bitches lie niggas lie numbers too
62867,Joey Bada,Cause bitches lie niggas lie numbers too
62868,Joey Bada,Bitches lie niggas lie numbers too
62869,Joey Bada,Bitches lie niggas lie numbers too
62870,Joey Bada,What the fuck you gon do when the Era come for you 
62871,Joey Bada,Check my style check check check it out
62872,Joey Bada,Check my style check check check it out
62873,Joey Bada,Check my style check check check it out
62874,Joey Bada,Check my style check check check it out
62875,Joey Bada,Check my style check check check it out
62876,Joey Bada,Check my style check check check it out
62877,Joey Bada,Check my style check check check it out
62878,Joey Bada,Check my style check check check it out
62879,Joey Bada,And Im from the blocks where they sell
62880,Joey Bada,Cell blocks rock my mental
62881,Joey Bada,See them fake thugs that you see before cant even spell
62882,Joey Bada,My flow spill with words you can t pronounce stories you can t tell
62883,Joey Bada,Welcome back yall youre listening to WPRO Brooklyn That was  Big Dusty  the new single from Joey Bada  and I am turning on the A C cause that joint is hot Joey is here in the studio with us right now Say  Hi Joey and tell the people where you from Yeah is this mic on Oh yeah like you know Im from I come from Brooklyn New York You know I was born and raised but ah my my parents from the Caribbean You know my mas from St Lucia and my pas from Jamaica So you know I play pretty close to my roots
62884,Joey Bada,Say Brain what do you wanna do tonight 
62885,Joey Bada,The same thing we do every night Pinky
62886,Joey Bada,Try to take over the world 
62887,Joey Bada,Who the fuck is this Joey Bada  nigga son 
62888,Joey Bada,Ayo who the fuck passed you the mic
62889,Joey Bada,And said that you could flow Point em out bitch I wanna know
62890,Joey Bada,Who the fuck passed you the mic 
62891,Joey Bada,Puffin on stramonium underground like potholes but going fossil
62892,Joey Bada,These bars like art in the Smithsonian
62893,Joey Bada,These flows is for custodians homeless men horny OBGYN dudes
62894,Joey Bada,Browsing my laptop lookin at red fallopian tube
62895,Joey Bada,They like  Yo Joey you rude  Im like  If only you knew
62896,Joey Bada,Im only in school for cosmology thats why I act as lonely as you 
62897,Joey Bada,You see Im wise behind my years and my peers
62898,Joey Bada,So my voice over the snares is the only way they hear
62899,Joey Bada,What I got behind my membrane but Ive been smoking chem strains
62900,Joey Bada,So lately Ive been having hard times with remembering
62901,Joey Bada,But be patient my studies prove Egyptians aint shit
62902,Joey Bada,Cause I believe that we could be like Neo in  The Matrix 
62903,Joey Bada,But fuck it Im erratic momma lock me in the attic please
62904,Joey Bada,Til I draw enough static in my somatic anatomy
62905,Joey Bada,And come out imputed with fusions of  Blueprints and  Illmatics 
62906,Joey Bada,I ve been going raw this just how I feel rappin
62907,Joey Bada,We gave yall sur tactics so yall can t even gas us
62908,Joey Bada,We taught you how to be prepared but still attacking the masses
62909,Joey Bada,Yall better get yall caskets cause we  bout to annihilate
62910,Joey Bada, The new Babylon era My empire gate s in the Empire State
62911,Joey Bada,I m on the higher platform look at the way they clap for  em
62912,Joey Bada,Never fuck with phony men cause I don t like my back torn
62913,Joey Bada,Nigga ask Kwon this that top ramen you ain t used to
62914,Joey Bada,Keep it neutral to scruple and tell  em no beef like noodles 
62915,Joey Bada,Keep it neutral just so you can scruple
62916,Joey Bada,I tell  em no beef like noodles
62917,Joey Bada,It s world domination nation you re tuned into my station
62918,Joey Bada,Always got a doobie and a motherfucking eighth lit
62919,Joey Bada,Always got the trees so what the fuck you mean
62920,Joey Bada,I ain t about to rise to the top with my fucking team
62921,Joey Bada,Ayo who the fuck passed you the mic
62922,Joey Bada,And said that you could flow Point em out bitch I wanna know
62923,Joey Bada,Who the fuck passed you the mic 
62924,Joey Bada,Ayo who the fuck passed you the mic
62925,Joey Bada,And said that you could flow Point em out bitch I wanna know
62926,Joey Bada,Who the fuck passed you the mic 
62927,Joey Bada,Microphone microphone check
62928,Joey Bada,Will I see you through my hazeus view 
62929,Joey Bada,Will I see you through my hazeus view 
62930,Joey Bada,Will I see you through my hazeus my hazeus my hazeus
62931,Joey Bada,You aint running with the apes yet apex at the Empire State neck
62932,Joey Bada,Hand no crown my niggas take that
62933,Joey Bada,In this state of mind gotta state facts suspect nigga
62934,Joey Bada,Get your wig pushed back tonight to     
62935,Joey Bada,Whodve thought that   I might be in my prime 
